,teacher_id,alpha_index,batch_id,scrape_date,scrape_status,teacher_name,location,followers,languages,date_joined,about,image_url
14000,thesoulfulentrepreneur,s,141,2022-12-12 07:54:10.310984,name found,Stella Habib,,34 followers,English,Joined in Jan 2021,"Stella is an Intuitive Strategist and Founder of The Soulful Entrepreneur where she empowers entrepreneurs to build their businesses through intuitive coaching, embodied branding and holistic business strategy. Across all of her offerings she is passionate about guiding people to tap into the transformative power of their intuition to create a life they love. As a meditation guide, Stella holds supportive space for people to practice the art of stillness amidst the busyness of their lives....read more",https://users.insighttimer.com/H2xlXhpuhGOPwj7JNqDlkOv6YX72/pictures/square_medium.jpeg
14001,theselfclub,s,141,2022-12-12 07:54:31.385552,name found,Samantha Sacchi,"Melbourne, Australia",34 followers,English,Joined in Nov 2020,"The Self is your masterpiece, your tool for life and growth. You create and discover it simultaneously from a place of acceptance, love, and curiosity. So your whole, authentic self can come out. That's what Samantha has been doing her whole life and that's what she offers you - the tools, spaces,​ and experiences to do just that. She brings forward her rich background in emotional intelligence, leadership development and spirituality to create a deep, beautiful relationship with your own Self.  ...read more",https://users.insighttimer.com/M2t1y5d6J1a2q3R8Y7E4t9J1H9M8W0A4B0H5M2u3G8y3j1f2N7p3P5e1U3v7J9f6u6A8w4J5N3N7R1t1R1h6y9C4r6F8x3V9X1m8/pictures/square_medium.jpeg
14002,pub1229033,s,141,2022-12-12 07:54:54.716880,name found,Sara Liddle,"London, UK",34 followers,English,Joined in Apr 2021,"Sara is a certified professional coach, she works with individuals and couples supporting them to build and create a healthy relationship in which they can thrive and will bring joy and happiness into their lives. Sara is a very intuitive coach and described by clients as radiating great calm and care, open-mindedness, authenticity and fun. She is an incredibly powerful coach free of judgement, she is knowledgeable, caring and intuitive. ...read more",https://users.insighttimer.com/R2x5A3y4Y4a6J4e3H6p7c1y2G7X4m9S9t6X7G5t9r7m8w2s5n8Z8h0K9T8w0x1W9V6S3u9x1J0b9p4b0F9S4J9A2n0u6W2Y2L4K3/pictures/square_medium.jpeg
14003,skotttaylor,s,141,2022-12-12 07:55:18.410473,name found,Skott,"Waiheke Island, New Zealand",34 followers,English,Joined in Mar 2020,"Skott is an experienced facilitator, public speaker, actor, trainer, musician, explorer and director with a demonstrated history of working in the management consulting industry. He designs and delivers workshops for a wide range of audiences that engage, drive action from participants, and create alignment....read more",https://users.insighttimer.com/q0a9h8A2v7C5E8M7r9Y1j3W5G3e1S4M6s9u6g0M1Z0J3s1N4x1N4C6n8H5v9T2A4w8q0m6D2F4e9f9S4W5F6h6F7A9A8v5H0p3C0/pictures/square_medium.jpeg
14004,saraafonso,s,141,2022-12-12 07:55:43.414411,name found,Sara Afonso,,34 followers,Français and English,Joined in Jul 2021,"Sara Afonso is a French composer and sound designer. She makes music and sound design for movies and video games. Since practicing meditation, she also creates meditative music and relaxing atmospheres.",https://users.insighttimer.com/IVddNvyqGnVLTRW86bibSYieHGs2/pictures/square_medium.jpeg
14005,mindfulgoddess,s,141,2022-12-12 07:56:02.997694,name found,Sam Wilson,"Southwell, UK",33 followers,English,Joined in Feb 2021,"Living Life with Passion, Pleasure & Purpose 
Sam Wilson guides and supports women into their bodies and out of their heads.
As a Mindful Goddess Teacher and Female Empowerment Coach, she creates and holds a safe container for you to uncover your deepest and juiciest desires for your life, as we heal the woman and awaken the Goddess....read more",https://users.insighttimer.com/qeft5WU39JguqOoneBfqLpt8MV92/pictures/square_medium.jpeg
14006,sanda.life,s,141,2022-12-12 07:56:11.842853,name found,Sanda Diviricean,,33 followers,Română,Joined in Jun 2021,"Psychologist and Psychotherapist
Motivational Speaker
MIND & BODY 
Personal development trainer
Mindfulness & Meditation
Women's Renaissance program coordinator 
@sanda.life instagram blog",https://users.insighttimer.com/RKn4ebPU1mQxowKNk2kOnntAnDh2/pictures/square_medium.jpeg
14007,susanengelhardt,s,141,2022-12-12 07:56:18.813899,name found,Susan Engelhardt,"Utrecht, Netherlands",33 followers,Nederlands,Joined in Mar 2019,"Susan richt zich op mindfulness voor drukke (werkende) ouders. Ze kent de uitdagingen van een druk gezinsleven met jonge kinderen. Susan vertaalt de mindfulnessoefeningen naar alledaagse momenten, zodat je de oefening kunt verweven in je drukke dag. Bouw bewuste momenten in je dag, elke dag opnieuw. Het helpt je om kalm te blijven, doordachte keuzes te maken. Ervaar meer rust en plezier in het spitsuur van je leven. ...read more",https://users.insighttimer.com/n7h1A0V6r6A3R6Y3B7Y2c0F8E4x8K1q5x5Y2y1W4k4R1G2P8t0S2L5Q8m8w1k7z4A1K6e3E4H9V1M3U2u7r7d5h6N5P6z7K8y7K3/pictures/square_medium.jpeg
14008,sweetsoulsconnection,s,141,2022-12-12 07:56:42.317747,name found,Sarah Anderson,,33 followers,English,Joined in Nov 2021,"Sarah is a Chopra Certified Meditation Instructor and is in training to be a Therapeutic Touch Practitioner. Over the past two decades she's worked as a business owner/entrepreneur in the field of photography and journalism. In the last few years Sarah's focus has shifted from busy outward activity, towards the stillness and calm of looking inward in order to create a more balanced life. Her current goal is to share this found inner peace and self love with as many people as possible through meditation....read more",https://users.insighttimer.com/WhRiUNlQTMaKwQGYC5XpA7wDtjA3/pictures/square_medium.jpeg
14009,skanfoush,s,141,2022-12-12 07:57:07.552147,name found,Sharon Kanfoush,"New Hartford, NY, USA",33 followers,English,Joined in Jun 2021,"Sharon is a meditation teacher, yoga teacher & yoga therapist, and somatic movement & posture specialist with extensive experience teaching Resilience Meditation & Yoga in the Kripalu-Infinite Light lineage and somatic movement body-mind modalities integrating the techniques of Frederick Alexander, Moshe Feldenkrais, and Thomas Hanna with various practices of pranayama and meditation....read more",https://users.insighttimer.com/Pf8n1Taoo1M3wLiBLn5R1PLbiuF2/pictures/square_medium.jpeg
14010,solange_caviezel,s,141,2022-12-12 07:57:15.225510,name found,Solange Caviezel,Bern,33 followers,Deutsch and English,Joined in Aug 2021,"„Erkenne was du alles nicht bist, um zu erkennen, wer du wahrhaftig bist“; in diesem Sinne, bringt Solange Bewusstsein & Klarheit in das Energiefeld. Sie ist eine Wahrheitssucherin und darin offenbart sich, was in die Heilung geführt werden darf. Mit ihrer hohen Sensitivität hilft sie Menschen in tiefem Mitgefühl und Ehrlichkeit, das zu sehen, was tief in ihnen steckt. Die Meditationen sind nur ein kleiner Teil ihrer Arbeit, denn sie ist Therapeutin für Traumatologie & verkörpertes Bewusstsein....read more",https://users.insighttimer.com/j5L3G4M7a2x4Y5T0y9f7L5P6K8d2w4k4d3h3R2w3L6f1f2m3h6b1G5m9g4G0c1W0e8A4K4f0Z5f2B3d5e8H6G6L3M5p4t0g4j1u7/pictures/square_medium.jpeg
14011,sethyogamusic,s,141,2022-12-12 07:57:39.520800,name found,Seth Lieberman,"Kingston, NY, USA",32 followers,English,Joined in Jun 2021,"Seth Lieberman is a classically trained musician and yoga teacher (RYT 500). He brings his refined music making to the yoga world through kirtan, guided meditations and yoga accompanied by his own live music, and through harmonium classes and private sessions. He brings his extensive training and experience teaching yoga to his classes, which are rooted in philosophy, anatomy, sanskrit, and mantra. He plays the piano, harmonium, clarinet, saxophone, guitar, sings and writes original music....read more",https://users.insighttimer.com/we1cGPJOpqcVmg7s88tPj9cj0Hu1/pictures/square_medium.jpeg
14012,shannonbrechtel,s,141,2022-12-12 07:58:02.939531,name found,Shannon B Yoga,"Annapolis, MD, USA",32 followers,English,Joined in Jan 2020,"Shannon is a 500 RYT and Advanced Yoga Nidra Facilitator, trained by Kamini Desai PhD, in the Amrit Method of Yoga Nidra. She is also trained in trauma-informed yoga through the Bodywise Institute and Yoga for 12 Step Recovery. Shannon has been working in the field of mental health and addiction recovery, as a yoga instructor and meditation facilitator since 2013.  ...read more",https://users.insighttimer.com/P8R1A9R9s6n9V6r1L6W2d2T8u5W8d5k6M8p1w2Y9G6F2F4e0N9b7f9p3k0m9p0M4S6T2W0q0L2N1R7H1N5S3m6A1q8N4e3s6W7H8/pictures/square_medium.jpeg
14013,themeditatedfoodie,s,141,2022-12-12 07:58:27.700496,name found,Samira Jones,"St. Louis, MO, USA",32 followers,English,Joined in Sep 2022,"As an advocate & fellow Warrior of Anxiety & Depression, Samira has found a taste of solace in healthier cooking & Meditation. She uses her certification as a Meditation Coach to stand as a vessel for those who may need a helping hand in nourishing their minds, bodies, and spirits within their healing journey....read more",https://users.insighttimer.com/bzHXi7nrN0NT4lgoOHip5Urzoek2/pictures/square_medium.jpeg
14014,sanahara,s,141,2022-12-12 07:58:51.284453,name found,Sanahara Ama Chandra,,32 followers,English,Joined in Mar 2022,"Usui Reiki Master, Sound Healer, and Holistic Nurse Sanahara Ama Chandra has a lifelong relationship with sound. From her roots in Southern Gospel and 90's R&B to her journeys through World music, Neo-Soul, Jazz, and Songwriting, her heart and soul have shared the healing power of music. On her path of seeking, she has acquired many skills and experiences and brings to her work an embodied expression of emotion, healed trauma, and unconditional love....read more",https://users.insighttimer.com/z2e5t4b3W6a0V4x7e5n4y2n4R1n1q4q3q2H3c1X8n6x4M9L1A2u5f2Z8g3m9S3j3k1z0Z5b1E9f7f0u4s1H7m7q0A3M4q5D4t4R6/pictures/square_medium.jpeg
14015,sanshpil,s,141,2022-12-12 07:59:14.715936,name found,Sandra Shpilberg,"Palo Alto, CA, USA",32 followers,English,Joined in Aug 2020,Sandra Shpilberg is an entrepreneur and the author of the bestselling and award winning book New Startup Mindset: 10 Mindset Shifts to Build the Company of Your Dreams. Meditation and mindfulness have been key building blocks to her success and fulfillment and she shares these teachings in the hopes that they can help others on their journey to service and peace....read more,https://users.insighttimer.com/K7a2z3A2E0S9s4g0B6w5b2V9d2f8s2T6R8T4F4b4h8y3u9u3Z8k3H7m7m7e3g7H9D8D0D4V7U1j3U0c3b1J9W9F7p1P7U8h1N7K8/pictures/square_medium.jpeg
14016,stephlei,s,141,2022-12-12 07:59:38.127341,name found,Steph Leighton,"Auckland, New Zealand",32 followers,English,Joined in Sep 2020,"Steph is a yoga teacher inspired to help people become more embodied, present and aware. Her yoga nidras will drop you into a state of stillness and leave you feeling calm and connected.",https://users.insighttimer.com/h3d8Z2S0Q1E5g4L0p8j9d0F4d5V2P8g9s2J4T7U5X9N4u0K9f7j5W8e4v1g9q4A5Q1Q5s1H2v8e9t8V5J2j2G5X1Q0g9L6z0F4Q0/pictures/square_medium.jpeg
14017,telltaleswithsri,s,141,2022-12-12 08:00:01.544432,name found,Sri Ghimire,"Melbourne, Australia",32 followers,English,Joined in Apr 2020,"I am Sri. I have been on a spiritual journey for the last 5 years and have been meditating for more than 15 years. I recently started a podcast to share my life experiences to help people live a more purposeful life. Follow me on Insight Timer for mindful meditation sessions, talks on conscious living, and overcoming daily stress. ...read more",https://users.insighttimer.com/h2x0U3q8M7r5X2r9q6K5P4x0a8S0a2L8z1e4F5F6a2L1v3c8z2c6T8b5d0p5M3k5J5L6A7H0Y0V7j1t3R3y5U4t8m1r7w2q5Z6j3/pictures/square_medium.jpeg
14018,sarahhayesyoga,s,141,2022-12-12 08:00:24.953177,name found,Sarah,"Port Lincoln, Australia",32 followers,English,Joined in Apr 2021,"Here to guide you back home to your body, your self, and earth. I’m an ecologist-turned-yoga teacher who weaves science and spirituality, East and West, movement and mindfulness. Join me for breathwork, meditation, and ceremony. Every inch of your being is welcome....read more",https://users.insighttimer.com/Q6D0Z5H8E7w0y3f3D4Y7t5N4y6G3b3U8n6q2X2r1r6T5r1U6Y2h3x3h3F5k5S9e4r1m5Z3H0r5w1T5w1J7H7M6j0M7h4r3T6R2f1/pictures/square_medium.jpeg
14019,shanna_hughes,s,141,2022-12-12 08:00:32.879488,name found,Shanna Hughes ,"California, USA",32 followers,English,Joined in May 2020,"For the first fifteen years of her life, Shanna lived in Kashmir, India, where her parents studied yoga and meditation under the guidance of a world-acclaimed philosopher and Kashmir Shaivite saint. By joining these classes from childhood, Shanna learnt, at an early age, the healing power of meditation and yoga.
 
Shanna is a certified yoga therapist and is currently a Senior Lecturer of Yoga Studies for the Undergraduate Dance Department at Loyola Marymount University (Los Angeles). ...read more",https://users.insighttimer.com/A1N2E0R2u5C7m4x1s7R0k2L0B0R1d0R0f9Z1h7k0a7n8A4n2k9P9T3G8V1P0G5C5H4K7L5K5q0A3r3u3f3t5h9a7C1n0k1U0N9V5/pictures/square_medium.jpeg
14020,saintsteph,s,141,2022-12-12 08:00:56.901700,name found,Steph St. Amand,,32 followers,English,Joined in Apr 2022,"Steph St. Amand is an award-winning, international best-selling author, international speaker, master of Prayer Treatment and Cultivator of Radical Joy​.  As a Spiritual Healing Practitioner and Ordained New Thought Minister, they support people in co-creating a healthy, vibrant and radically joyful life.  Rev. Steph's passion is to be in the Presence of Oneness and to know a greater Truth for the world....read more",https://users.insighttimer.com/lWqVHNCg2GWOFSBgyYLI9yaLZDD3/pictures/square_medium.jpeg
14021,shawna,s,141,2022-12-12 08:01:20.696605,name found,Shawna Turner,,32 followers,English,Joined in Jun 2022,Shawna is a yoga teacher and teacher trainer.  She runs a 200hr training called Yoga School as well as a yin yoga and mindfulness program.  She believes in the healing capacities embedded in the practice of yoga and meditation and can be found teaching in person in Toronto Canada as well as online....read more,https://users.insighttimer.com/c3H0T4Q7R3E5n4d7n1Q2w6u3c2T1Z4u6L4H6E9Q6c3v9r8X1U7S1j6a6X4J4U9Z9Q9v3T2w7F0U0C1U1D6B4m0m5z3Y2u2v8C7c6/pictures/square_medium.jpeg
14022,saracyr,s,141,2022-12-12 08:01:44.198436,name found,"Sara Cyr, CHC","Hopedale, MA, United States",32 followers,English,Joined in Sep 2022,"Sara Cyr, CHC sparked her own healing powers with deep relaxation & visualization 16+ years ago. Sara helps you relax and connect to nature with her meditations so you can be the next healthiest and happiest version of yourself. 

She coaches people to build consistency in many areas of health such as building morning/sleep routines, shifting out of stress, losing weight and solidifying sleep. 

She lives the beach life under the Southern moon & stars with her husband and three teens in SC....read more",https://users.insighttimer.com/r4A8K6G0y8P7R6a5q8H5n2s2k7y3y2B6V0A8T6n2T4B2U5Q5n4p0y9X9m7P1h2H9u2C5D1E7H0X8M8t9Y0S4Z1B3d7M3P4G5v9Z2/pictures/square_medium.jpeg
14023,soniabestulic,s,141,2022-12-12 08:02:07.941195,name found,Sonia Bestulic,,31 followers,English and Italiano,Joined in Dec 2021,"Sonia Bestulic is renowned as an innovative, creative, socially conscious entrepreneur; empowering positive change. An award-winning author of children and adult books; she is an advocate for positive family health. Sonia is on a mission for mothers to thrive and flourish throughout the world. She combines real-world experience having worked with thousands of mothers and their children, within her Speech Pathology practices, together with her own lived motherhood, raising three children (all born in 2 ½ years!). Her mothers' wellness empowerment work is inspired by her latest bestseller; Flourish for Mums 21 ways to thrive with self-care and acceptance....read more",https://users.insighttimer.com/HxkH5VY8qYMvp1OjfI7EE2fpYcI2/pictures/square_medium.jpeg
14024,scottvtusa,s,141,2022-12-12 08:02:31.412624,name found,Scott Tusa,,31 followers,English,Joined in Jun 2022,"Scott Tusa is a Buddhist meditation teacher who has spent the last two decades exploring what it means to awaken the heart through the Buddhist path. Ordained by His Holiness the Fourteenth Dalai Lama, he spent nine years as a Buddhist monk, with much of that time engaged in solitary meditation retreat and study in the United States, India, and Nepal. Scott currently teaches meditation internationally in group and one-to-one settings....read more",https://users.insighttimer.com/ksRHU4Fq51bIVqiUZpEDJronoYZ2/pictures/square_medium.jpeg
14025,sarahgrynberg,s,141,2022-12-12 08:02:55.793222,name found,Sarah Grynberg,,31 followers,English,Joined in Jul 2022,"Sarah Grynberg’s passions lie in teaching people of all ages how to adopt the habits and strategies of life’s greatest leaders – to help them live their most inspired lives. 
Sarah is the current host of one of Australia’s most top-rated self- improvement podcasts, A Life of Greatness. It is here where she’s personally interviewed some of the world’s biggest celebrities: including Matthew McConaughey, Wim Hof, Jay Shetty, Daniel Ricciardo, Simon Sinek, Sadhguru, Dr Joe Dispenza, Robin Sharma, Dr Gabor Mate, Mark Manson, Tara Brach as well as many others. 
Through her decades of experience and her own ongoing research studying the lives of the world's most influential people, she has formulated her own blueprint to achieving greatness. Via these practices and techniques, her ultimate goal is to impart this wisdom and knowledge via her talks, podcasts, books & tv to anyone who may need it, so they too can lead their own lives of greatness....read more",https://users.insighttimer.com/OwUCuf0MWTYoQxiI7IdCdnycYHg1/pictures/square_medium.jpeg
14026,suzanwolf,s,141,2022-12-12 08:03:15.902042,name found,Suzan Wolf,"Heidelberg, Germany",31 followers,Deutsch and English,Joined in Sep 2021,"Suzan Wolf ist Psychologin (M.Sc.) und zertifizierte Lehrerin für MBSR (Mindfulness-based Stress Reduction). Sie hat an den Universitäten Mannheim und Exeter Psychologie studiert und sich auf Achtsamkeit spezialisiert. Nach der Arbeit in der Unternehmensberatung im Bereich Team- und Führungskräfteentwicklung hat sie 2020 ihre Berufung zum Beruf gemacht. Inzwischen begleitet sie als zertifizierte MBSR-Lehrerin und Achtsamkeitstrainerin Privatpersonen und Unternehmen. In ihren Trainings arbeitet sie mit zentralen Methoden und Modellen aus der Psychologie und Neurowissenschaft, die sie mit einer gelassenen und klaren Art vermittelt und anwendet....read more",https://users.insighttimer.com/dOQRv2iH00WflKTc2rMnmgTrENn1/pictures/square_medium.jpeg
14027,sbroucek,s,141,2022-12-12 08:03:41.126068,name found,Shahnaz Broucek,"Canton, MI, USA",31 followers,English,Joined in Oct 2020,"Shahnaz Broucek is a Certified Trainer for the Search Inside Yourself Leadership Institute (the Mindfulness & EQ program developed at Google), Executive Coach and Founder of OptimizeU Leadership Coaching, and a faculty member at the University of Michigan Ross School of Business.  Shahnaz is currently a Mindful Self-Compassion teacher-in-training (Neff, Germer).  ...read more",https://users.insighttimer.com/E5c0x9K6D6j9L8f8W6M7V7F1D6A4C9v4D6E3u2k0M1w2t9H9W1G2U5d2K2Y2T7u2M9v0h4R7E1q4S2c9R7j4N4u3K9j2d2h5f2Q7/pictures/square_medium.jpeg
14028,les_meditations_de_sarah,s,141,2022-12-12 08:04:06.786888,name found,Sarah Bellini,"Bouches-du-Rhone, France",31 followers,Français,Joined in Jun 2021,"Cela fait deux qu'elle consacre sa vie à l’apprentissage du Reiki, la méditation et d'autres soins énergétiques. De rencontres en lectures, de formations en voyages, elle a accompli un chemin spirituel, guidée par ses anges et guides accompagnateurs, elle vous propose des méditations guidées pour ouvrir vos centres énergétiques, vos chakra.
Aujourd’hui, elle à cœur de vous aider à retrouver la lumière qui est en vous,  développer votre intuition et vous reconnecter à votre monde merveilleux....read more",https://users.insighttimer.com/h8ymLpfoLuggZwMActr0plra6ei1/pictures/square_medium.jpeg
14029,sarahmaloneyoga,s,141,2022-12-12 08:04:32.529371,name found,Sarah Malone,"Margaret River WA, Australia",31 followers,English,Joined in Oct 2020,"Yoga, Meditation, and Wellness teacher

I invite you to take an opportunity today to press pause and create some space for your mind and body to settle and reboot. This may be at the start of your day, during your day, or at the end of your day to help you unwind and sleep deeply.
⁣...read more",https://users.insighttimer.com/AHi0flOREPUtUpCRyytjTZeRRpH3/pictures/square_medium.jpeg
14030,samanthaheaney,s,141,2022-12-12 08:04:55.881560,name found,Samantha Heaney,"Ayr, UK",31 followers,English,Joined in Jun 2020,"Through my work as an intuitive energy coach, i love bringing in guided meditations to help people feel more calm, more connected and send healing to themselves. I now want to share what i love to you all here too. Meditation has been one of the wonderful tools i use daily and helped me through my own personal journey, suffering from anxiety and PCOS....read more",https://users.insighttimer.com/w0A6z7M7L4U9R2M0r0q4V0b3z1w3z3p1d6M7w3N4S0u4G8a8D0S8a7h3P5T1k7N7f2J3B2S5H4e4d5u8H8Y8x5h5x7m5U5F1P2z3/pictures/square_medium.jpeg
14031,seangrabowski,s,141,2022-12-12 08:05:19.140810,name not found,,,,,,,
14032,zuluisms,s,141,2022-12-12 08:05:41.873352,name found,ShaKara Zulu,,29 followers,English,Joined in Nov 2021,"ShaKara is a spiritual & mental wellness content creator. With a yoga practice that extends far beyond asanas. This space is for spiritual and mental wellness for anyone building a dream. Massage the mind. Manifest your deepest desires! High vibes, for always....read more",https://users.insighttimer.com/o54gwbEzZcRLp11CO6ShcgPV10D3/pictures/square_medium.jpeg
14033,sanaholistic,s,141,2022-12-12 08:06:05.619724,name found,Sana Holistic,,30 followers,English,Joined in Nov 2021,"Sana is a certified Sound Therapist, Reiki Master, and Meditation teacher. Sana practices these energy healings with her clients at her South London clinic and holds regular group meditation/sound baths in London too. Sana also facilitates virtual/live sessions for corporate wellness days, bringing a new dimension to employee wellbeing....read more",https://users.insighttimer.com/wjEs0c8ZvDbNVvarDdFZMaAzR2E2/pictures/square_medium.jpeg
14034,sabinakipra,s,141,2022-12-12 08:06:30.331810,name found,Sabina Kipra,"Zürich, Switzerland",30 followers,Deutsch,Joined in Nov 2019,"Seit meiner Ausbildung zum Dipl. Entspannungs- und Mentaltrainer verspüre ich den großen Drang, anderen Menschen zu helfen. Mein Ziel ist es die Teilnehmenden zu fördern in ihrem Denken und in ihren Ansichten neue Wege zu ermöglichen. Durch geführte Entspannungslektionen lernst du bewusster, auf deine Gedanken zu achten, dich in deiner Selbstwahrnehmung zu schärfen und ein neues Gefühl der inneren Gelassenheit zu entwickeln....read more",https://users.insighttimer.com/M7L2W2K6y6u7S9p8z5L5b7W5M9U6r7f4D9t8W3F0X2e9X7C7U5J6u0z7s4T0x0v1y3b7d3m6L7V7s8M8F5V6h0U2M0a0C7h8P0b0/pictures/square_medium.jpeg
14035,sarahgodinez,s,141,2022-12-12 08:06:53.596997,name found,Sarah Godinez,"Carpinteria, CA, USA",30 followers,English,Joined in Mar 2021,"True Light Guide, Meditations and Yoga.",https://users.insighttimer.com/iISROciDBCbXMtwYeOe9KLjOPWg1/pictures/square_medium.jpeg
14036,meridiana,s,141,2022-12-12 08:07:17.315710,name found,Sound Yoga Sanctuary,,30 followers,English and Русский,Joined in Dec 2021,"Evgenia certified yoga teacher, Reiki master & Integral Sound Healing practitioner. Originally came from Siberia. Evgeniia is passionate about helping clients strengthen their body and mind while receiving the relaxation and spiritual benefits of sound. Besides doing spiritual work and practice, she is also a solo electronic pop synthwave artist based in San Francisco, CA. She was a member of a few electronic bands where she was composing and writing together with other great local musicians (band “Low Valley Hearts”). Evgeniia creates ambient soundscape compositions and charge it with healing energy and high vibrations....read more",https://users.insighttimer.com/rVNHFuu5INTWJtOZ1XdwRBcF5wP2/pictures/square_medium.jpeg
14037,subtle_triumph,s,141,2022-12-12 08:07:26.978373,name found,Subtle Triumph,,30 followers,,Joined in Jun 2021,"Subtle Triumph is an ambient music duo based in Seattle WA consisting of Christopher Israel-Bishop and Trevor Sellman. Christopher grew up with a diverse spiritual and religious background, growing up writing songs about his life experiences. Trevor grew up in the spiritual mecca that is Mt. Shasta CA, learning percussion at a young age and studying a wide variety of instruments. The two came together to create music that embraces spiritual growth with an emphasis on self-awareness....read more",https://users.insighttimer.com/UXoCc0FbLhWncO3hTyef8D586m43/pictures/square_medium.jpeg
