,teacher_id,alpha_index,batch_id,scrape_date,scrape_status,teacher_name,location,followers,languages,date_joined,about,image_url
10880,peaceandpresencewithmelina,m,109,2022-12-11 17:09:44.177330,name found,Melina Demertzis,"Sunshine Coast, Australia",12 followers,English,Joined in Jul 2021,"Melina is a Heart-Based Mindfulness, Meditation, and Yoga Teacher. Melina was initially drawn to yoga and mindfulness for its ability to connect body, mind and spirit and was soon addicted to the soothing qualities of the practices. Using conscious breath, feel-good gentle yoga and peaceful mindfulness practices, Melina brings a gentle, calming, and soothing energy to her classes.  Her mission is to create a space of stillness, peace and spaciousness for people to connect back to their heart....read more",https://users.insighttimer.com/e5h0G0j3R1E9V0f8W4m1e7u3D7k1a0V0W3B5c6B9J0P4P4B6z0w5D1a7P2x8e4H1d5e3b9a1t0b8x7L1L3r5z7C3K3G8q5n3p9a2/pictures/square_medium.jpeg
10881,universalsoulace,m,109,2022-12-11 17:10:03.884771,name found,Mel Darling,,12 followers,English,Joined in Feb 2022,"Mel is a yoga and meditation teacher based in Perth, Western Australia. She has a special interest in the therapeutic benefits of combining yoga, meditation, and Yoga Nidra, with other self-awareness practices such as the Internal Family Systems Model and exercise. She has a particular interest in supporting the well-being of education staff....read more",https://users.insighttimer.com/taMoGa4YjibAidIHg9TtnqLmbb23/pictures/square_medium.jpeg
10882,mindfulx,m,109,2022-12-11 17:10:22.733755,name found,MindfulExistenC,"San Francisco, CA, USA",11 followers,English,Joined in Sep 2018,"MindfulExistenC:
A Mindful state of Existence bringing people optimal potential. Empowering energetic and creative capacity, MindfulExistneC teaches how to develop intention and direct the authentic presence which creates beneficial impact within persons and the world. Welcome to MindfulExistenC

MindfulExistenC focuses on individual and collective Wellness & Health as well as provides an online arena to learn, advocate, and contribute to the complete integral wellness movement....read more",https://users.insighttimer.com/Q6y6v4d7z5W1p9k2x8J5J0h7h2p1B3L5S3n3s5a9c4F2K9r9B1x6B9q9w8c4r2P1B5b6B8w6Q5j2y1G1h6D1r2Z1u8L1E8e8R3B1/pictures/square_medium.jpeg
10883,markaccomando,m,109,2022-12-11 17:10:41.359861,name found,Mark Accomando,,11 followers,English,Joined in Aug 2021,"Mark has been teaching peaceful, healing and soothing guided meditations, including sound bath healing, meditation, and mindfulness skills for over 20 years. He incorporates Tibetan singing bowls, crystal quarts bowls, Paiste Gongs original native American flute music in his healing sessions. In 2011 Mark wrote Spiritual Education in Recovery curriculum where he has been sharing healing, inspiring and practical life skills practices like emotional regulation, self-empowerment, intentional life purpose practices and skill building for living an empowering and fulfilling life. Mark supports people in following and trusting their deepest heart-felt creative passions and allowing their lives to naturally unfold with great joy, love, peace and purpose!...read more",https://users.insighttimer.com/QLCCezA7WyeFP4b4uNa7LN9sA2p1/pictures/square_medium.jpeg
10884,madeleineharmath,m,109,2022-12-11 17:11:00.024086,name found,Madeleine Harmath,"Menlo Park, CA, USA",11 followers,English,Joined in Jul 2021,"What happens when a solid, grounded Software QA Engineering Manager with strategic problem-solving skills has a spiritual experience of a past life contact beckoning her to “WAKE-UP?

You got it. She becomes an Advanced Spiritual Teacher and Healer.

Madeleine hopped on the express train becoming obsessed with all the goodies in the spiritual candy store. She received certifications as an Advanced Spiritual Healer from the Dancing with Source Mystery School, a MotoKi Level II healer, as well as a Reiki Level I, II and II Healer and Teacher.

Madeleine’s greatest delight is to help others help themselves. There is nothing more fulfilling than to empower each person with the knowledge and tools to help them let go of their emotional and physical pain and replace it with a happy, joyous, abundant and loving life....read more",https://users.insighttimer.com/WI9lWgNAnZhjTin3TwSjwndFwc52/pictures/square_medium.jpeg
10885,maudgubbasta,m,109,2022-12-11 17:11:26.824330,name found,Maud Gubbels,,11 followers,English,Joined in Sep 2022,"As a Creative Arts therapist, Maud loves connecting mindfulness with expression - in different ways: movement, art making, breath, music, etc. Maud is always searching for ways to 'unbecome', to just be able to stay in the present moment, and to connect with whatever arises through the senses and the body. 'Unbecoming' so that you are able to become who you were meant to be in the first place. Within BASTA! Let's Move Together, she provides a space where others are able to be present, 'unbecome' and connect with their highest self. 

The meditations offered in this channel are all movement based - you choose how big or small the movement gets, as long as it feels right for you and your body. While doing these meditations, please look after yourself - hydrate yourself, don't push too far, be gentle & kind and invite yourself to be curious....read more",https://users.insighttimer.com/eERP1XVulZf88mTisMk1Ye4moh13/pictures/square_medium.jpeg
10886,intuistichealth,m,109,2022-12-11 17:11:45.585571,name found,Meaghan Moran,,11 followers,English,Joined in Jan 2021,"Meaghan is a holistic health and life coach specializing in helping you truly nourish yourself through emotional, physical, and spiritual wellbeing so you can feel free in your body and life.  She combines an intuitive and holistic approach to guide you into your healthiest and happiest life. Meaghan is on a mission to guide and hold space for women to learn to love themselves, to help them tune into their intuition, and tap into that wisdom that is already there within themselves so they can live in a body that they truly trust and live a life they truly love....read more",https://users.insighttimer.com/9UpuB4BkRWXsQXoxgfwcg0OP0vU2/pictures/square_medium.jpeg
10887,monicasantos,m,109,2022-12-11 17:11:48.196320,name found,Mónica Santos,,11 followers,Português,Joined in Jan 2022,"“Se ensinássemos meditação a todas as crianças de 8 anos, eliminaríamos a violência numa geração”. Esta frase de Dalai Lama, juntamente com a minha experiência pessoal fez-me querer partilhar convosco  uma breve meditação guiada para crianças. Junta relaxamento, visualização e diversão na mesma história de sonhar. Bons sonhos!...read more",https://users.insighttimer.com/DNkkRnvzkvTboYfp8O99vbN3Cws2/pictures/square_medium.jpeg
10888,mollyrodau,m,109,2022-12-11 17:12:06.936740,name found,Molly Rodau,,11 followers,English,Joined in May 2021,"Molly is a certified coach, master facilitator and leadership expert who believes deeply that our individual evolution is tied to our collective progress.
Molly lives in the greater NYC area with her partner, toddler and dog.",https://users.insighttimer.com/T1T1U6d9L6H8H3e4L5w0H9s3x8G1B8Z0y4M2T6F7G3v9k6M3m6n4w2d4Q9L3e1a1Q3h0j4t3Y8G0y5L8K0R0s5d1X0c9d0Y6M6Q0/pictures/square_medium.jpeg
10889,manori,m,109,2022-12-11 17:12:09.625783,name found,Manori Sumanasinghe,"Los Angeles, CA, USA",11 followers,English,Joined in Feb 2021,"Hello! My name is Manori. I am an architectural designer, entrepreneur, energy healer, and facilitator of creative altered states of mind. I started training in Theravada meditation practices under the tutelage of distinguished monks in Sri Lanka around 11 years of age. In my late teens I started studying buddhist philosophy, and learnt energy mindfulness and healing in my early twenties. For over a decade, I have been teaching, mentoring, and facilitating deep meditative and altered state journeys specifically designed to tap into the creative genius within an individual. Join me in a journey deep into your subconscious and beyond!...read more",https://users.insighttimer.com/P7nSID0PT8U8BNdG8KbseaFX3MA3/pictures/square_medium.jpeg
10890,melissanoelrenzi,m,109,2022-12-11 17:12:12.278159,name found,Melissa Noel Renzi,"Forest Park, IL, USA",11 followers,English,Joined in May 2020,"Melissa is a licensed social worker and trauma-informed yoga teacher who weaves her skills together to help highly sensitive people transform deep-seated anxiety, befriend their minds, and uncover the peaceful observer within. Through her ""all parts welcome"" approach, Melissa invites her students to relate to the body-mind with gentle compassion and embrace....read more",https://users.insighttimer.com/F2t8A0t3Q6M3z9b9k3g3J6U0W5J7L7a5j1s6u6N2L9f2m4v6Z3Z8K8n0C2N0Z0A4Y1f4p0k9e9U7W0Z1m3v5h5D0y6P0j4j4d0d5/pictures/square_medium.jpeg
10891,melody_r_harris,m,109,2022-12-11 17:12:41.099610,name found,Melody Harris,"Birmingham, AL, USA",11 followers,English,Joined in Sep 2022,"Christian, Mystic, yogi, wanderer. Melody discovered meditation along with somatic trauma therapy as she started her journey of healing from years of trauma. Currently Melody is Somatic Trauma Therapy certified and is pursuing her Yoga Teacher Training certification in order to guide others through a more holistic way of moving through their trauma....read more",https://users.insighttimer.com/bQZcFMLoSKUgHnge5KnCEMvzHWv1/pictures/square_medium.jpeg
10892,meltheoracle,m,109,2022-12-11 17:12:59.908204,name found,Mel The Oracle,,11 followers,English,Joined in Nov 2022,"Mel The Oracle is a mentor, voice artist, writer, 200hr Certified Yoga Teacher and podcast host. Over the past decade, she served as an Embodiment Guide and Healing Facilitator in Austin, TX through her company Grow Your Lovespace. After initiating a much needed business sabbatical in March 2022, she birthed her podcast Full A** Human and has returned to her roots of supporting her community by vulnerably modeling humanness, teaching by living and reminding them to re-center humanness and invite all dimensions of themselves to the table....read more",https://users.insighttimer.com/bX0NkG38gRRtIOoiYyKv543B4PU2/pictures/square_medium.jpeg
10893,positive_wellbeing,m,109,2022-12-11 17:13:02.725547,name found,Michelle Falzon,"Melbourne VIC, Australia",11 followers,English,Joined in Nov 2021,"Michelle a positive psychology consultant & coach, an educator, lover of learning, and advocate for positive mental health and wellbeing. After facing an unexpected tragedy that completely changed the trajectory of her life, she now sees herself as a survivor and not a victim. So, it is with this strong mindset that she dedicates herself and the work that she does each day to supporting others....read more",https://users.insighttimer.com/NFZ5RHAopXTS6JNsqnnJeoV1Mip2/pictures/square_medium.jpeg
10894,maedean2021,m,109,2022-12-11 17:13:21.596717,name found,Maedean Myers,"Vancouver, BC, Canada",12 followers,English and Deutsch,Joined in Feb 2022,"“There are two basic motivating forces: fear and love. When we are afraid, we pull back from life. When we are in love, we open to all that life has to offer with passion, excitement and acceptance.”
— John Lennon

Maedean Yvonne Myers, RCC, CCC, RYT is a counsellor in private practice in British Columbia.  She is passionate about  helping other lovely humans create healthy, creative and deeply satisfying lives.  The influences on her work include Mindfulness, Cognitive Behavioral, Feminist, AEDP, Developmental, Ecotherapy and Psychodynamic interventions.  When not working with people, she loves various forms of meditation, dance, yoga, martial arts, science fiction, and nature....read more",https://users.insighttimer.com/l4bRUjSu1JPgU1DuJGrSHtv719d2/pictures/square_medium.jpeg
10895,mari.sutra,m,109,2022-12-11 17:13:46.390744,name found,Maria Sukorkina,,11 followers,Русский,Joined in Jan 2022,Преподаватель хатха-йоги.,https://users.insighttimer.com/D4Wa3BqIzkTZzcRG5YY7rEJ7Ycm2/pictures/square_medium.jpeg
10896,happymemichelle,m,109,2022-12-11 17:14:05.233713,name found,Michelle Marsh,"Perth WA, Australia",10 followers,,Joined in Feb 2020,"Michelle is deeply passionate about teaching women to connect with themselves and thus, know who they are at an intimate level. She teaches them to hold their power and explore the gifts they have and can manifest. When you embrace the journey you can find peace and contentment in the here and now and enjoy the process as it unfolds. This is her calling and her joy; an expression of life and love....read more",https://users.insighttimer.com/u0e2K1U9x4w0z3x7g0R7h3L9m2w0r7J5h2P3U0D1L4U6W6e1d6v6A0s6u2h6m7E3n9G9k1Y3U5u8h2K9D1T2S0b9J8t9b7Q6m5M8/pictures/square_medium.jpeg
10897,effectmari,m,109,2022-12-11 17:14:23.877326,name found,Maria Alehina,,10 followers,,Joined in Jan 2021,"Certified gem expert and psychologist from Russia. I help to change life for the better through the power of gems and self-improvement.
Author of more than 800 publications.",https://users.insighttimer.com/eWSy6Y5hTBaUJU64XMgr2eGW5IN2/pictures/square_medium.jpeg
10898,meghanmarie,m,109,2022-12-11 17:14:42.854539,name found,Meghan Lawless,,10 followers,English,Joined in Nov 2021,"Meghan is a recovering perfectionist who fell in love with yoga and meditation as a way to come home to herself. 

She became a dedicated student in a period of transition as a way to metabolize her experience. As she surrendered deeper to the practice, she discovered how it could be a vehicle back to her authentic self. By following the teachings of yoga as an ethical and practical framework, she realized that it was possible to choose courage, peace and acceptance in any moment or circumstance.

In any of Meghan’s classes, you can expect to find a welcoming space to allow your experience to unfold as it will. You will be invited to observe how your emotions, breath and body interrelate as you meet your edge with compassion. Her humble intention is to share the balance of strength and grace she has found through the practice....read more",https://users.insighttimer.com/cDQ6QnULt4ZyPYWZpErP1h3MC1t1/pictures/square_medium.jpeg
10899,morganandersonreed,m,109,2022-12-11 17:15:01.474329,name found,Morgan Anderson-Reed,,10 followers,English,Joined in Oct 2021,"Morgan changed corporate careers in 2008 and channeled her passions into all things wellness becoming a certified yoga, barre, fitness teacher and Licensed Massage Therapist. Morgan has taught and trained thousands of students over the past decade. Her classes are alignment based and designed for all levels to improve strength, flexibility and reduce stress. Morgan runs a corporate wellness company helping employees live healthier at work through office ergonomics, meditation & yoga classes....read more",https://users.insighttimer.com/j8u7c5g5w2M5K0y5W7v9R8r7x0Q1C7L0D2r8Q4M7W2K3a6j6G1z2P0W7Q5Q2k4R2d0X7x8R1A3H6G9T0e2P5z2U2d9k6v1T1N6H3/pictures/square_medium.jpeg
