,teacher_id,alpha_index,batch_id,scrape_date,scrape_status,teacher_name,location,followers,languages,date_joined,about,image_url
11035,mariamayes,m,111,2022-12-11 17:55:02.248921,name found,Maria Mayes,,3 followers,English,Joined in Dec 2022,"Maria Mayes is a Well-Being Coach and Teacher with a mission of helping others take their power back from anxiety. She specializes in simplifying techniques and ancient wisdom teachings into short digestible bites that are easy to apply in busy western lifestyles. She is certified through Chopra Global in Coaching, Meditation and Ayurveda and is an RYT200 Yoga Teacher.  In 2020 she traded in a 20 year career in the technology industry to follow her dharma and founded Take 5, LLC....read more",https://users.insighttimer.com/dFzRnvY3vyeMws6VwRHFgYngPr42/pictures/square_medium.jpeg
11036,dejeni,m,111,2022-12-11 17:55:22.304638,name found,Martine Genicot,,3 followers,Français and English,Joined in Nov 2022,"Martine est tombée dans la marmite du yoga à 18 ans après une période d'anorexie à l’adolescence. 
A la naissance de son quatrième enfant, elle suit la formation de 4 ans de l’Ecole Française de Yoga et obtient son diplôme en 1988.
Il y a une dizaine d’années elle découvre la pratique de la méditation de Pleine Conscience. Elle participe à de nombreux stages (MBSR) et retraites de Pleine Conscience au Village des Pruniers en Dordogne et au “Florida Community of Mindfulness” à Tampa USA...read more",https://users.insighttimer.com/YLmtd3ywAhbS5mHHLoUdmVXN65r2/pictures/square_medium.jpeg
11037,kunye.co,m,111,2022-12-11 17:55:33.019582,name found,Melissa Nkomo For Kunye,,2 followers,,Joined in Jun 2021,"Melissa Nkomo is a mindful movement guide and embodiment worker, as well as the Founder of KUNYE - a modern mindfulness company.

Kunye works to galvanize the power of Self through the practice mindfulness, movement and body-care. We are shifting the self-care paradigm, seeking to diversify popular representations of health and healing, and empower people to reclaim their well-being and healing. ...read more",https://users.insighttimer.com/Njy1E45V38U3UL1uY0OIIXXhkoU2/pictures/square_medium.jpeg
11038,marissachastain,m,111,2022-12-11 17:55:51.808906,name found,Marissa Chastain,,2 followers,English,Joined in Aug 2021,"Marissa Chastain is a yoga and meditation teacher (e-RYT), reiki healer, certified personal growth coach and writer. The focuses of her work are identity discovery, healthy relationships, and somatic healing. She lives in Colorado and North Carolina with her husband and rescue dog....read more",https://users.insighttimer.com/rJYC25Y29nMwPT6tiBOGlvTXrwh2/pictures/square_medium.jpeg
11039,matthewgoodmanphd,m,111,2022-12-11 17:56:10.676599,name found,Matthew Goodman,,2 followers,,Joined in Jul 2022,"Matthew Goodman, PhD is a Licensed Clinical Psychologist and Founder/CEO of The Middle Way Consulting. He is also Clinical Assistant Professor at the Keck School of Medicine of USC. Dr. Goodman taught mindfulness and stress-reduction strategies for nearly 10 years in clinics, hospitals, schools, and to the general public. He has a particular interest and affinity for self-compassion and heart-based practices. His book, ""Simple Stress-Reduction: Easy and Effective Practices for Kids, Teens, and Adults,"" guides readers through simple, step-by-step practices in the areas of mindfulness, self-compassion, sleep, breathing techniques, grounding, and more....read more",https://users.insighttimer.com/1c0cUN2bsKbAoYQnjfA1sNFCeoE3/pictures/square_medium.jpeg
11040,tapwithmarti,m,111,2022-12-11 17:56:29.281173,name found,Marti Murphy,,2 followers,English,Joined in Apr 2022,"Marti is a Certified EFT Tapping Practitioner, Author of two books, Forbidden Emotions - The Key to Healing and 365 Days to Embracing Forbidden Emotions - A Daily Guide to Peace and Fulfillment a collaboration with her daughter. She’s the Creator of the Transformational Tapping Certification which certifies clients in Tapping so they can help others reconnect with their authentic selves. She hosts on-line groups such as The Amazing Power of What if and other tapping programs and runs the Tapping Really Works Facebook Group....read more",https://users.insighttimer.com/z9GIwuqGvmOb8XdTNeu0DH49IBn2/pictures/square_medium.jpeg
11041,marissahalterman,m,111,2022-12-11 17:56:47.892563,name found,Marissa Halterman,"Madison, WI, USA",2 followers,English,Joined in Mar 2022,"Marissa came to meditation during a time of great need and built a practice around letting go and looking in.

Marissa's approach to teaching is to cultivate hope, calm, and self love through her meditations. She draws upon her own practice of growing self esteem and finding the light in any darkness. Her meditations are accessible and simple, and come from her love for writing and connecting with others. 

Marissa lives with her family in Wisconsin, USA....read more",https://users.insighttimer.com/b4U8m4Q1X8w8v1b4w9g4v2y8n9v2P3a9n7x7E5p3N1h9f9R6q7v6T3s7P6f4Q9p0z5h1j0L9T4Y8b9S9S8P1f9H7a9h4U9j7k5y1/pictures/square_medium.jpeg
11042,michelleevangelistayoga,m,111,2022-12-11 17:56:50.709575,name found,Michelle Evangelista,,2 followers,English,Joined in Jul 2022,"Michelle's classes are a practical mix of yoga and mediation to help you feel uplifted and restored. She teaches a unifying practice of being perfectly at ease with ourselves, each other and life. Certified in Hatha yoga, mindful meditation and Reiki she teaches classes, workshops and retreats....read more",https://users.insighttimer.com/LUU3GObRxoNmwXci7gaIt2Z3XqJ2/pictures/square_medium.jpeg
11043,thebalancedceo,m,111,2022-12-11 17:57:09.455372,name found,Michelle Gagliani,,2 followers,English,Joined in Jul 2022,"Michelle Gagliani is a Certified Meditation + Mindfulness Teacher and founder of The Balanced CEO, a digital media platform for holistic health and mindful living. Through her content, Michelle guides people to create holistic self-care and wellness habits that work for them and to find peace and calm in the everyday hustle. The Balanced CEO promotes that when you find balance within, you feel your best and live a healthier and happier life....read more",https://users.insighttimer.com/ff578pimD6Qer9ncVwcv3crVFS43/pictures/square_medium.jpeg
11044,stillmovemeant,m,111,2022-12-11 17:57:40.269838,name found,Morvah Violet,"Málaga, Spain",2 followers,English,Joined in Jun 2022,"Morvah is a Shiatsu Practitioner who studied TCM, Zen and Five Element Shiatsu with the Bath School of Shiatsu & Yoga, they are a registered member of the Shiatsu Society (MRSS). They are passionate about pure essential plant oils, especially for emotional and spiritual evolution. They are a mover, they dance, and find it to be a way to regulate the wordless and the nervous system. They are a writer, a lyricist, a vocalist. Morvah translates to ""of the sea"" which is where they feel most at home. They feel drawn and passionate about sharing the self-supporting tools they use, with those who resonate. 

Creator + Writer + Mover + Singer...read more",https://users.insighttimer.com/L7LECShn60dMFtX6MmbACopAnxJ3/pictures/square_medium.jpeg
11045,marinazwicky,m,111,2022-12-11 17:57:58.986796,name found,Marina Zwicky,,2 followers,English,Joined in Apr 2022,"Marina is a Meditation & Mindfulness Teacher as well as a Yoga (RYT-500) Teacher. Her goal is to provide access to meditation and yoga, allowing people to experience what’s going on in their body and especially what’s going on in their mind....read more",https://users.insighttimer.com/vH4Xd12LwvOgTCrPOlPQn818rSJ3/pictures/square_medium.jpeg
11046,mellaragold,m,111,2022-12-11 17:58:17.904185,name found,Mellara,,2 followers,English,Joined in Sep 2021,"Mellara is a teacher of meditation and mindful yoga. For over 20 years she has been influenced by Hatha Yoga, Mindfulness, and Buddhism. 
Her radiant and inspirational teaching blends the physical and spiritual aspects of yoga with self-inquiry. She leads online and in-person workshops, retreats, and spiritual mentoring sessions. 
She is also a regular contributor to Elephant Journal, OM Yoga & Lifestyle Magazine and other spiritual platforms....read more",https://users.insighttimer.com/eToNQWQ6mmSaXtQezNDaYbT9yok2/pictures/square_medium.jpeg
11047,marayoga_sana,m,111,2022-12-11 17:58:20.496287,name found,Mara Patricia Steen,"New Orleans, LA, USA",2 followers,Español and English,Joined in Jul 2022,"Me describo como un alma yoguini,enfocada en su propio viaje de sanar, cuidar y alimentar alma, mente y cuerpo para así poder ayudar y acompañar a otros en este camino de UNIÓN con su ser superior y la divinidad.
Mara se describe como un alma, en una experiencia de vida transformadora, practicante de yoga desde hace 7 años y maestra certificada de yoga y meditación en la india, facilitadora de terapia de reiki y terapia de chakras

Mi visión es integrar el yoga en nuestras vidas como una herramienta de sanación y transformación personal....read more",https://users.insighttimer.com/r5u9V6r7c5a2A6J8b0F7x4N8h2C9G0f8a1z3s6L6s1q5c6z2S6g2R6n4E8k3H2W0p0d1A5f2b6N1f6a8n2b0f4A2N7p1Z1E0E8G0/pictures/square_medium.jpeg
11048,thecentreforhealing,m,111,2022-12-11 17:58:39.115955,name found,Melissa Hiemann,,2 followers,English,Joined in Aug 2022,"Melissa is a therapist, healer and mentor. Her passion is helping people to get out of their own way to create fulfilling and abundant lives through their own soul-led business. She helps people effectively shift through their limiting beliefs, blocks, and resistances to having their dream lives. She is an author, mum and director of The Centre of Healing, along with creating two signature methods, Root-Cause Therapy and the Trauma-Informed Manifestation Coaching Certification....read more",https://users.insighttimer.com/y8CqqxSRT8blhHGHUbyDT4QadGB2/pictures/square_medium.jpeg
11049,martinewerkhoven,m,111,2022-12-11 17:59:05.841369,name found,Martine Werkhoven,,2 followers,"English, Nederlands and Français",Joined in May 2022,"Martine helps women, drained from unhealthy, toxic or narcissistic relationships, re-align with their Divine self by holding a nurturing space to ground, connect and attune with the healing energy of the Archangels, Ascended Masters and other Light Beings, so that any difficult emotions or blockages can be dissolved and released under the Law of Grace. 
Martine is a Qualified Teacher of Ascension with The Diana Cooper School of White Light....read more",https://users.insighttimer.com/GqicNJFfPCWEWRJBZGOPwTucQ4K3/pictures/square_medium.jpeg
11050,maxwellflowers,m,111,2022-12-11 17:59:25.422288,name found,Maxwell Flowers,,2 followers,English,Joined in Mar 2022,"Maxwell Flowers transmits music and auditory journeys from the lands of plant medicine and meditation. Blending traditional meditative instruments and natural environments, Flowers takes us to auditory landscapes that feel peaceful yet engaging. Take a deep breath, let your analytical mind relax, and open your consciousness to the deep waves of the universal wisdom....read more",https://users.insighttimer.com/tvkx0SJStMgh7FoYNNYBLIOOTbE2/pictures/square_medium.jpeg
11051,mytraemeliana,m,111,2022-12-11 17:59:44.354323,name found,Mytrae Meliana,,2 followers,English,Joined in Oct 2022,"Mytrae Meliana is a holistic psychotherapist, trauma specialist, women’s empowerment and Divine Feminine teacher, channel, musician, sound healer, author and speaker. She helps women heal from trauma, liberate themselves from patriarchy, and evolve to their Divine Selves. She has empowered hundreds of women to find their voice, truth, power, Soul Purpose, and connect with the Divine Feminine. Her award-winning memoir is ""Brown Skin Girl: An Indian-American Woman’s Magical Journey from Broken to Beautiful."" She lives in the beautiful Pacific Northwest.

She also creates piano healing music and sound healing music with crystal singing bowls and other instruments. Founder of Temple of Sound Healing, she offers sound healing trainings for health/wellness practitioners and organizations....read more",https://users.insighttimer.com/SudN8JKDxIZuVDPJwJXB4Iz6Lm82/pictures/square_medium.jpeg
11052,mariedemoulin,m,111,2022-12-11 17:59:47.243233,name found,Marie Demoulin,,2 followers,English and Français,Joined in Jan 2022,"Je suis Marie Demoulin, facilitatrice de cercles de femmes et de cercles de parole mixtes.
Artiste, pédagogue, juriste et sauvage.
J'ai créé cette chaîne pour vous offrir des moments de détente, de calme et de relaxation, et vous offrir un extrait de se qui se passe dans mes cercles.
Un cercle de femmes ou un cercle de parole mixte est un espace de co-construction.
C’est une danse entre se connecter à soi et se connecter aux autres.
Parler et se taire.
Introspection et partage.
Il y a quelque chose de l’ordre du sacré dans le cercle.
Quelque chose d’intemporel....read more",https://users.insighttimer.com/7DwBPxY2V3V44aYohpeTalRSGsv1/pictures/square_medium.jpeg
11053,michaeldirosa,m,111,2022-12-11 18:00:05.964686,name found,Michael DiRosa,"Briarcliff Manor, NY, USA",2 followers,English,Joined in Sep 2022,"Michael is an arts educator, meditation teacher, and visual artist. With over seven years of teaching experience developing art and nature-focused offerings at museums, cultural institutions, and internationally, Michael has developed a teaching practice centered on creativity, connectedness, and loving-kindness. 

Michael's meditation style, learned through training with monks in Bhutan and Thailand, is rooted in Buddhism and complemented by secular mindfulness....read more",https://users.insighttimer.com/L9p9j4W9K6Z6F7B7b7G7A0s0h2k3k8g5B9W3u9K8d2a0x9j0b9H6m6C4A6F9c4p5f7K1J4m7j6M5m6g2F0N0e8R9J7K0n3s0A8z3/pictures/square_medium.jpeg
11054,mirabellbell,m,111,2022-12-11 18:00:24.730513,name found,Mirabell Arad,Ibiza,2 followers,English and עברית,Joined in Apr 2022,"Mira Arad, a filmmaker, visual artist, and sound healer, was based in the Himalayas for more than eight years, where she was to make a transformative discovery of Tai Chi practice, Meditation (Transcendental Meditation), Reiki, and the sublime Full Moon Singing Bowls...
Mira lived in Nepal with the family of a mythological traditional sound healer that invented the powerful Full Moon Bowls. She learned his technique of sound healing therapy and started to teach it and play in Sound Baths....read more",https://users.insighttimer.com/F3G8d0k5J0b9N8y8E9g5w1D2d5t0z9R8k8R3x5V0V3H7u4M8u1g8C0Q2C6V9n2p1P4h3R5A2Z0a3v8D5U1c9Q9P5Q7G2u6t8Z3a8/pictures/square_medium.jpeg
11055,cruzen_medicine_music,m,111,2022-12-11 18:00:37.445136,name found,Mary Cruz,,2 followers,,Joined in Nov 2022,Mary Lu comes brings prehispanic ancestor medicine music to serve and lift the soul. Tranquil Medicine songs of the heart for the heart. Sharing moments of connection with spirit. Channeling songs and sounds from the heart. We hope you may receive this medicine music with open hearts and gratitude....read more,https://users.insighttimer.com/dVRot9EewMhxEH7BSMuwo7Zmjj13/pictures/square_medium.jpeg
11056,youinmotion_yoga,m,111,2022-12-11 18:01:20.313460,name found,Marie-Luise Grützner,,2 followers,"Deutsch, English and Español",Joined in Oct 2022,"Marie-Luise Grützner ist Yogalehrerin, Coach und vor allem Soulsister. Außerdem ist sie Gründerin von you in motion. Hier geht es um die tiefe Verbindung zu dir und deinem Umfeld durch die Kultivierung von Selbstliebe und Authentizität. Ihr Ziel ist es wieder mehr Leidenschaft für das Leben in den Menschen zu entfachen. Dafür nutzt sie einen ganzheitlichen Yogaansatz, Breathwork, Coaching und Zeremonien....read more",https://users.insighttimer.com/rn9lm2e4NkfC3FayFqyPiLu7isQ2/pictures/square_medium.jpeg
11057,martynayogaandlife,m,111,2022-12-11 18:01:38.990938,name found,Martyna Tetera,,2 followers,"English, Deutsch, Polski and Français",Joined in Nov 2022,"Martyna is a Hatha Yoga Teacher and Holistic Wellbeing Coach. She helps women to access inner peace, find emotional freedom and align with their purpose. 
She offers online and in-person Yoga, Meditation, and Yoga Nidra classes and a 1:1 mentorship and coaching.n Yoga, Meditation and Yoga Nidra classes and a 1:1 mentorship and coaching....read more",https://users.insighttimer.com/tRAcUiqKaOUkKzSwC5Z68CFU5362/pictures/square_medium.jpeg
11058,empoweredgrowth,m,111,2022-12-11 18:01:57.797405,name found,Michelle Fagan,"Denver, CO, USA",2 followers,English,Joined in Jun 2022,"Michelle is a Licensed Professional Counselor based in Denver, CO.  Michelle utilizes her formal education in psychology, her extensive training in mindfulness/somatic-based interventions, as well as her 8 years practicing yoga to formulate her trauma-informed meditations. Michelle's meditations typically focus on relaxation, embodiment, and mindfulness....read more",https://users.insighttimer.com/rQX6lHi7lhYgANWW7IRTVafmUih2/pictures/square_medium.jpeg
11059,mariana.bauso,m,111,2022-12-11 18:02:16.648368,name found,Mariana,,2 followers,BR. Português,Joined in Oct 2022,"Mariana Baúso é instrutora de Meditação formada pelo M4YOU - Extensão em Mindfulness pela PUC/RS e Mestre Reiki. Há mais de 5 anos pratica e estuda sobre meditação, curas energéticas, autoconhecimento e desenvolvimento pessoal.",https://users.insighttimer.com/J8w4v6Q4z7a0A2p0b8d6q9e8u3F9R8z3J4g8y1t0J5M5B2b1F3t8r3A4r2u2V4n6V3z3q5Z6v8F6E0q0u3Z1W4p2x9G6q5W8T3b5/pictures/square_medium.jpeg
11060,marchenrisandoz,m,111,2022-12-11 18:02:35.522497,name found,Marc-Henri Sandoz Paradella,Suisse,2 followers,Français,Joined in Nov 2022,"Marc-Henri est enseignant de méditation, écrivain et thérapeute. Il a été autrefois pasteur, et a démissionné lorsqu'il a réalisé le sectarisme et les refoulements qui étaient au cœur de sa foi. Il a commencé un travail thérapeutique intense pour aller à la rencontre de ses ombres. Il s'est formé en méditation Mindfulness, en Yoga Nidra et en Yoga.
Pour lui, une spiritualité saine doit avant tout nous aider à intégrer toutes les parties de notre personne et de notre expérience, sans en rejeter aucune.
Il enseigne le tarot et écrit des ouvrages consacrés à la spiritualité et à l'intuition....read more",https://users.insighttimer.com/IKKLYUP2WoczrfBM9daNoBJzk6D3/pictures/square_medium.jpeg
11061,mariemag,m,111,2022-12-11 18:03:02.345970,name found,Marie Mag,"California, USA",2 followers,English,Joined in Dec 2022,"Marie (she/her) is lifelong learner, a yoga enthusiast, and an advocate for mental wellness. She is a 200-hour certified yoga teacher and mind-body wellness and SEL facilitator through Breathe for Change. She hopes to share her yoga and wellness experience with the higher education community where she works. She is based in Southern California....read more",https://users.insighttimer.com/hJNwQwPPJpemHfZY2yJdRANJ0rn2/pictures/square_medium.jpeg
11062,maricoutinho,m,111,2022-12-11 18:03:05.293741,name found,Mari Coutinho,,3 followers,BR. Português and English,Joined in Nov 2022,"Yogi dedicada ao proprio caminho que abre a passos conscientes.
Yoga e mindfulness.",https://users.insighttimer.com/Y2Fh56CXXBXyAnTXTqb7105hQWF2/pictures/square_medium.jpeg
11063,undefined,m,111,2022-12-11 18:03:24.085954,page not found,,,,,,,
11064,pub20649673,m,111,2022-12-11 18:03:42.735991,name found,Marilyn Vigneron,,1 followers,,Joined in Oct 2021,,https://users.insighttimer.com/tmG7aVvLxpeLjBQdWn9Jm1tGBcr2/pictures/square_medium.jpeg
11065,morganatara,m,111,2022-12-11 18:04:01.335881,name found,Morgan Susan Taylor,"Austin, TX, USA",1 followers,,Joined in Apr 2020,"Morgan is a specialist in women's sexuality and feminine spirituality, helping women find their voice, resolve resentment and guilt, so that they can get back to love.",https://users.insighttimer.com/Z2N3A7J0X2D4D9X5z1t5f6Z5Z5v9n2J1a6D1K5X7C5s5W1m1n8k1Y4K4Q6X1x2G1G2G2q5q8j5c1y4f9e5Y2M6q3d5b1v6E8C4n3/pictures/square_medium.jpeg
11066,restfulsleep.eu,m,111,2022-12-11 18:04:19.974345,name found,Maša Nobilo,,1 followers,"English, Italiano, Сербский, Русский and Polski",Joined in Jul 2021,"A passionate proponent of sleep and rest, Maša's mission is to help people get consistently restful nights through movement, embodiment, breathwork and meditation sessions, backed by behavioural science. 
Her sessions range from deeply restorative bedtime exercises meant to lull you to sleep, to introspective meditations on improving our daily habits, routines and rituals in order to live a life fully in line with our values.
Good sleep starts the moment you wake up, what will you choose to start your day with?...read more",https://users.insighttimer.com/mIOM00cLGyVzvR1UORxS7yoGIOi1/pictures/square_medium.jpeg
11067,madeleines.yoga,m,111,2022-12-11 18:04:38.657831,name found,Madeleine Klammer,,1 followers,Deutsch,Joined in Feb 2022,"Madeleine ist seit 2 Jahren Yogalehrerin. Am wohlsten fühlt sie sich im Hatha und Yin Yoga. Sie freut sich darauf, dich auf der Matte zu sehen!",https://users.insighttimer.com/NbaJmj93eRQSAlcdzH805PnkItu1/pictures/square_medium.jpeg
11068,maximilianhachtmann,m,111,2022-12-11 18:05:07.523474,name found,Maximilian Hachtmann,,1 followers,English and Deutsch,Joined in Apr 2022,"Maximilian is a Transformational Life Coach, working through the lens of Ontology (the study of Being).

He originally studied Sociology with a personal emphasis on the nature of social interaction and philosophy. And along side these explorations, he was deeply interested in the reality of the individual. Taking on individual practices such as meditation, self-inquiry and exploring the Self through various workshops and communities.

It’s that deep interest of reality and perception, that lead him on the path of studying transformational practices and Ontological Coaching.

He works with individuals, leaders and entrepreneurs. Supporting his clients going through transformational phases of their life, as well supporting them to take the action needed to create a deeper and more expressed version of their life....read more",https://users.insighttimer.com/7aon5cH6qrNkZk5gt372O5QzS6n1/pictures/square_medium.jpeg
11069,mikeis,m,111,2022-12-11 18:05:26.147441,name found,Michael Turner,"New Jersey, USA",1 followers,,Joined in Apr 2021,Mike is a 29-year-old male who was born and raised in New Jersey. In previous moments in his life he suffered greatly with Broad-line personality Disorder. Mike was able to find peace within himself through meditation and his mindfulness practice. Today Mike works full-time as a site safety health officer for a federal contractor and also goes to school full-time studying psychology with the goal for his Phd in clinical psychology. Mike loves learning and love giving back hope to others. @mikeis...read more,https://users.insighttimer.com/7p14hvEbVCb1829BcIdjhJ7to2R2/pictures/square_medium.jpeg
11070,maria_markinez,m,111,2022-12-11 18:05:44.864065,name found,Maria Markinez,"Alegría-Dulantzi, Spain",1 followers,,Joined in Mar 2022,"Le invita a la escucha narrando la historia de la vida plasmada en un lienzo. Le ensaña a identificar sus emociones a través del lenguaje de las flores con relajaciones y visualizaciones dando paseos guiados por el bosque, le ofrece relajaciones personalizadas con su situación emocional actual a modo terapia floral. Conseguir aprender y llegar a conocer la relajación es la base de ser capaz de mantenerse para lograr meditar....read more",https://users.insighttimer.com/Lhuz04CRy7eri2CUkwslqjULJiD2/pictures/square_medium.jpeg
11071,spirituallaundry,m,111,2022-12-11 18:06:03.552980,name found,Maria Martinez,,1 followers,English and Español,Joined in Aug 2022,"Healing journeys to release, remember and heal within.  Meditations to see the unseen and hear the unheard. A moment in time to clean your mind and give your heart a chance. Do some Spiritual Laundry for a few every week. Blessings, Maria...read more",https://users.insighttimer.com/F4jTjEwDz5WrspqBHXQgJodhlUU2/pictures/square_medium.jpeg
11072,mallydoesyoga,m,111,2022-12-11 18:06:31.584432,name found,Mallory Miller,,1 followers,,Joined in Feb 2022,"Mallory is a strong believer in the notion that anyone can do yoga, She is a 200hr certified yoga teacher with yoga alliance certification.  Feeling unsure but always wanted to try? Been awhile since you've been on the mat? No worries.  Come join as you sync you breath with your movements in a safe, inclusive environment.

Mindfulness is a passion of Mallory's that she includes in her practice.  Come prepared to open your mind and heart during an all levels welcome vinyasa flow....read more",https://users.insighttimer.com/64F1dwSpGHYanOuemjlI4Ik5AX22/pictures/square_medium.jpeg
11073,marcelgrouxyoga,m,111,2022-12-11 18:06:50.278700,name found,Marcel Groux,"Zürich, Switzerland",1 followers,English and Deutsch,Joined in Sep 2022,"Marcel believes that Authenticity, Balance and Curiousity are of utmost importance in this crazy world. By teaching yoga or as the host of the Health Skill Podcast, Marcel shares these values with you.",https://users.insighttimer.com/ROzT3qFPejgi9rwdgA4mivwteci1/pictures/square_medium.jpeg
11074,heartbodyglow,m,111,2022-12-11 18:07:02.874623,name found,Maame-Mensima Horne,,1 followers,English,Joined in Jul 2022,"Maame-Mensima Horne is a Certified Clinical Hypnotist, Certified Massage Therapist, Usai Reiki Practioner, 200 Hr Certified Yoga Instructor and doctoral student studying Naturopathic Medicine. She is the owner of Heart Body Glow, a heart-centered approach for mind, body, and spirit healing. Her focus is supporting clients to reveal their inner glow by creating space for spiritual and emotional healing....read more",https://users.insighttimer.com/RQ82rLDHaiWU2xaBRzdRSr7cv6f2/pictures/square_medium.jpeg
