,teacher_id,alpha_index,batch_id,scrape_date,scrape_status,teacher_name,location,followers,languages,date_joined,about,image_url
8337,kaisakapanen,k,84,2022-12-11 20:20:05.229383,name found,Kaisa Kapanen,,7 followers,English,Joined in May 2022,"Kaisa Kapanen started her journey in yoga and meditation 10 years ago after a corporate burn-out. She quit her job in the financial services and moved to the Philippines with her husband to host yoga and scuba diving retreats. 

Next to her business experience Kaisa is a certified Life Coach, NLP practitioner and Yoga Teacher (RYT 200hrs and 50hrs Yin).

Kaisa is currently based in the Netherlands, running her Branding and Webdesign business and living with her husband and son....read more",https://users.insighttimer.com/sd3baOtg1tarceNu0K0sX1itlQ12/pictures/square_medium.jpeg
8338,kyle_e_alexander,k,84,2022-12-11 20:20:29.363472,name found,Kyle E Alexander,,7 followers,English,Joined in Jan 2022,"Kyle E Alexander exists to create, care, and cultivate by seeking the highest version of his own self and uplifting everyone in his path along the way. He is grateful to share in the journey of those he comes into contact with. He is a multi-instrumentalist, songwriter, producer, certified life and personal development coach, business owner, and perpetual student of life and growth....read more",https://users.insighttimer.com/5sBVVaBvcUgGvk9s7HrUHfrgoiC3/pictures/square_medium.jpeg
8339,katelyn,k,84,2022-12-11 20:20:36.911280,name found,Katelyn,,7 followers,English,Joined in Apr 2022,"Katelyn is a 500 RYT with a heart centered towards healing, spiritual and emotional growth. Her focus is on therapeutic yoga for trauma. She focuses on yin, as she is also on her way towards becoming a LMBT. The mind, body, spiritual connection is very near and dear to her. She is also certified in mindful resistance training with the Veteran Yoga Project. She hopes too bring a sense of ease, safety and compassion in her practices that she shares with others....read more",https://users.insighttimer.com/ZZF6VJ8nQ5OtarNw1BsLN9hqrlv1/pictures/square_medium.jpeg
8340,katepowersunlockingjoy,k,84,2022-12-11 20:20:44.474500,name found,Kate Powers,,7 followers,English,Joined in Oct 2022,"Kate Powers, MS has a Master's Degree in Exercise Physiology and currently works as a Health Navigator, Group Fitness Instructor, Life Coach, Yoga Instructor and Meditation Leader in the healthcare industry.  Kate as been helping others step closer towards their best versions of themselves through meditation, motivation and movement for over 15 years.  She has helped her clients reach their weight loss and mindfulness goals through positive reinforcement and encouragement. She believes in the whole being approach to health and happiness.   Kate's coaching approach is to help others find their gift and share it with the world.  Kate's gift is sharing joy with others through uplifting mediations to guide them towards finding their fittest, healthiest and happiest versions of themselves.  Kate mediations are short, sweet and always up-lifting.  She provides meditations to relax, de stress and to work towards the best possible version of yourself....read more",https://users.insighttimer.com/C4Z4y6Z4v3h2j8P9G9W1r6L1q5S1L8n6a5m5R7t9h3b0b1j8H9V0B2d3X9K1G1E9w3C3t7D4S5W1N2t6F7W2j3e3S9m2n5R1T6H3/pictures/square_medium.jpeg
8341,karlito,k,84,2022-12-11 20:20:52.139675,name found,Karl Patin,,7 followers,Français and English,Joined in Mar 2022,"Apprendre aux personnes à prendre soin d'elles-mêmes plutôt que de se critiquer est devenu la mission de Karl. Vous améliorerez votre confiance en vous et en la vie pour une vie moins stressante et plus saine.
En tant qu'enseignant MSC ""Mindful Self Compassion"" le programme d'autocompassion en pleine conscience, il saura vous guider pour développer vos propres ressources de guérison.
De plus, il complète actuellement son cursus pour devenir enseignant MBSR. Par ailleurs Karl est professeur de Yoga Vinyasa et de Yin yoga.
Au travers de ses stages, formations et méditations, découvrez toute sa sensibilité bienveillante....read more",https://users.insighttimer.com/jzRQsNIQTgNnnJmd7bRqLi606Dp1/pictures/square_medium.jpeg
8342,yogikim,k,84,2022-12-11 20:21:00.327598,name found,Kim Tull-Esterbrook,"Seattle, WA, USA",7 followers,English,Joined in May 2021,"Kim Tull-Esterbrook is 500 hour level yoga Instructior and mindfulness meditation teacher based in Seattle, Wa. She is certified through the Mindfulness Meditation Teacher Certification Program facilitated by Jack Kornfield and Tara Brach and is a member of IMTA. Kim is dedicated to sharing tools that can help reduce suffering in the body, the mind, and the heart and helping others realize their own capacity to care for the places within them calling out for care....read more",https://users.insighttimer.com/9uWm03Nv9EPwHfxnINyk6jkESVy1/pictures/square_medium.jpeg
8343,katibsh,k,84,2022-12-11 20:21:08.226084,name found,Kati Boijer-Spoof Heikinheimo,,7 followers,Suomi,Joined in Aug 2022,"Kati on (työ)hyvinvoinnin asiantuntija, jonka intohimona on erityisesti ajatustyöläisten palautuminen. Koulutukseltaan Kati on mindfulness-opettaja, PilatesHealth-ohjaaja, KTM sekä Auktorisoitu Personal Trainer (APT) erikoistumisalueina ravitsemus- ja liikuntalääketiede. Hän on myös Etätyön hyvinvointioppaan toinen kirjoittaja....read more",https://users.insighttimer.com/NOAZJ66E1cUVkumqjeUisgtK6UM2/pictures/square_medium.jpeg
8344,katasana,k,84,2022-12-11 20:21:17.085450,name found,Katie Rogers,,7 followers,English,Joined in Mar 2022,"This is your space to feel more connected with yourself; to nourish your mind + body through the many practices offered + develop into the most confident + fulfilled version of YOU. Explore these powerful sessions, to go deeper + hold space for the inner work.
​...read more",https://users.insighttimer.com/ccnnnKzKgRO4SEML0S607kNpWnu2/pictures/square_medium.jpeg
8345,schiraz,k,84,2022-12-11 20:21:26.295934,name found,Kerissa Kuis,,6 followers,English,Joined in Aug 2019,"Kerissa Kuis, MBA is the CEO and Founder of the University of Wellness. The University of Wellness was created to provide consumers with cutting-edge wellness education, services, retreats, and certifications. Kerissa is an inspirational international speaker and coach who works with clients all over the world in all areas of their lives.Kerissa is a regular contributor to Forbes, MindBodyGreen and Huffington Post...read more",https://users.insighttimer.com/X8G3f8p0f8R5Y7A3q8R2v3k3N5a3n9q2C4t9C3J3h7C1p2y7H8Q5D3T0d6p3V6q9y8K7t8A4k0d6v0R8m6P5Y8Z5x1J6s5a7C3R7/pictures/square_medium.jpeg
8346,kvetoslava,k,84,2022-12-11 20:21:49.466588,name found,Kvetoslava Sarvašová,"Košice, Slovakia",6 followers,,Joined in Apr 2020,"Som lektorka mäkkých zručností, mentorka, koučka a lektorka Mindfulness vo výcviku. Dlho som pracovala na top manažérskej pozícii v zahraničných korporáciách. Mindfulness - všímavosť  som objavilla, keď som hľadala bezpečnú cestu von z chronického stresu a celkovej nepohody. Na Slovensku tento vedecky podložený koncept nie je zatiaľ veľmi známy, a preto by som vám rada sprostredkovala nielen informácie, ale najmä Mindfulness meditácie v slovenskom jazyku. ...read more",https://users.insighttimer.com/C3a8v5M2c3g9P0u3h3p2q2P5R1g1s5W3g1Z4J5d5S9c5G2N1g0r1V8a6Z3B4T9Z6h6y9p9z1J1R1W7h1L0Y3g8y2x4Y8S1w3M5s3/pictures/square_medium.jpeg
8347,kirasky,k,84,2022-12-11 20:22:13.369075,name found,Kira Wampler,"Santa Cruz, CA, USA",6 followers,English,Joined in Jan 2021,"Welcome! This is where Kira combines her multiple passions as she guides you to become more empowered, centered, uplifted and calm. Kira spent 15 years teaching environmental education in redwood forests to elementary students. Subsequently, she expanded her skills by becoming certified in hypnosis, Law of Attraction Life Coaching, NLP, EFT and teaching yoga. Experience her unique style and enjoy....read more",https://users.insighttimer.com/Iwx5wlki0qbfV7C0i3VEcUh29ID3/pictures/square_medium.jpeg
8348,yogawithkoah,k,84,2022-12-11 20:22:37.044067,name found,Koah Mascolo,,6 followers,English,Joined in Aug 2022,"Koah is an E-RYT 500, YACEP Yoga Alliance registered instructor. With a degree in psychology and graduate studies in mental health counseling, she have found that everyone has the opportunity to find their best version by taking the time to connect with themselves through breath, movement, and meditation. She is certified in vinyasa, ashtanga, prenatal/postnatal yoga, aerial yoga (level 1 & 2), mindfulness/meditation, yin, and restorative yoga. Yoga allowed her to tap into her strengths and weaknesses. It constantly reminds her to not force things in all aspects of life. It has given her the opportunity to grow stronger and more flexible in body and mind. Yoga is not about how far you can stretch the body, its about how far you can stretch your mind. It all starts and ends with breath. Without an even breath, the rest is impossible. If you tap into your mind, without judgement and stress, you will find a whole new world of possibilities...maybe even touching your toes!...read more",https://users.insighttimer.com/Oxkz92j9VESgINgRQKNCZy5k3hy1/pictures/square_medium.jpeg
8349,readysetmindful,k,84,2022-12-11 20:23:00.290598,name found,Kerri Bicskei,,6 followers,English,Joined in Oct 2021,"As a professional athlete turned licensed mental health counselor, performance consultant, and meditation teacher, Kerri has experienced firsthand how mindfulness and meditation have positively transformed her performance on and off the court. Kerri is committed to sharing her unique style of digestible meditation with high performers who are looking to optimize their performance....read more",https://users.insighttimer.com/8L5544dqLWUqQf9jQHOpOK0Y6mo2/pictures/square_medium.jpeg
8350,kyraluna,k,84,2022-12-11 20:23:07.821405,name found,Kyra Luna,,6 followers,English,Joined in Feb 2022,"Kyra is in the continuous process of her personal evolution and becoming more in touch with who/what she is at her core. And as she is growing in wisdom, love, and clarity, she is here to connect and share in the process with other beautiful beings. She does this through her guided meditations, 1:1 and group containers, oracle card readings, and reiki healing sessions. All of this with the underlying effort in mind—to help unlock all soul's highest potential for expansion and embodiment....read more",https://users.insighttimer.com/erhhZVXnoPey331gN2czL1VnUfA3/pictures/square_medium.jpeg
8351,my_life_my_treats,k,84,2022-12-11 20:23:16.517189,name found,Kersti Kuuse,,6 followers,English and Eesti,Joined in Sep 2021,"Kersti is a ballerina, yoga teacher, TCM student, blogger and writer with a mindful and loving approach to life. She is here to share positivity and knowledge to lead you home - the home inside your body.",https://users.insighttimer.com/4sa0UDZZlJghRCACQMWlYTCb62X2/pictures/square_medium.jpeg
8352,shineyogavb,k,84,2022-12-11 20:23:24.103959,name found,Kacie Steinmetz,"Virginia Beach, VA, USA",6 followers,English,Joined in May 2022,"At Shine Yoga, we promote peace and wellbeing by preparing the body with the practice of asanas, healing the body with the power of our own energy, quieting the mental clutter with breathing and meditation, and carrying our calm confidence off the mat into our daily lives....read more",https://users.insighttimer.com/eLwVuJCTq9NGlN0UljsysIAmZZz2/pictures/square_medium.jpeg
8353,soulriseyoga,k,84,2022-12-11 20:23:32.461957,name found,Kristen Yates,Seattle,6 followers,English,Joined in Oct 2022,"Kristen is a yoga and meditation teacher who is passionate about bringing people to a state of peace, wholeness, and expansiveness within. Trained in yoga and meditation in India, she has traveled the world learning spiritual and healing modalities and gently guides people to reconnect with their inner source of wisdom, intuition, and creative energy within their body....read more",https://users.insighttimer.com/s9J4T7v9A0T8u9C2F7a2f6L7M4B7K4y2f7t5N3U9W8e9b0F4R9p2w4e1K9T0H0e5h9q4H5M2A7C6F2J6U7P2z9n9Y2G4w4c5w3A8/pictures/square_medium.jpeg
8354,mysoreyogaparis,k,84,2022-12-11 20:23:42.713789,name found,Kia Naddermier and Yotam Agam,,6 followers,English,Joined in Jun 2022,"Kia has over 25 years of experience of Ashtanga Yoga and is the main teacher & director of Mysore Yoga Paris. She lives with her husband and two daughters in Paris . She is a dedicated advanced practitioner and teaches Ashtanga Yoga, Pranayama, Kriyas, Meditation and adjustment techniques. She mentors teachers, runs long-term apprentice programs and gives workshops, trainings and retreats internationally....read more",https://users.insighttimer.com/nr6JfhM5NlWAmoeJFzjwi5E3RcK2/pictures/square_medium.jpeg
8355,kristydavis,k,84,2022-12-11 20:23:50.860259,name found,Kristy Davis,,6 followers,English,Joined in Apr 2022,"Kristy is a certified energy healer and meditation teacher. She has been studying and practicing meditation for over ten years. She has spent time studying at the Ka-Nying Shedrub Ling Monastery in Kathmandu, Nepal as well as with Jack Kornfield and Tara Brach in the Mindfulness Meditation Teacher program. Kristy is also a certified Reiki Master and Yoga Instructor....read more",https://users.insighttimer.com/c1T7z9f5q0F7N7D7w4U4y3E7s0b1p3d8E6F4Y9g6m8b8m6K9C3a2L2v5y7w3K3a5H5m3V3W3A7u1G3Z0p8S9a5R9f3G8p4n9e8F4/pictures/square_medium.jpeg
8356,soulqueen,k,84,2022-12-11 20:23:59.186300,name found,Kelsey Hennessey,"Saint Paul, MN, USA",6 followers,English,Joined in Aug 2022,"Kelsey is a transformational mindset coach, meditator, teacher, and yogi that is committed to supporting your journey to become the person you most want to be! 

Kelsey has a bachelor's degree in Urban Education as well as a Master's degree in Curriculum and instruction....read more",https://users.insighttimer.com/5ihuaRPEhcQtZjVYcdplq2ngnay1/pictures/square_medium.jpeg
8357,ohkatylong,k,84,2022-12-11 20:24:08.617551,name found,Katy Long,,6 followers,English,Joined in Oct 2022,"Katy Long is a spiritual creative and student of love, fueled by curiosity and the desire to explore every aspect of the human experience. Katy is trained in the Heart Math method and facilitates heart centered healing through awareness, embodiment, breath-work and a deep connection to the earth....read more",https://users.insighttimer.com/8OVx4vYQnffDAMIlGtK4BhuGaDw2/pictures/square_medium.jpeg
8358,acuyogini,k,84,2022-12-11 20:24:18.719335,name found,KC AcuYogini,,6 followers,English,Joined in Aug 2022,"KC AcuYogini (she/her) is a certified 500 hr. Kripalu Yoga Teacher, Yin & Gentle Yoga Teacher, and a certified 550 hr. Massage Therapist from Hirudaya Holistic Life Center in San Luis Obispo, CA.  She attended classes at the Acupressure Institute in Berkeley, CA as continuing education from 2007-2011.  It was at this school that she found her passion for acupressure and mentored with her teachers to create her unique style of integrating self care acupressure into yoga and meditation....read more",https://users.insighttimer.com/KIixZn3sRUR2lmXBa4weuJokKEm2/pictures/square_medium.jpeg
8359,mentalcoachkev,k,84,2022-12-11 20:24:37.690416,name found,Kevin Cottrell,"Little Rock, AR, USA",6 followers,English,Joined in Aug 2022,"Kevin aka ""MentalCoachKev"" is a full-time Audio Engineer that meditates daily. He
creates Meditation Audios utilizing the elements of nature and binaural beats. He also creates guided Meditations for self improvement and personal growth & development....read more",https://users.insighttimer.com/7fAMpx2fOZcYwN9LzXSnHbtA1UB3/pictures/square_medium.jpeg
8360,kykyrodrigues,k,84,2022-12-11 20:24:45.109231,name found,Kyky Rodrigues,,6 followers,BR. Português,Joined in Sep 2022,Kyky é co-fundadora do grupo Akoma: afromeditação. Também é psicóloga membra da Association of Black Psychologists (USA) e professora de Yoga associada à Yoga Alliance (RYT 500). Durante sua trajetória foi introduzida a práticas meditativas tradicionais através da linhagem milenar de professores dos Himalayas. É performer e atriz do Grupo Pretagô e faz parte do coletivo Atinuké-  sobre o pensamento de mulheres negras.  Atualmente participa do grupo de pesquisas e estudos em Psicologia Africana do Instituto de Psicologia Sankofa sob a supervisão da professora Roberta Maria Federico....read more,https://users.insighttimer.com/yq8jdsPmbuPXubb5LGEJZV5cMer1/pictures/square_medium.jpeg
8361,kiranjot,k,84,2022-12-11 20:24:56.376894,name found,Kiranjot Kaur,,6 followers,English,Joined in Aug 2022,"Vocal Amazon turned Mantra Matriarch, Kiranjot Kaur’s unique voice takes you on a journey across continents.

Kiranjot Kaur is a Vocalist, founding member of Copper Wimmin, Kundalini Yoga teacher, Indian Classical music teacher and a devotee of the Divine Mother. Copper Wimmin were featured on NPR program Democracy Now and their song Bleeding Rivers was featured on the Showtime television series The L Word. In 2006 Kiranjot refocused her career around classical Indian music and spent five years living and studying under the guidance of her beloved teacher Dr. Ustad Narindar Singh in Amritsar, India. From her travels through India to Chile and back she discovered that her favorite thing in this world is using her voice as a call to stillness and healing....read more",https://users.insighttimer.com/vdYfHqlR6mSLNDf4ja3BZd1m9rs1/pictures/square_medium.jpeg
8362,kseniachernova,k,84,2022-12-11 20:25:20.041081,name found,Ksenia Chernova,"Москва, Russia",6 followers,Русский,Joined in Jun 2020,,https://users.insighttimer.com/h9N0M5J1e0G9z8E0N2c1N8W0T5G7p4L7e8F5m8P7Y5T5C4t1f4m7M1H2k2s1h5Q8q3h7p1p2q6S9R9d6q8Q7L1x9j7N6y8a4E0t0/pictures/square_medium.jpeg
8363,medicinalsmiles,k,84,2022-12-11 20:25:44.400473,name found,Kristin V.,"Columbus, OH, USA",6 followers,English,Joined in Jan 2021,"Registered Nurse, Seeker of God, Naturist Influencer & Author

Kristin is a woman rejoicing in the love of spirit and sharing in exaltation with others. By trade, a registered nursing committed to self care and dying with dignity. By passion, naturist influencer, advocate, author, and retreat hostess. In 2020 Kristin self published her first book The Natural Spirit: An Introductory Guide to the Naturist Experience and opened a retreat cabin in Pomeroy, OH to bring the peace of solitude and nature to all who seek it....read more",https://users.insighttimer.com/v4z8T3g1n5F0c1q6h1j1q9q1R0E2T9j7N8q7L1v2t3n3y5e1w0Q2J9Q8A4f4a1R0Z6f6N0v3M5Z4b6p6T2U8S4b2R0K3y3Q4v1d0/pictures/square_medium.jpeg
8364,kimberlywharton,k,84,2022-12-11 20:26:01.149772,name found,Kimberly Wharton,Austin,5 followers,English,Joined in Jun 2022,"Kimberly is an E-RYT 500 certified yoga instructor, specializing in mindfullness, stress management and nervous system regulation. During her 20 year career, she has taught in NYC, LA and Austin, where she now calls home. She has led teacher trainings and both local and International retreats.  You can find here teaching at Cancer Rehab & Integrative Medicine, Flow Yoga and businesses all around Austin,TX. She has been featured in articles in both ‘Backstage Magazine’ and recently in ‘Voyage Austin’.  Her voice has been heard narrating audiobooks, on videogames, and in animation. For more on Kimberly, check out: KimberlyWharton.com...read more",https://users.insighttimer.com/T1u1T2r5j5n4b6a1B2a2p8D4E9S1G1w5X9p3c3E6u6Q7e4a1L1d2H4u7j2B4W2w8Z4M7U5s5e8r2E4r6q9f5y7y6e1g2M3g1p7G5/pictures/square_medium.jpeg
8365,karinearshakyan,k,84,2022-12-11 20:26:24.750189,name found,Karine Arshakyan,,5 followers,English and Русский,Joined in Jul 2022,"Karine is a certified art therapist, life coach, healer with ""Co-Hill"" International (Created by Joe Dispenza). She's also a certified teacher in special education and art. She's very involved in practices related to personal and spiritual growth. She attend week-long retreats with Joe Dispenza, a week long ""summer expedition"" with Wim Hoff (Iceman) in Spain, a year long program (A Year of Miracle) with Dr. Sue Morter, breathework workshops, and many others. She works with all ages....read more",https://users.insighttimer.com/RtY4eZ3Q00aIHYvTEjulx67xjZk1/pictures/square_medium.jpeg
8366,kalyapnina,k,84,2022-12-11 20:26:32.268398,name found,kalya pnina,,5 followers,עברית and English,Joined in Sep 2021,".מזה 15 שנה מנחה סדנאות מיינדפולנס ושחרור ממתח בעירית ת״א ובקהל הרחב
.עוסקת בעשור האחרון באימון פרטני, זוגי משפחתי - דרך תקשורת מקרבת ומודעות עצמית 
לאורך השנים עסקתי ב‬חקר החשיבה ‬ועבדתי ‬עם‭ ‬כאב‭ ‬רגשי‭ 
במגזר‭ ‬הפרטי, באוכלוסיות‭ ‬מוחלשות בעיריה ובעמותות...read more",https://users.insighttimer.com/s0M7q4Q8S1k3v2A8v6e1a5C7J1v3k2K0C6G1k0t0p4q0U5n9Q2t6c7f7W9K1D4t3G3V8H1n3S7G1U0y4J3G3C8T6K4W6h7x1r7b8/pictures/square_medium.jpeg
8367,kristakubikyoga,k,84,2022-12-11 20:26:57.333838,name found,Krista Kubik,,5 followers,,Joined in Jun 2021,"Krista Kubik is here to help you discover the magic of yoga with in you!  She is a 500hr. Certified Yoga Teacher, Certified Holistic Health Specialist, and Yoga Teacher Trainer/Mentor
Her passion is helping people discover themselves and heal through the lens of Yoga. 
Krista's classes are innovative, combining creative and intelligent, sequencing with inspiration and soul
We Move, We Breathe and We Meditate.  
You can count on leaving her classes feeling grounded, inspired, refreshed, balanced!...read more",https://users.insighttimer.com/5cUngke4rlg0NE9kuRboRfZfZoI3/pictures/square_medium.jpeg
8368,meditariinstitute,k,84,2022-12-11 20:27:05.230691,name found,Kristen Selman,"Atlanta, GA, USA",5 followers,English,Joined in Jan 2022,"With over 30 years of meditation experience, Kristen Selman, is an avid practitioner and teacher of a specific meditation style known as Creative Meditation, a discipline that she has utilized for over 17 years to help her and other members navigate through the labyrinth of life.  Through Creative Meditation, she helps others tap into their intuition and inner energy to manifest their goals, while bringing more peace and balance into their lives. ...read more",https://users.insighttimer.com/3ulnqju32OfcATmI2F0yq9lelSO2/pictures/square_medium.jpeg
8369,kiannasteadman,k,84,2022-12-11 20:27:13.670306,name found,Kianna Steadman,,5 followers,English,Joined in May 2022,"Kianna is the creator of the Now and Here mindfulness blog and the mindfulness workbook ""My Autobiography."" Kianna's mission is to help others live from a foundation of daily joy. She teaches others how to live mindfully and incorporate meditation into their everyday life. She helps you trade worry for wonder, one day at a time. 

Certifications: RYT-200
Meditation Teacher-Yoga Alliance 141 hrs...read more",https://users.insighttimer.com/YG6N2ghNJ6PkGRAc3qwbHUwl8pw2/pictures/square_medium.jpeg
8370,kortneysharanya,k,84,2022-12-11 20:27:26.621829,name found,Kortney Sharanya,"Scotland, UK",5 followers,English,Joined in Aug 2020,"Kortney Sharanya is a spiritual guide and past life regressionist. She has 12-years of experience within wellness and spirituality and shares her love of bringing more love, light and relaxation into your day through meditation and yoga nidra....read more",https://users.insighttimer.com/IQXX6hWZrfOWWko7uIqoBsZhlQ23/pictures/square_medium.jpeg
8371,kavehmonshat,k,84,2022-12-11 20:27:34.332901,name found,Kaveh Monshat,"Melbourne, Australia",5 followers,English,Joined in Jun 2021,"A doctor with a background in molecular biology, Kaveh now works intermittently as a relief psychiatrist in remote Australia. A practitioner since 2007, he is focussed on (self)compassion and non-violent communication. He is deeply grateful to Thich Nhat Hanh; Jon Kabat-Zinn; Robert Gonzales (NVC); and the late SN Goenka. Retreats: 2 years Plum Village; several silent retreats incl. 3 months in IMS. Qualifications: MBSR Teacher; PhD & university appointment in Mindfulness Training....read more",https://users.insighttimer.com/x8s3x6d6P7W1y3c9a2a2A1x8g3N6Z4k9C6n1B0Z5R7j2h9M4j4u0q1d7d0q8f1N4e4C2G2x8p3Z9Q2u2C2f9s4T8j0Q0X6z5Q9w6/pictures/square_medium.jpeg
8372,missfit.wellness,k,84,2022-12-11 20:27:43.774338,name found,Krissa Olson,,5 followers,English,Joined in Oct 2022,"Krissa is a nationally certified wellness coach and group fitness instructor. She is the creator of the podcast Missfit Wellness where she covers wellness topics in easily digestible episodes and encourages listeners to accept their imperfectness. She works with people on living a well balanced and whole hearted lifestyle that follows their intuition and energy. In this space, she invites you to be exactly who you are in this moment and to find your meditation practice, just that, a practice....read more",https://users.insighttimer.com/Vl3KLKKchcTCncf8ylPUdRefc6e2/pictures/square_medium.jpeg
8373,katharinadix,k,84,2022-12-11 20:27:56.385042,name found,Katharina Dix,,5 followers,Deutsch and English,Joined in May 2022,"Hallo, ich bin Katha. Ich bin Ayurveda Coach, Yoga- und Meditationslehrerin. Mir liegt es am Herzen, dass so viele Menschen wie möglich wieder zu ihrer Natur und in ihre eigene Balance finden. Mit meinen Meditationen möchte ich auf diesem Weg ein Stück helfen....read more",https://users.insighttimer.com/hQqSwfljkNgtfSJFPC15QZAdZs13/pictures/square_medium.jpeg
