,teacher_id,alpha_index,batch_id,scrape_date,scrape_status,teacher_name,location,followers,languages,date_joined,about,image_url
14074,sarahstarling,s,141,2022-12-12 08:18:41.977604,name found,Sarah Gravely,"Charleston, South Carolina, United States",25 followers,English,Joined in Jun 2021,"Sarah Gravely is a workplace wellbeing advisor works and wellness consultant who works with businesses to create multidimensional, research-based well-being programs. She is a seasoned industry thought leader who utilizes her expertise to curate tailored wellness approaches, spark wellness awareness, and achieve business goals. She is a Certified Workplace Mindfulness Facilitator and a member of the Workplace Wellbeing Initiative with the Global Wellness Institute....read more",https://users.insighttimer.com/Q2L3E8u3V6c5b5x0p8H6E7y6c3F3z4a7P2N6r5k0r9A6u2z6K1d6L4n5n7n2B1E8q6u5y7w2h2s6R9R9F7e1k5u6G2w5F8S6t5G8/pictures/square_medium.jpeg
14075,shareejohnson,s,141,2022-12-12 08:19:05.240124,name found,Sharee Johnson,"Melbourne, Australia",25 followers,English,Joined in Oct 2021,"Sharee is a registered Psychologist and Executive Coach. She considers mindfulness the most effective way to bring sustained change and focus to life. As a mindful practitioner she brings a deep understanding and lived experience of the power of presence, supported by a depth of experience and accreditations. Integrating mindfulness into her coaching practice enables Sharee’s clients to benefit from a growth mindset and improve their performance and their wellbeing....read more",https://users.insighttimer.com/diere9QzQMWc1numFIdTaq9G1Ji1/pictures/square_medium.jpeg
14076,spa-cio,s,141,2022-12-12 08:19:30.174633,name found,Spa-Cio de Sanación Eterica,"Guanajuato, Celaya, Guanajuato, Mexico",25 followers,Español,Joined in Mar 2019,"Hola sean bienvenidos yo soy su amiga Krys Arredondo, quiero decirte que soy maestra Reiki y que voy a compartir contigo algunos métodos de sanación que puedes hacer en ti, también en este espacio encontrarás meditaciones para conectar con tus ángeles y podrás encontrar gran variedad de meditaciones y charlas que te ayudarán a tu crecimiento espiritual, espero próximamente incluirte cursos con contenidos esotéricos que aporten cosas positivas para ti...read more",https://users.insighttimer.com/W5W9T7p6j7S3j7D8J8K7k0j8s0T4z0q3s5A6S1R0V9b8T6F3G5q9L4k3K4q4d0B4D2F2S3U6t9s3B2u6w0K5S6U1z1n6r0K9C0x6/pictures/square_medium.jpeg
14077,sonyalee,s,141,2022-12-12 08:19:37.547198,name found,Sonya Lee,"Huntington Beach, CA, USA",25 followers,English,Joined in Jun 2021,"Having experienced burnout, loss of life direction, Sonya left behind a 25-year career as a C-level executive and became a Self-Love Guru. Growing up in a monastery as a young child, Sonya deepened her spirituality and now works with people to help them discover their life’s purpose and passion by reawakening the art of mindfulness, intention, compassion, and empathy. As an intuitive channeler, Sonya also channels information on self-love from a cosmic energy named Chiron....read more",https://users.insighttimer.com/mYBHqDvmbKg3d7Y0z42Epo2EYVh1/pictures/square_medium.jpeg
14078,sleepyturtlerecords,s,141,2022-12-12 08:20:01.072251,name found,Sleepy Turtle,,25 followers,English and Deutsch,Joined in May 2022,"The music of Sleepy Turtle Records' is all about telling a story and shaping the perfect atmosphere around it. Every note within every melody is carefully chosen, bringing the story down to the essence of what they want to tell the audience. Every rhythmical pattern serves to carry those melodies and set the mood for the story, creating the perfect sound for relaxation, stress relief and deep sleep....read more",https://users.insighttimer.com/Vunu7GXWuVW2RzmlD6qMxgCGQuy2/pictures/square_medium.jpeg
14079,sintoniadealma,s,141,2022-12-12 08:20:24.700084,name found,Sintonia de Alma,,25 followers,BR. Português,Joined in Mar 2021,"Amigas sintonizadas pela alma, em busca contínua de autoconhecimento, crescimento pessoal, autocuidado, cuidado com o próximo de forma integral e desenvolvimento social.
Aline é Terapeuta Transpessoal e Comunitária. Tainá Porã é Sound Healer e Terapeuta Integrativa.
Oferecemos meditação, atendimentos individuais e trabalhos em grupo....read more",https://users.insighttimer.com/MMv4oGa3xoaYlJqVXuS5GgFTXzi1/pictures/square_medium.jpeg
14080,shellyrudolph,s,141,2022-12-12 08:20:39.230921,name found,Shelly Rudolph,,25 followers,English,Joined in Aug 2020,"Singer, songwriter, poet, soul siren. That's who I am. I've been on a quest, pursuing my passion for living fully: body+soul, for as long as I can remember. I know I will be on this journey for the rest of my life - sharing my song and my soul with those near and far. 

It is my great joy to meet you here. ...read more",https://users.insighttimer.com/DVbviZyIEdTxfEtiPSblp4WuQb12/pictures/square_medium.jpeg
14081,sabrinasundari,s,141,2022-12-12 08:21:03.148364,name found,Sabrina Sundari,"Toronto, ON, Canada",25 followers,English,Joined in Jan 2022,"I facilitate energetic completion of trauma through guided 1-1 Journeys and Regression Therapy. I come from a lineage of healers, and have been called into service as a Guide in this lifetime. 
​
I am a certified Hypnotherapist and trained Clairvoyant. I have dedicated my life to supporting the positive transformations of those around and working with me.
 
Like most people who were meant to help others, I have emerged from an adverse childhood, and the resulting repetitive patterns and karmic loops. I have done over a decade of intensive work to integrate my inner child, untie the bonds of other people's stories, and heal ancestral trauma....read more",https://users.insighttimer.com/b7W8g0R5T1M9s5c0A4V2L8t5M5h1e8H5N4j7p4V5b8X4p3e2d1j0s9D3Z3v5s5q1m4W4f0K3K1w1v7P1G2D6V3Q7t2x2e1b0e8E0/pictures/square_medium.jpeg
14082,svetnala_nagorodnaya,s,141,2022-12-12 08:21:26.815113,name found,Svetlana Nagorodnaya,"Naro-Fominsky District, Russia",25 followers,Русский,Joined in Dec 2020,"Прожила очень тяжелый развод, потеряла все смыслы в жизни, которые создавала. За 2 года создала себя по кусочкам и открыла свой центр гармонизации личности в Киеве. Уже 10 лет создаю и провожу обучающие программы для женщин. Красной нитью во всех моих обучениях идут женские практики, которые восстанавливают ваш ресурс и дают силу для дальнейшего роста по жизни.
Иногда Боль может сломать человека, но боль можно сделать своим союзником и использовать, как ресурс по жизни....read more",https://users.insighttimer.com/IIyvLfnRyVglfxQtpMaxt7mYYKy1/pictures/square_medium.jpeg
14083,sara-k-brown,s,141,2022-12-12 08:21:34.804062,name found,Sara K Brown,"Washington D.C., DC, USA",25 followers,English,Joined in Jan 2021,"Sara came to yoga and meditation as modalities to mitigate chronic stress that was resulting in negative impacts on her health. After a relatively short period of practice, experiencing the benefits, she decided to deepen her practice through an MBSR course and yoga teacher training, earning a Yoga Alliance RYT-200 credential. Sara is now in 100-hour meditation teacher training to be of better service in facilitating and guiding meditation practices and has recently started You Are Here LLC focused on learning to live in the present moment through the mindful practices of yoga and meditation....read more",https://users.insighttimer.com/Vxg3rP8qORehxBxXxs0QNO2BE3w2/pictures/square_medium.jpeg
14084,psksaygin,s,141,2022-12-12 08:21:58.652519,name found,Seyit SAYGIN,"İstanbul, Turkey",24 followers,Türk,Joined in May 2020,"Psychologist and Lifetime learner.

Merhaba ben Psikolog Seyit SAYGIN

Bolu Abant İzzet Baysal Üniversitesinin Psikoloji bölümünden mezunum. Özel olarak:

stres yönetimi,

ilişki sorunları,

depresyon ve

anksiyete üzerine odaklanmaktayım. Danışanlarımla Bakırköy’de bulunan ofisimde veya online olarak görüşmekteyim.

Psikolojide bulunan birçok ekolden Bilişsel Davranışçı Terapi ekolüne yatkın ve bu konuda eğitimliyim.

Aldığım diğer eğitimler şu şekilde sıralanabilir:

Spor Psikolojisi

Davranış Analizi

Yönetim ve Liderlik

Endüstri Psikolojisi

Psikofarmakoloji

Öğrenme güçlükleri...read more",https://users.insighttimer.com/N3G0A3t3j6F3U0v4N8j1j2R3n5Y9s6E4n9p9M6j9E7r7s5T5A7R4Q9V3d8P6h3D4A0y3j1k4w6d3a1L9M2K7z3d4S0Q4m9L3T9j7/pictures/square_medium.jpeg
14085,smoralesjr,s,141,2022-12-12 08:22:06.377479,name found,Samuel Morales Jr.,"New York, NY, USA",24 followers,English,Joined in Apr 2021,"Samuel has been a meditation practitioner since 2009 and has practiced in the Korean Zen, Tibetan, and Insight traditions. He is a graduate of the mindfulness and compassion meditation teacher training program at The Path, and is currently in the third and final year of the Home Study Dharma Course by Kagyu Samye Ling Monastery....read more",https://users.insighttimer.com/W1Q1f8c1B1y1U9g6r2T9J6E0R8Y3r8w6F2T2R9h6N7z4R6u6v8F1j9J7y8S9g6j3b4z9U6D2D5H9u2H1R7x2N6U5w1A0p8E9L0Q5/pictures/square_medium.jpeg
14086,shrita,s,141,2022-12-12 08:22:30.810541,name found,Shritamurti Saraswati,"Les Abrets, Les Abrets-en-Dauphiné, France",24 followers,English and Français,Joined in May 2020,"Believer in self-empowerment and self-knowledge for us to better view and understand the world and universe all around us. 
Inspired by slow living and somehow a bit minimalistic too. 
Yoga teacher and Reiki healer and very much into essential oils and aromatherapy.
Shritamurti is delighted to get to share some Pranayamas, Meditation practices and Yoga Nidra on the platform.
Hari Aum....read more",https://users.insighttimer.com/S8t1y8Z8Z5x1A3C1y4n4Q9t1A3K4k2k4Z7W6A1W5W9v7Z5z6t0b5b0K7t8G0E2Z4j7E6V2Q4n9V6a9a3c0N4h7R8z7t6d2L6e3S6/pictures/square_medium.jpeg
14087,sarahcapua,s,141,2022-12-12 08:22:54.373811,name found,Sarah Capua,NY,24 followers,English,Joined in May 2021,"Sarah Capua is a dedicated Yoga Therapist, lay Buddhist chaplain, and spiritual caregiver, rooted in the tradition of Yoga and grounded in the practice of Zen Buddhism. Her hope is to be a compassionate and curious support for others on the path, to bear witness and make meaning, and to hold a mirror up to our embodied wisdom which can be a companion no matter where life takes us.  ...read more",https://users.insighttimer.com/a9c1s0J8x5X7H2s4e8X0m9h7b1a8T1z5Z7n8C2H8M0Q2N0V3V1H3Q9k0t1j3k1X6r3c9a3x4w7F8C7G7J0G9j2P0n6T0D4M9W5E5/pictures/square_medium.jpeg
14088,susie,s,141,2022-12-12 08:23:02.317005,name found,Susie Spinks,,24 followers,English,Joined in Nov 2020,"Susie Spinks discovered first-hand the transformational effect of a regular meditation practice. She then became interested in the science behind meditation, and what is happening in the brain and body when we meditate.

Susie is an accredited meditation teacher with the Meditation Association of Australia. She currently teaches Mindfulness and Meditation classes and Teacher-Training in Sydney and online.
...read more",https://users.insighttimer.com/r64bdyYNmURVnUQ9lRhzJOqKLSs1/pictures/square_medium.jpeg
14089,kojyu,s,141,2022-12-12 08:23:26.638265,name found,Shaku Kojyū,"Benbow, CA, USA",24 followers,,Joined in Aug 2019,"After 10 years of training at Rinzai Zen monasteries in Kyoto, Kojyū Osho has been the Abbot of Daishu-in West since 2018.",https://users.insighttimer.com/y6Y7p9q4G0B7E8w4k7y8f0a3E5n7S6N0T0D8X4h1N9E7U5S5c3d8Q4u8e0B3R5s1z8p8N4F8t5r8Q0b0G6g6G4F4z8F0p0w8K4Z6/pictures/square_medium.jpeg
14090,zun,s,141,2022-12-12 08:23:51.595714,name found,Susanna Godee,"Uppsala, Sweden",24 followers,Svenska,Joined in Apr 2021,"Susanna is a yoga teacher driven by curiosity to explore what is a human. She is leading Uppsala Yogaskola, one of the first yoga schools in Sweden (established 1981). She has her roots in the Satyananda yoga tradition with 400+ h yoga teacher training. Other trainings include mindtrainer, personality psychology, Enneagram model. Her clear and calm voice leads with conviction and warmth to inner stillness and spiritual depth. Teaches both in English and Swedish....read more",https://users.insighttimer.com/ZW6pu01aBQbE8Kp43F7cQX7LVKh1/pictures/square_medium.jpeg
14091,yogasheron,s,141,2022-12-12 08:23:59.144753,name found,Sheron Jutila,"Comox Valley, BC, Canada",24 followers,English,Joined in Aug 2020,"As a teenager Sheron discovered the calming benefits of meditation & excitedly began sharing this with her friends. Shortly after, Sheron found the stress-reducing benefits in a physical practice of yoga (asana). She's been practising for 30 years & (certified) teaching classes for 17 years, yet she is still in awe of the new things that she (& her students) discover every time they step into practice. Knowing that she will never know everything about these practices keeps her excited, receptive & aware. ...read more",https://users.insighttimer.com/y2b7p1w7G5J0z5Y4P4J9s2t3Z4z5q3J3F1v8p8X9Q1W8R4f9c4D8H6H0y6e9y2J7t1Q9y6k3B5P0d5X0X0N3q1w7v8F8J2a3e4e8/pictures/square_medium.jpeg
14092,satya,s,141,2022-12-12 08:24:08.819069,name found,Satya,"Hoboken, NJ, USA",24 followers,English,Joined in May 2020,"Satya has been teaching yoga and meditation since 2006. He brings humor, real-world spirituality, and a rebel's flair to his teaching. He is a 500 E-RYT through Yoga Alliance. He has been initiated into Babaji's Kriya Yoga since 2003 and is an Osho sannyasi since 2006....read more",https://users.insighttimer.com/Y3E0r5N3m6J7k5V4w0m2b7P8u0g0V6r8d9S5p9g5A2T5N0m2b8Q9U5d8H4Z0F0R3w3S2P6t5M5m1r8t6n3C3j1H1g6q9z6z0j9G3/pictures/square_medium.jpeg
14093,shelbeymoon,s,141,2022-12-12 08:24:32.904079,name found,Shelbey Moon,"British Columbia, Canada",24 followers,English,Joined in Jan 2021,"Shelbey helps ambitious biz babes maximize their time and remove the self-doubt that inhibits them from taking inspired action. Using the ancient wisdom of the menstrual cycle, lunar cycle, and seasonal cycles she helps you learn how to navigate your unique energetic cycles in order to achieve more with less effort in your business....read more",https://users.insighttimer.com/Z0R7h6d0e6A6D8n7S2D1q1e6H7F2S0w7s4G2v0c7L8B1h5T6C5Q4s1C7k9e0R7W7R6g6q4a5X3J2d3a3r4V8d5P9z3G1P6T4m4r7/pictures/square_medium.jpeg
14094,acedis,s,141,2022-12-12 08:24:56.509619,name found,Sergey Pogorelov,,24 followers,English and Русский,Joined in Oct 2021,"Acedis is a conceptual musical project by Russian performer and composer Sergei Pogorelov. 
The creativity of the ""Acedis"" project does not fit into the framework of one music or project. He sees and hears music in the synthesis of the arts. For him, music is, first of all, freedom of flight and space for creativity. This music gradually captures the heart in silence, captivating, creates indescribable feelings and images in which you want to plunge into the ocean with a full head....read more",https://users.insighttimer.com/cmhdf9gauvgV4MqHdiOnUXo7GLs1/pictures/square_medium.jpeg
14095,samanthatyler,s,141,2022-12-12 08:25:04.795912,name found,Samantha Tyler,"Nebraska, USA",24 followers,English,Joined in Jun 2021,"Samantha is a certified meditation and transformational mindset coach who enjoys helping emotionally exhausted women find the courage to reclaim their souls, power, and purpose by creating an intimate relationship with themselves and speaking their truth.

She is a cancer survivor and Lyme disease warrior who chooses to live her life with intention, alignment, and balance.
...read more",https://users.insighttimer.com/nEf4PiXjAaMxR8foz8TkY5TW1lE2/pictures/square_medium.jpeg
14096,suzannealyssa,s,141,2022-12-12 08:25:29.169521,name found,Suzanne Alyssa Andrew,,24 followers,English,Joined in Aug 2022,"Suzanne is an author, literary editor and writing coach who guides writers like you to write with the energy and frequency of your soul. Whether you're exploring creative expression or a seasoned pro, she'll show you how to create with more clarity, courage, ease, joy, light and love....read more",https://users.insighttimer.com/GFizeFdavIawm1apTJJIoxs2vgz2/pictures/square_medium.jpeg
14097,shantijoseph,s,141,2022-12-12 08:25:52.886081,name found,Shanti Joseph,,23 followers,English,Joined in Apr 2022,"Shanti is a born mystic. Her efforts have been to draw consciousness and healing into the world through music, spiritual dream exploration, and retreats.  She has for many years been a force for Love through talks, retreat guidance and walking with those who wish to commit to following the Light. Besides the subtle intuitive knowing, she has a vast and grounded knowledge in depth-psychology and practical psychotherapy as practitioner and post-graduate lecturer/trainer. She has conducted research into dream work and spoke at international conferences on the topic. Her approach embraces both inner expedition and lived spirituality. Her retreats and workshops encompass various levels and lengths, from half days to 40-days. Online events include Peace-sessions where she shares divine inspirations and healing practices which guide individuals towards inner harmony.

*ShantiPaul, is a collaboration with Paul, who lends his magnificent voice to the esoteric teachings extended through Shanti....read more",https://users.insighttimer.com/XKc5SEbHUsc5CwaR1TmHWD2PPzQ2/pictures/square_medium.jpeg
14098,shaktiloka,s,141,2022-12-12 08:26:16.550478,name found,Shakti Loka,"Moscow, Russia",23 followers,,Joined in Sep 2020,"The Moscow duo Shakti Loka is a synthesis of gentle acoustics, dynamic indie, melodic trip-hop and captivating vocals. In their songs, the group skillfully twined together conceptual lyrics, filigree guitar passages, sacred mantras and enveloping ethnicity.

Their songs are played on more than 30 radio stations. Although the band appeared only 3 years ago, there is already a debut album, ""You know?"", 5 singles, 7 clips in his creative achievements.

...read more",https://users.insighttimer.com/XZwGe2klDGM0glkk3Zv0celeQ5O2/pictures/square_medium.jpeg
14099,tranquil_led,s,141,2022-12-12 08:26:40.116221,name found,Stephen Baines,"Doncaster, UK",23 followers,English,Joined in Jul 2020,"Having held my own personal practice for over 12 years, I decided to explore becoming a teacher in 2016. I started with the Search Inside Yourself Leadership Institute, becoming a Certified Teacher in 2019. I have taught >100 sessions whether large-scale in-person workshops, smaller online workshops or guided meditations. I am now extending my expertise through a Masters in Psychology & Neuroscience and training alongside Jack Kornfield & Tara Brach through their Certification Program....read more",https://users.insighttimer.com/f0H8n4P0T8V3a6t3L0Q3B2S1T4z6s3b4N4A7L8g9z6e0j3W7T8z5T5C2A1e0a8x3M5e4B6H6z9N8L1h6n4s2Z6m1z8F8N2M9u8d8/pictures/square_medium.jpeg
