,teacher_id,alpha_index,batch_id,scrape_date,scrape_status,teacher_name,location,followers,languages,date_joined,about,image_url
11075,aradya1111,m,111,2022-12-11 18:07:21.626536,name found,Mariana Telias,"New Jersey, USA",1 followers,English and Español,Joined in Sep 2022,"A kind soul trying to connect to her highest self through spirituality . Searching for her path in this place we call earth. Connecting with the source of energy that is all around. Guided by her spirit counsil to deliver a transcendent experience for the audience to enjoy . A journey through time and place. An experience like no other. A soul connection between teacher and student. A passage through the deep divine spiritual realm. Something to help ease worries, anxieties, negativities and so help relax the mind....read more",https://users.insighttimer.com/euH02aUgcsPVNXGPwiCPF5GdoWv2/pictures/square_medium.jpeg
11076,bloomsoundtherapy,m,111,2022-12-11 18:07:40.328550,name found,Marina Bloom,,1 followers,English and Deutsch,Joined in Nov 2022,"Marina Bloom shares harmonies and vibrations for deep transformation and relaxation. Bloom Sound Therapy uses loop meditation through sound baths supporting the cells of your body to let go. This sound technique helps you heal, gain clarity and bloom!...read more",https://users.insighttimer.com/Uv9oAlmv0oUecYtZhkehoNH5oxR2/pictures/square_medium.jpeg
11077,yogayuktaatma,m,111,2022-12-11 18:07:59.005007,name found,Maria Sara Intoccia,"Latina, Province of Latina, Italy",1 followers,English and Italiano,Joined in Oct 2022,"Yoga means Union.
This is a safe-space based on inclusiveness. 
You are fully accepted as you are.

Pranayama, Meditation, Asana",https://users.insighttimer.com/9sEOHRXeRrhr62dl7nxLHpnL3cq1/pictures/square_medium.jpeg
11078,her_source_intuition,m,111,2022-12-11 18:08:17.663436,name found,Mandy Brendish,,1 followers,English,Joined in Apr 2022,"A qualified Intuitive Intelligence Trainer, Reiki Maven, Yoni Massage Practitioner and two times best selling author, Mandy has, for over 20 years, been honing her craft as a Priestess of sacred women's medicine, a mentor and coach, capable of holding her women in the most powerful of sacred energy.

Mandy create safe spaces for Women to journey through the underworld, to burn away all that is not truth and emerge with the knowledge of who they are within their soul. Bliss, pleasure, power and freedom....read more",https://users.insighttimer.com/42eONsmIDOQv7qmKCcynChfiqvy2/pictures/square_medium.jpeg
11079,maartenschuchard,m,111,2022-12-11 18:08:36.475690,name found,Maarten Schuchard,"Valkenswaard, Netherlands",1 followers,Nederlands and English,Joined in Oct 2022,"Maarten is a Holistic Coach and Producer of Meditation and New Age Music for Mind and Spirit. Maarten is a creative artist with the goal to make the world a little bit nicer. Maarten loves to receive feedback, so don’t hesitate to contact him for any feedback or ideas....read more",https://users.insighttimer.com/xcO1hGVxHSbvKzQJDORgdgoDz8v2/pictures/square_medium.jpeg
11080,melissaxu,m,111,2022-12-11 18:08:49.181577,name found,Melissa Xu,,1 followers,English and 普通話,Joined in Apr 2022,"Melissa is a Yogi who seeks healing, awakening, and liberation. She believes all spiritual teachings are ultimately talking about the same truth. The truth is within ""I AM"".
After intense suffering, Melissa discovered meaning from tragedy, and found peace and wisdom from within....read more",https://users.insighttimer.com/oiKElZuLaZUiiBHPoytSoAJmyZl2/pictures/square_medium.jpeg
11081,maggmoves,m,111,2022-12-11 18:08:51.781086,name found,Maggie,,1 followers,English and Español,Joined in Nov 2022,"Maggie is an actress, dancer, choreographer, and teacher based in Washington, DC. She started her meditation and yoga practices when she was 12 years old, and is very grateful to be able to share them with the internet!",https://users.insighttimer.com/t7P9A6S2c8j2F1p5S6C4m3g0B5A5p4E6u7U1z1V6b0S1V9a4Z9Y6s7A1Y1a3e6F2x2S3K1H9k7Y2a3e5R6H8m4X1w7S3q9a2n5H2/pictures/square_medium.jpeg
11082,innersoulsmile,m,111,2022-12-11 18:08:54.583335,name found,Marleen Hermann,"Dún Laoghaire, Dublin, Ireland",1 followers,English and Deutsch,Joined in Nov 2022,"Yoga is the passion of Marleen and she teaches with authenticiy and all her heart. She qualified in December 2019 as a yoga teacher in Piha (New Zealand) and had been teaching since. 

Her main objectives for her students are that they reconnect with their body and feel good i side and out. 

Her teaching styles are: Hatha,  Yin,  Yin and Yang and Vinyasa. Each of her class includes breath work and is finished with a beautiful meditation including affirmations.

She believes yoga is a life style and once you decide to follow the yogi part life unfolds it's beauty. 

Marleen is looking forward to welcome you in her class.

Namste...read more",https://users.insighttimer.com/zqGnKo6JsFRgfG3rK8TAyflDT9N2/pictures/square_medium.jpeg
11083,activemamacoach,m,111,2022-12-11 18:09:13.340756,name found,MJ Outnumbered Mama,,1 followers,English and 普通話,Joined in Aug 2022,"Dr MJ is the Active, Healthy Outnumbered Mama of 3 who supports other mums as a holistic exercise & nutrition coach. She runs an online coaching membership that supports mums to make health enhancing habits without focus of the numbers on the scale. Since her personal health event which changed the way she views and approaches health, she has been practicing meditation and hopes to help other mums enjoy a sense of peace amongst the loving chao of motherhood....read more",https://users.insighttimer.com/nxlfS99gehR7Ct4Ls1zyLBSolYK2/pictures/square_medium.jpeg
11084,acuphealing,m,111,2022-12-11 18:09:16.451860,name found,Marcy B. Newman,"Honolulu, HI, USA",1 followers,English,Joined in Dec 2022,"Dr. Marcy is an iRest Yoga Nidra Certified teacher, Caritas Coach, RYT-200 Yoga Instructor, an acupuncturist and also a Registered Nurse. She feels great joy helping people on their journey to well-being.",https://users.insighttimer.com/D5c4X3D7p3a3q8N6p8P6M8j3L7j2u5g0G9Q3S9a3F6M2f6H1D5d1U1S3z3n4s2y1N7q0g0q7P7b2t8H7n7q1T5n5W3a6v6D8A5v6/pictures/square_medium.jpeg
11085,mimirswell,m,111,2022-12-11 18:09:35.238596,name found,Mimir's Well,,,English,Joined in May 2022,"Mimir's Well is a project that focuses on meditation , discussions of esoteric practices and beliefs and paganism and all forms of spirituality. Mimir's Well is also a YouTube channel that has a variety of meditations around ancient Gods....read more",https://users.insighttimer.com/Ib0rWkW8sxPMP9huQakgBaHaqWn2/pictures/square_medium.jpeg
11086,mindfulmike,m,111,2022-12-11 18:10:04.013051,name found,Mike Van Cauter,,,English,Joined in Jul 2021,"Mike has a dynamic style of teaching involving a mix of Hatha, Vinyasa & mindfulness in order to make movement and meditation accessible to a wider audience. His approach is having an element of fun, adventure and curiosity of ""why"" in our practise in order to sustain a consistent habit. 
Yoga has taught him more than just being a yogi on the mat, but also how we mindfully uphold the same principles of yoga philosophy off the mat which serve as an inspiration behind his teachings....read more",https://users.insighttimer.com/xpSgTlrUYZYPF84CaDHEctOCxxf1/pictures/square_medium.jpeg
11087,melissacugini,m,111,2022-12-11 18:10:22.599143,name found,Melissa Cugini,,,English,Joined in Feb 2022,"Melissa Cugini has been a certified Yoga Instructor since 2008. She has experience instructing yoga and meditation practices with individuals of all ages and abilities in a variety of settings and believes that yoga has something to offer to everyone! Melissa is happiest when she is active and outdoors, enjoying hiking, golfing or horseback riding. When being outside isn’t an option, a good book or a puzzle and a cup of tea will do just fine!...read more",https://users.insighttimer.com/tmoC5xVZ2XfqW0hgtYpF8MvXxP43/pictures/square_medium.jpeg
11088,thebarefootedyogini,m,111,2022-12-11 18:10:25.071538,name found,Melissa Dyke,,,English,Joined in May 2022,"Melissa has been teaching yoga & meditation for the last 10 years, primarily focusing on energy nourishment through movement & meditation. Melissa has spent the last 8 years camping in the bush around australia, she has spent along time meditating alone and with her family & tuning into her own energy field. Melissa primarily teaches vinyasa and pranic nourishment meditations....read more",https://users.insighttimer.com/wM8LypP5NUa6mJ2OfpQ42ZjgiCM2/pictures/square_medium.jpeg
11089,theblackswanmindset,m,111,2022-12-11 18:10:43.951002,name found,Mirabela Pravat,,,English and Română,Joined in Aug 2022,"Dip. Hyp. HWHP / Clinical Hypnotherapist/ Mindset Coach / NLP Practitioner
Through her life experience and extensive training, Mirabela has reached and shifted the lives of tens of thousands of people all over the world. She has helped people overcome their limiting beliefs, blocks, and fears, by aiding them to access dormant resources that were already within reach. The biggest lesson she learned so far and she shared with all her clients is that when a person aceepts and  embraces its true nature, he/she can become a master of their thoughts and therefore of his/her results....read more",https://users.insighttimer.com/fXcUPRXj80Py1V9qUob7JnxfX7f2/pictures/square_medium.jpeg
11090,writewithmegan,m,111,2022-12-11 18:11:02.673572,name found,Megan Barnhard,,,English,Joined in Sep 2022,"Megan's writing meditations and visualizations will help you connect to your intuition and write from your heart, whether you want to share a message to call in your soul clients, or simply speak the deep truth that's longing to be voiced.

Megan Barnhard has 16 years of experience as a professional writing coach for students, authors, and soul-led business owners. Her coaching, books, and retreats invite big thinkers to find their unique writing process and change the world with their words....read more",https://users.insighttimer.com/J17WRKBYeVgfHzRbNKfr44LnUz73/pictures/square_medium.jpeg
11091,marypsmiley2022,m,111,2022-12-11 18:11:21.551901,name found,Mary Patricia,"Dubai, United Arab Emirates",,English,Joined in Aug 2022,"Mary Patricia combines her love of yoga, somatic intelligence and Human Design to offer energetically aligned practices that recalibrate and heal from the inner realm.  She encourages students to approach practice with grace, patience and a curious mind to journey to the essence of self. Her focus is the felt sense of optimal anatomical alignment, therapeutic application, philosophical perspectives whilst maintaining a touch of humour and fun....read more",https://users.insighttimer.com/wMeH7Xzn7TgnbQrGKi8NjrtNlPe2/pictures/square_medium.jpeg
11092,mindcalmr,m,111,2022-12-11 18:11:40.147808,name found,MindCalmr,,,English,Joined in Nov 2022,"MindCalmr is a meditation channel based on science backed EMDR, or Eye Movement Desensitization and Reprocessing. It's a radical technique which induces REM or Rapid Eye-Movement, allowing your mind to heal itself just like it would do while you're sleeping. The benefits of EMDR meditation are extraordinary and rapid. For best results, we recommend listening to our meditations once per day. Led by your mediation guide Willow, we hope to be a part of your journey to mindfulness....read more",https://users.insighttimer.com/zws7tuRej8hp1fe6d3p4K4JbEhN2/pictures/square_medium.jpeg
11093,moonstruck,m,111,2022-12-11 18:11:54.746267,name found,Moonstruck_jl,,,English,Joined in Nov 2022,"Moonstruck is a 200 hour certified yoga teacher and a Holy Fire II Reiki Practitioner. She is currently working on her 500 hour teaching certificate. She just finished her yin yoga certification.  She has been practicing yoga for over 15 years. In her personal practice she loves inversions through rocket yoga, restorative yin, meditation, nidra, power and hot modalities....read more",https://users.insighttimer.com/TtNjKoOZuMRxru18KKcunzuTxIE2/pictures/square_medium.jpeg
11094,mariafornieles,m,111,2022-12-11 18:12:13.433332,name found,Maria Fornieles,,,Español,Joined in Nov 2022,"Te acompaño a mejorar tu vida y ser feliz a través de tus hábitos diarios. El cambio está dentro de ti.
IIN Holistic Health Coach",https://users.insighttimer.com/P2p2N5m8v7m2r5g3P7c5e8t0v0K6W8R4m0a1C7h7u4L2f5R0a6u1e5m2D3w2U1V7u9a6W0W8A5T1T3Z4T1U7G9L8k7J2V2p4U8E1/pictures/square_medium.jpeg
11095,monikasingh,m,111,2022-12-11 18:12:32.238252,name found,monika singh,,,English and हिंदी,Joined in Nov 2022,"Hi, I am a life coach, spiritual guide, law of attraction coach, meditation & mindfulness coach, chakra healer, and author from New Delhi, India. I am the founder of ""Magical minds academy - a school of spiritual sciences"". My mission is to provide tools that empower people to ignite their dreams, unleash their potential, and fulfill their purpose. Whatever you desire, I am here to help you realize it - whether it is career success, education, wealth, love and relationships, health, healing or even just finding the inner peace and spiritual contentment in life...read more",https://users.insighttimer.com/OeSemebd0FU46P03H2hLuaASkWL2/pictures/square_medium.jpeg
11096,miriamburrell,m,111,2022-12-11 18:12:50.991914,name found,Miriam,Hockley,,English,Joined in Nov 2022,"Miriam has been a behavioural change coach for over a decade and a meditation teacher since 2019, now running classes online and locally to teach children and adults, and those that don't believe they can meditate to do just that!  
Miriam works with groups and individuals and invites them to gently explore who they are, creating space for change and evolution, increased self awareness and more joy in more moments.

Miriam is also a circle facilitator, holding sacred space for women and children, a rare opportunity in today's busy world.  Meditation is an integral part of these offerings creating the ability for transformative change through emotional healing and space to be....read more",https://users.insighttimer.com/u8M6a2M0g5g5X9h4P1M2A8h6b3D6a6n3X7E6w1Y7k1w6d1h3n7z2J6H3t1S6F2f7V7g2a6t4z0s3b7w7B9z0z3K6W9d6C3n7P3a4/pictures/square_medium.jpeg
11097,coachofclarity,m,111,2022-12-11 18:13:09.682001,name found,Monique Brown,,,English,Joined in Nov 2022,Monique is a certified guided meditation facilitator who enjoys helping others through the amazing gift of meditation. She has been meditating for years and has grown to love the benefits that meditation has brought to her own life. She looks forward to helping as many people as possible whether they are new to guided meditation or are already familiar with guided meditation....read more,https://users.insighttimer.com/NwRHtORm6oRO2sT3klVfS2gUYoy2/pictures/square_medium.jpeg
11098,meganfebuarywrites,m,111,2022-12-11 18:13:28.418363,name found,Megan Febuary,,,English,Joined in Jul 2022,"Megan Febuary is an Author, Trauma-Informed Writing Coach, and Founder of the global storytelling platform For Women Who Roar. She has published thousands of women's work and helped hundreds write their books and heal their stories at her writing program Book Year. With a background in trauma, body, and integration–she has spent over a decade studying the way our body's hold story and how writing can serve as a method for recovery, creating courses, workshops, and embodiment programs to bring writing and the healing process together. She is currently working on her next book....read more",https://users.insighttimer.com/eIRcmtinVkZaIFtMWd6OqbEZtd13/pictures/square_medium.jpeg
11099,sacramentaldance,m,111,2022-12-11 18:13:57.257740,name found,Monica Vrăbiuță,"Bucharest, Romania",,English and Română,Joined in Oct 2022,"""Hello dear soul,
My name is Monica Vrăbiuță (which means Little Sparrow in Romanian). I present myself to you like this because what I teach sometimes feels like lessons about flying. The flight of human beings as dancers, writers, healers, peacemakers, magicians, lovers, children, and more, more than that the flight as Spirit.""

Monica is a message therapist working at the floating tanks space in Bucharest (Zen Float Spa). She does messages for the ""whole being"" and holds space for women's circle here.

She has experience with dancing and dance therapy, healing performances for ceremonies and writes poetry.

Monica was one of the few who worked with conscious dancing in Romania. 

She built a FB group called Sacramental Dance which promotes interesting dancing, singing and artistic manifestations....read more",https://users.insighttimer.com/FYzQARe5hKasIobezoq7d5zhGLJ2/pictures/square_medium.jpeg
