,teacher_id,alpha_index,batch_id,scrape_date,scrape_status,teacher_name,location,followers,languages,date_joined,about,image_url
13700,sarahkemp,s,138,2022-12-12 12:06:23.106686,name found,Sarah Kemp,"Lincolnshire, UK",93 followers,English,Joined in Jan 2022,"Sarah is a lifelong follower of the yogic tradition and she practices and teaches in rural Lincolnshire in the UK. She is a yoga teacher, therapist and CBT therapist, with additional qualifications in yoga nidra and restorative yoga. 

Her life purpose is to heal herself and others through the practices of yoga, mindfulness, meditation, gratitude, compassion and connection with our fellow human beings. Her own practice has taught her that deepening awareness of one's Self, and loving connection with each other is the way to true happiness....read more",https://users.insighttimer.com/t3c5z9H6G5t3W2j2K1F5r8a5L6c2q6t1q0d7E9E6b6j1M6L3v0B8n4W5L6f9h4K2g3U0w6H9K2t7j3w5s5m2u6E8v0p8d6N4q6b1/pictures/square_medium.jpeg
13701,susanstabile,s,138,2022-12-12 12:06:26.259972,name found,Susan Stabile,"Saint Paul, MN, USA",92 followers,English,Joined in Oct 2016,"Susan is a spiritual director and has significant experience in giving retreats and other programs of spiritual formation as well as in offering individual spiritual direction. She is the author of Growing in Love and Wisdom: Tibetan Buddhist Sources for Christian Meditation (Oxford 2013) and of the blog, Creo en Dios! ...read more",https://users.insighttimer.com/w1L4Y0H1n8G5L0t7m7u3K9j1R2D7k7A9n4J3H9M0G2v4S7V2K6u6c0j9V9K6x2B5C8S3v7J9e2U7N8y1X4W0G3N8B4X8E6T1N9z3/pictures/square_medium.jpeg
13702,shekinahlevesque,s,138,2022-12-12 12:06:45.175167,name found,Shekinah Levesque,"Ham-Nord, Quebec, Canada",92 followers,Français,Joined in Sep 2016,,https://users.insighttimer.com/E4L9F2t3M4S8Z5b7m5L3h2N6H5A7K5b8H1s3z2D5k6B9t0B5k3j8D9j3s8g8c5E6X5w4F4r5k3X2e5L8q1k3y0c3b9E1a4w9s9a2/pictures/square_medium.jpeg
13703,som.meditacao,s,138,2022-12-12 12:06:48.345937,name found,SOM - Spiritual Omni Meditation,"Araras - State of São Paulo, Brazil",92 followers,BR. Português,Joined in Apr 2020,"Sou Felipê Ferrêira
Mediador e Guia em Meditações em Grupos e Pessoal.
Sou criador do Método S.O.M. (Spiritual Omni Meditation), que não se limita a uma linha específica de meditação, ele agrega todos os tipos e os alinha de acordo com o momento e necessidade de cada grupo.
Queremos ajudar todos a aprender a Respiração Consciente, a acalmar a mente e se conectar com o ""EU"" interior.
Estamos muito felizes em fazer parte dessa comunidade que tanto nos faz bem. Gratidão, Namastê....read more",https://users.insighttimer.com/V0P1F5e9w4a5G5J4N4K9h0s3u3Z0F4z7R0f4A5m5V5w0a9Z4w9p1X4E6D3n5b7n1z6R5R0J2x7Y2A8q4j3K5r6z6Y6v8Y2Z1e2T4/pictures/square_medium.jpeg
13704,sarahlewisco,s,138,2022-12-12 12:06:58.568363,name found,Sarah Lewis,"Dubai, United Arab Emirates",91 followers,English,Joined in Jun 2019,"Sarah is an intuitive life coach. Her mission is to support women to release their fears, build a strong and loving relationship with themselves, step in their power and awaken their inner wisdom, their intuition. She empowers women to become the intuitive leaders of their own life so that they can create a life filled with joy, purpose and love and intuitively manifest their desires.

...read more",https://users.insighttimer.com/J8D7N2b3C8E8W9u0k1N6z5S0Z7K4f7k4M5y5X0u6R5A1Z0J1a4j6C5p6F6Q3H8v9d2C7F9c7f4T4L7Y6Y2u1f4g6M1K0j8L2E3v4/pictures/square_medium.jpeg
13705,thestaceyfoley,s,138,2022-12-12 12:07:02.702759,name found,Stacey Foley,"Cochrane, AB, Canada",91 followers,English,Joined in May 2021,"“Stacey Foley is an IMMA & CPD Certified Meditation and Mindfulness Teacher and Renowned Wellness Workshop Instructor.”

In a world where we often feel disconnected and out of alignment with our true selves, Stacey teaches the importance of integrating meditation, mindfulness, personal development, and wellness into our daily lives. Often described as a ""Guiding Light"", Stacey connects to the deepest part of your soul while helping you find the truest and most authentic version of yourself....read more",https://users.insighttimer.com/0aqSJMZeQJMzp8g1tsL0y4comql2/pictures/square_medium.jpeg
13706,barbikovaa,s,138,2022-12-12 12:07:23.384142,name found,Sveta Bárbikova,,90 followers,Русский and English,Joined in Jul 2021,"Гармония с собой для меня основа счастья и мой жизненный приоритет. В стремлении к гармонии я пришла к регулярным практикам медитации и йоги и сейчас начала записывать и работать над своими медитациями, которыми хочу делиться с как можно большим количеством русскоговорящих людей по всему миру....read more",https://users.insighttimer.com/OmcAy3KiSQcbu2LGaKuGFn4eOkh2/pictures/square_medium.jpeg
13707,meditandovida,s,138,2022-12-12 12:07:42.813232,name found,Silvana A. Santos,,90 followers,Español,Joined in Jun 2021,"Silvana es Instructora de Yoga Nidra y Yogaterapeuta. Mientras transitaba su carrera profesional, la meditación la ayudó a desembarcar en las orillas de la paz interior luego de ajetreados días de oficina. Después de varios años y de la mano de IYT, conoce la milenaria Yoga Nidra, el Yoga del Sueño, que le abrió las puertas al impactante mundo que subyace entre el sueño y la vigila. Silvana imparte sus prácticas de acuerdo con las enseñanzas y método desarrollado por Swami Satyananda Saraswati. ...read more",https://users.insighttimer.com/Z2w5e4c2n9J8w2A2v5B1e9B4m1k1Z9a6A6L8A6h8H2b8u8b6e9c1a9k6K3E1J2m7a3v9S0T9P8g0M6P0s2C0u6B4T0V0T5j2B6U6/pictures/square_medium.jpeg
13708,practicewithscarlett,s,138,2022-12-12 12:07:45.912623,name found,Scarlett Chang,,89 followers,English,Joined in Apr 2022,"Scarlett is a mindful flow yoga teacher, yoga nidra guide, intuitive empath, writer and visual artist. Discover deep embodiment, true self-love & complete wholeness. Journey inward and return to yourself with these practices.",https://users.insighttimer.com/YGEP272q85S8dBNwXbNHnbEtzpz2/pictures/square_medium.jpeg
13709,yogawithshanee,s,138,2022-12-12 12:08:00.030112,name found,Shanee Finley,"Los Angeles, CA, USA",89 followers,English,Joined in Feb 2021,"Shanee Finley (also referred as Sharanya) is a devotional Yoga Teacher, Meditation Teacher, Reiki Healer, Sound Healer, Birth Doula, Bodywork therapist and Transformation Coach based in Los Angeles. 
In each class, she guides students to address bodily awareness, emotional transformation and creative intention. By connecting to your own awareness, we move deeply into a more integrated experience through the practice of meditation and yoga....read more",https://users.insighttimer.com/c3F3p4n8U7Q4g7N7F4w3m8v1u7z7G3m8h7Q7A3a1z8Q2V4m0V0B4K3F9Q8J4b9x3x1m6r6q9f0c8J6A9q3C9A5n7f8x7F7L5f1q8/pictures/square_medium.jpeg
13710,solymoreno,s,138,2022-12-12 12:08:19.476864,name found,Soly Moreno,"Tarragona, Spain",89 followers,"Español, Català and English",Joined in Apr 2020,"Vibra tu propio sonido para dar un paso mas allá. Con los ejercicios Inner Sonar profundiza tu practica de meditación, cantos sagrados, proceso de sanación, disciplina artística. 
Comparto aquí ejercicios para disfrutar del efecto de la vibración de las cuerdas vocales, que como las alas de una mariposa, son capaces de producir enormes efectos en tu vida, en la de las personas cercanas y en el mundo entero....read more",https://users.insighttimer.com/k0q6q1M5v5V6r9F0m7x4D2j8X0R3G5j4z8a1D1d5e5N4V0M4a6s6L6x4j9m5U5K9A6T1r7F9d0D7z4Q7W7y2t1m4n9D8c3r0L8j4/pictures/square_medium.jpeg
13711,swissnaturesounds,s,138,2022-12-12 12:08:38.427751,name found,SwissNatureSounds,"Meggen, Switzerland",89 followers,"English, Deutsch and Schweizerdeutsch",Joined in Jun 2021,"Claude, the creator of SwissNatureSounds, is all about healing. He loves to be in nature. Likes to do yoga and to meditate to the sounds of nature. That's why he records all of natures soothing sounds that he stumbles upon in his home country Switzerland. Claude hopes sharing his content will bring joy and appreciation for nature and animals to others....read more",https://users.insighttimer.com/U9m9X1C3T0F8R0u4R3v6B1R2G2R9W4d4A8N7E6T9V2K2z5H1s5F4s3T2w1j8u7M0b4F6x4F2t7n4r1n7k7P8T2g0m1h2Y5X7U9q2/pictures/square_medium.jpeg
13712,sonyasophia,s,138,2022-12-12 12:08:57.256547,name found,Sonya Sophia,"Austin, TX, USA",88 followers,English,Joined in Nov 2016,"Our dream is to live in a world where people connect with each other in a healthy way, where people feel emotionally stable and make wise choices.  To accomplish this we have made Tapping support more widely available and much more affordable. We consistently assist, uplift and support anyone who is striving to improve their own lives and to change this world for the better....read more",https://users.insighttimer.com/N6z9J1w4D7F6R3f3Y5X4Z5T6G0L1H6h0P6R1t9h6c7H8M7k1p9W1M7n9p0k9A2A7k1G9B3n9y6S9W4P8d1M7D5e6j4b1s8t1r0d6/pictures/square_medium.jpeg
13713,sjoukjegummels,s,138,2022-12-12 12:09:06.252084,name found,Sjoukje Gummels,"Folkestone, UK",88 followers,English,Joined in May 2021,"Sjoukje Gummels is a Shamanic Practitioner and a mother of two. She works with energy healing disciplines such as Reiki, Regression Therapy and Shamanic Healing. Sjoukje has trained with world-renowned teachers in Shamanism in the West: Sandra Ingerman Imelda Almqvist and Joan Parisi Wilcox. Sjoukje offers guided meditation classes for healing and self-revelation. Journeys to support people to reconnect to them self, their intuition
Offering people a safe space to release, relax and re-energise....read more",https://users.insighttimer.com/SB2iMwRldhQKbqPqfFlBoeORx0r2/pictures/square_medium.jpeg
13714,sarahblangiardo,s,138,2022-12-12 12:09:10.405254,name found,Sarah Blangiardo,"Byron Bay NSW, Australia",88 followers,English,Joined in May 2020,"Sarah offers a combination of Kids Yoga, Kids Meditation & Mindful Craft experiences through her classes Move & Make. Her meditations are based on her studies and research of Heart Math. Sarah works closely with kids, gently guiding them to follow their intuition & their hearts. Her meditations focus on positive & feel good emotions that teaches kids how to self regulate, improves self awareness and encourages positivty in their life. These meditations make your heart happy!...read more",https://users.insighttimer.com/y4w0T2A0f5J3w5F6a5j7V5u0P9L2B6f9k0z4M2J5D6M1d0Y3D3v1E6q1J9m7D4j5y4L3m2z8s6p9v0n5b3F5K9L8v8Y2T9Q4M0e5/pictures/square_medium.jpeg
13715,simonhilton,s,138,2022-12-12 12:09:13.284044,name found,Simon Hilton,"Sydney NSW, Australia",88 followers,English,Joined in Jul 2017,Simon Hilton is a meditation teacher from Sydney Australia who has been studying meditation for over 10 years. He aims to bring a more simple approach to the practice and help students integrate mindfulness into their daily life. ...read more,https://users.insighttimer.com/j4A6Q7b7a9d8r6k0k4d1u4m3x9a6G8D6c8Z0b6S4c5t0F6U7a8b8S0U4a0x9B0E1L8u5R7d2a8S9W5Y2L7c5M4a5Q4y9E7m1U8h9/pictures/square_medium.jpeg
13716,susannekersig,s,138,2022-12-12 12:09:32.407078,name not found,,,,,,,
13717,stevenhyland,s,138,2022-12-12 12:09:35.106203,name found,Steven Hyland,"Bangkok, Thailand",87 followers,,Joined in Mar 2019,"Yoga Teacher (KPJAYI Authorized to Level 1), Music Lover & Composer. n a search for something that went beyond just physical fitness, Steve first discovered, and began to explore, Ashtanga Yoga in 1997. Authorized to teach in 2013 by Sharath Jois, Steve is one of only a small number of teachers worldwide who has received the blessing to teach Sri K. Pattabhi-Jois’s Astanga Yoga method.    ""After a couple of years of 'bending & stretching', in 1999 I met Mariella De Martini, an Ashtanga Yoga enthusiast & teacher, based in Oxford, UK and began a more focussed study of the Ashtanga Yoga system. I continued my studies, with her and visiting teachers until 2004, when I had the opportunity to study regularly with Certified Teacher, Hamish Hendry in London. I studied with him and his able assistant Louise Newton (Authorized), as much as possible, which culminated in one year of daily Mysore-style practice throughout 2008....read more",https://users.insighttimer.com/a7L6M6Z1c2p8s3V7d2L6A0d8U9u5W9c8f0B3A4W1X3f3u1w4u0L6k0N7B7L0z3a1r4M0t1p8Q2f8M4d9c2p0z7A2Y3F0S6K9y9V7/pictures/square_medium.jpeg
13718,oatsandwoes,s,138,2022-12-12 12:09:44.201541,name found,"Sarah Wood, Joy Soldier","New York, NY, USA",87 followers,English,Joined in Jun 2019,May we heal ourselves so we can heal our organizations. ,https://users.insighttimer.com/X1W3r6x8Z7h8L0a7m6f0C4Q1f5F7m6E8u9t6s2B6T2e9p7F9N5v6g9a9z8G5R3V3x2m1b0E9r1H5D9W4Q9W3d2V0x8B6p9u0r7a5/pictures/square_medium.jpeg
13719,elojonarraciones,s,138,2022-12-12 12:09:47.028549,name found,Sergio Fernández Reyes,,88 followers,English,Joined in Jan 2022,"A lo largo de mi vida he atravesado una serie de problemas muy fuertes que no hubiera podido pasar de no haber sido por la lectura, la meditación y el yoga. De modo que me he permitido adentrarme en estos temas para así poder compartir y transmitir a alguna persona que lo necesite y lo ayude mucho tanto como alguien me ayudó en su momento....read more",https://users.insighttimer.com/QUkRHFFaopfVTyiHuJvihiWsIXX2/pictures/square_medium.jpeg
13720,starryalignment,s,138,2022-12-12 12:10:06.739435,name found,Stevie Medina,"New Jersey, USA",86 followers,English,Joined in Dec 2018,"Stevie Medina is an Astrologer & Intuitive Guide. She is the creator of Starry Alignment: The Daily Horoscope Podcast for Visionary Lightworkers available on iTunes, Spotify, Anchor and more. 

Stevie waives astrology, psychology, metaphysics, and neuro-linguistic programming into her work to create an experience of holistic healing. She helps people connected to their bodies and the cosmos through her work.
...read more",https://users.insighttimer.com/Q8n9a1N8Z4Q2x2Y5M2c6L1A6Y8a3V8y2C1e6G8e0a5K5z9D7h3T6T6T0v9v1S0e7e4X8B4A8j7V9w5x5q7g5Q1s3v2k1g5u5f7J0/pictures/square_medium.jpeg
13721,susantara,s,138,2022-12-12 12:10:09.439340,name found,Susan Meyer,"Saratoga Springs, NY, USA",86 followers,English,Joined in Feb 2021,"Susan offers a unique interweaving of photography, writing, mindful awareness, and energy work that supports presence, awakening, and well-being. She is a multifaceted, contemplative creative whose work is pollinated with a vibrant combination of life experience, formal education, and a lifelong devotion to evolving the Self. Her deep interest in the nature of consciousness and appreciation of the natural world infuse her art. She is a seeker of angles that serve as exquisite openings to the luminosity that is our essential nature. ...read more",https://users.insighttimer.com/S6k8g3g5C1T8C2B2j7F0a6v0C3L6R9L7y7h7Y6u3D1e7K0C9S0B6Q6d9C3t4G2Q6J6c2N2p3g3h8u3X0Z3b6t0u3z2d6J0a8W1K6/pictures/square_medium.jpeg
13722,sarahgood.ot,s,138,2022-12-12 12:10:34.406137,name found,Sarah Good,"Ottawa, Canada",86 followers,English,Joined in Aug 2020,"Sarah Good is an occupational therapist and mindfulness meditation teacher in Ottawa, Canada.  She has been practicing mindfulness meditation for nearly 20 years.  Sarah teaches mindfulness to other occupational therapists and to people living with persistent pain....read more",https://users.insighttimer.com/qcG0U9ipV8TUC7lei08vMNs9PPa2/pictures/square_medium.jpeg
13723,sudhasong,s,138,2022-12-12 12:10:53.297301,name found,Sudha,,86 followers,,Joined in May 2021,"Sudha shares her love for and connection with Divine Source through the healing sound of her voice. For 20 years she has traveled the world offering music and meditation at festivals, retreats, workshops and concerts. Sudha is passionate about the human ability to connect heart to heart through the power of song and silence, which opens a space for healing, empowerment and the experience of Oneness.
Sudha has released three solo albums and appears on a long list of albums as a session singer...read more",https://users.insighttimer.com/WXYuwOydQYVqMhrfhNUptkVTfz42/pictures/square_medium.jpeg
13724,sam.curtis.coaching,s,138,2022-12-12 12:10:56.065538,name found,Sam Curtis,"London, UK",86 followers,English,Joined in Sep 2021,"Sam Curtis is a results-based and down-to-earth but no-nonsense Life Coach and Meditation Teacher helping you to get out of your head and into your life.

Her work focuses on all areas of life, helping those who are stuck and over-thinking to make decisions, build life skills, and progress with confidence and clarity. 

Sam lives in the UK and works with a huge range of global clients both online and offline....read more",https://users.insighttimer.com/MWMiYX0vo4aFsEQ1AGx2seu6wf83/pictures/square_medium.jpeg
13725,sethdavidclark,s,138,2022-12-12 12:11:15.164317,name found,Seth David Clark,,86 followers,English,Joined in Aug 2021,"The Rev. Dr. Seth David Clark is an ordained ABCUSA minister, pastor of a multiethnic church in the San Diego area, published author, and religious activist with the Border Church. He is also an aspiring Christian mystic who sees the values of scriptures and tradition as an aid to contemporary spiritual growth. You are invited to adore, pray, and meditate along with Seth here and to find out more, including spiritual direction offerings, on his website....read more",https://users.insighttimer.com/kyQpv0CTveMifYsOMD0JmnCxsM22/pictures/square_medium.jpeg
13726,onlynewagemusic,s,138,2022-12-12 12:11:40.226774,name found,Suzanne Doucet,"Ojai, CA, USA",87 followers,"English, Deutsch, Français and Italiano",Joined in May 2018,"Suzanne Doucet is an award winning composer, producer, recording artist and former pop star from Europe. Suzanne became one of the pioneers in the new age music industry in West Germany and is now recognized as one of the foremost authorities on the subject worldwide. Steven Halpern says in his foreword to the New Age Music Guide by P.J.Birosik, published by MacMillan ""...explorers, who helped lay the groundwork for what we now term New Age Music include Kitaro, Andreas Vollenweider, Vangelis, C.H.Deuter, Klaus Schulze, Paul Horn, Suzanne Doucet, Brian Eno and Paul Winter.""

""Life Magazine"" began their report on New Age Music with a quote from Suzanne Doucet, while specialized Keyboard Magazine acknowledged Suzanne for having ""the most authoritative view on New Age Music,"" and the LA Times devoted a full page article to Suzanne in their Sunday Calendar section. Magazines and TV production companies have interviewed her for their publications in Germany, Austria, France, Spain, Greece, Brazil, Japan, Taiwan, and South Korea.

Suzanne's over 40 years in the world of Music and Show business have provided her with incomparable knowledge, experience and contacts. Beyond being an international recording and performing artist, a singer, songwriter & composer (several hit records and albums in Europe, Asia and the USA), prime time TV ""Pop Show"" hostess (guests included the BeeGees, Eric Burdon, Grateful Dead, Keith Emerson, Donovan) Suzanne is also an established actress and musical star (Godspell with Donna Summer), director, producer, script writer, art director, sound designer, publisher, label owner, marketing consultant and online-retailer.Suzanne won several awards (including the Silver Award for her Visual Music Music work STARFLIGHT) and studied Business administration and marketing at Pepperdine University in California.

She produced a legendary avant-garde triple album under the name ZWEISTEIN for Phonogram and was according to Ado Schlier (Radio Bavaria) the first ""Liedermacherin"" (singer-songwriter) in Germany. She started her own music publishing company Golden Key Music in 1966 and her own record label Isis Music in 1980. She translated many songs and brought Yip Harburg's musical FINIAN'S RAINBOW to German theaters. She also played in many TV-plays and did numerous voice overs. She moved to California in 1983 and became one of the foremost experts in New Age Music worldwide. She recorded and released many instrumental albums, opened up the first ""New Age Music"" store in the World, directed and produced 3 international New Age Music conferences and became also a consultant to artists and record labels.

Suzanne collaborated with Christian Buehner, Tajalli, Gary Miraz, Chuck Plaisance and Paradiso. Her latest albums include Resonance, Tantra Zone and Healing Vibes, as well as the singles Moon Valley (Ambient Introspection) and Gobi (Desert Meditation & Shamanic Drumming).

In 2008 Suzanne founded the Online Community The New Age Music Circle, newagemusik.ning.com which became the new network for new age music creators and supporters. She produced 7 MP3 compilations, with each about 4 hours of music and 40-50 artists per CD. These compilations which features award winning artists as well as newcomers have been helping successfully promoting the genre and the music....read more",https://users.insighttimer.com/v0R8n8B6p8c2x6h4m5v1t7U8S7Q6u4Q2S8t2J2H3r9w6k1Y2T5w5D1t3M2x6q1H7G3J3R6h1u8d8T4r2K7T6g1Y2L8C9v4M4z0f6/pictures/square_medium.jpeg
13727,shaping_reality,s,138,2022-12-12 12:11:59.162340,name found,Stef Bourke,"Belleville, ON, Canada",86 followers,English,Joined in Apr 2021,"Stef Bourke is an Certified Alignment Coach and Meditation Guide who works through Meditation, Movement, and Mindset to help bring you home to your body.

Stef is intuition and energy led and is focused on maintaining her presence to allow the space-time for her inner wisdom to shine forth. She is a lover of nature, animals and authentic connection.  ...read more",https://users.insighttimer.com/p9g9U0v1r8Q6p9P3N3y9s1d0p1A7d1E4X0V4S1X1T3t1F2Y8H5K6V2X4c5V5n6P8y5U2y4L8g1K5U1x0z5c7E2g0e9g0R5h7t7F5/pictures/square_medium.jpeg
13728,joyfulmind,s,138,2022-12-12 12:12:18.292680,name found,Shakti burke,kyogle nsw Australia,85 followers,English,Joined in Mar 2019,"Shakti Burke facilitates mindfulness and yoga workshops in her locality of the Nthn Rivers, NSW, Australia. A long-term meditator, she blends her thirty-plus year practice with the contemporary insights of neuroscience and embodied mindfulness. She is also a keen student of Tibetan Buddhism, her main teacher being Dzongsar Khytentse Rinpoche. Her wish is to spread the ease and joy of being that comes from knowing you are not your thoughts!...read more",https://users.insighttimer.com/R4s7K8m5T1n9S3V5K6k8p6Y4R1w9u7Q0w9c6n6d0e4D2N2c3u4g1e4h0h6E1S3C6g5N5p6c9t5C0D4R0C1L3F9R4S1F6M3t2V9t1/pictures/square_medium.jpeg
13729,sunita,s,138,2022-12-12 12:12:28.364099,name found,Sunita Patil,"Sydney NSW, Australia",85 followers,English,Joined in Feb 2021,"Sunita Baste/Patil is a yogini, teacher, writer, artist, and coach. She offers the most comprehensive Yoga, Meditation & Ayurveda teachings. She is renowned for her depth of understanding of the ancient language of yoga, Sanskrit. Sunita makes this ancient wisdom accessible and easy to adapt to modern times. Sunita has over 30 years of experience in the personal practice of yoga, and over the past 18 years, she has taught 1,000s of students worldwide ~ Australia, USA, and India. Sunita has more than 15,000 hours of recorded yoga teaching experience. Sunita teacher Meditation, Yoga & Ayurveda for Yoga & Meditation teacher trainings in Australia & USA, and Yoga Therapy Teacher trainings in Australia

...read more",https://users.insighttimer.com/0WPMv8kochQBy20Do7x6MUZC28C3/pictures/square_medium.jpeg
13730,waterfallyogatherapy,s,138,2022-12-12 12:12:53.549832,name found,Sarah Cummins,,85 followers,English,Joined in Mar 2022,"Somatic Yoga Therapist and owner of Waterfall Yoga Therapy empowers individuals to self manage their chronic pain through pain science and the holistic teachings of yoga. Her client-centered approach meets clients where they are on their journey offering encouragement, guidance, and confidence in achieving their health goals. Sarah teaches private yoga therapy sessions, small group yoga therapy classes and workshops,  and wellness retreats....read more",https://users.insighttimer.com/K8y7S0z3T2M3F0J1B3N8H5j1q4g2Q4s0N6w8M0x1p0z4Y6J9d1p0U3A7h8r8B2G5Y6L5p2A8V7k4t3y9z1Q0c0a0P3Z4u4m3P2t9/pictures/square_medium.jpeg
13731,sanjunryn6,s,138,2022-12-12 12:13:12.490207,name found,Sanju Narayan,"San Francisco, CA, USA",84 followers,English,Joined in Jan 2022,"Sanju is a yoga, meditation, and Self-Love/manifestation coach. She is also a writer for The Wellness Wednesday for a corporation. Sanju is always learning  and believes in  loving oneself is most important part for spiritual growth.  She overcame her years of suffering from Sinusitis and Anxiety. 
 She now teaches how emotions can block one's manifest for the  better life. Her teaching includes - breathing techniques, mindfulness meditation, open eye meditation, and self-love....read more",https://users.insighttimer.com/Z9v2G5F4u1e8t5z7A9J0A6B1g0F8D9n1X6q9g4a3s7A7n2H2h1A6a7q1v9a9A0u4c5K5e6H3R5p1Z3J4k9t5A4w6G0U9t8q4R6A6/pictures/square_medium.jpeg
13732,zensonya,s,138,2022-12-12 12:13:31.477501,name found,Sonya Thorne,,84 followers,"Français, English and Español",Joined in Jul 2021,"Sonya Thorne est professeure de yoga et de méditation et directrice de l’Institut CIME dont la mission est de former les intervenants scolaires, sociaux et pédiatriques dans l’implantation de la pratique méditative auprès des enfants qu’ils côtoient.  Elle est auteure du programme Le Fil d’Ariane et co-auteure du coffret familial La P’tite boîte à Médites....read more",https://users.insighttimer.com/yantpCDUmEhDKehYxGAQiyaBD1q1/pictures/square_medium.jpeg
