,teacher_id,alpha_index,batch_id,scrape_date,scrape_status,teacher_name,location,followers,languages,date_joined,about,image_url
1979,ahintofsageyoga,b,20,2022-12-11 06:39:40.199128,name found,Beth Hill / A Hint of Sage,"Northeast Ohio, OH, USA",43 followers,English,Joined in Nov 2022,Beth Hill is a 200-HR RYT. She has been a student of the practice for over 25years. Forever a student of this ancient practice she will bring newness and curiousity into each practice. Teaching is a way for her to help others feel and experience their bodies and emotions and offer compassion and space for self healing....read more,https://users.insighttimer.com/G4e2P3X6K4n1R4S3r0R5c8r2k1A0C1w5W5K1v4z7H6A0b5C2U1L5M7E2Y0t8b4U0t1b9T7a0K9n6L7a9a1d3c3B9T0n2N5a3D8E7/pictures/square_medium.jpeg
1980,pub8009776,b,20,2022-12-11 06:40:04.862755,name found,Bonnie Rhea Tomeoni,"San Diego, CA, USA",42 followers,English,Joined in Jul 2019,"My name is Bonnie Rhea Tomeoni, thanks for your support. I am currently a yoga teacher (RYT- 500) as well as a Certified Yoga Nidra Guide. I am open to providing more Yoga Nidra inspired scripts if there is an interest in the market for this very healing practice. I have received trauma informed training as well from Veterans Yoga Project. I love the concept of having more connections than just my immediate location. Insight Timer seems a great way to do just that. Please respond if interested!!...read more",https://users.insighttimer.com/e3r4q9P0X8x2e9W9E4E1R9G0A6p4N9r4V7A4M1B5M1C8a7k4R8C0H8d8k8B1N8A0j9z9N5M6s8V6w0U9D9Y2y8W5a5z6M3p4W6C5/pictures/square_medium.jpeg
1981,beckyhesseltine,b,20,2022-12-11 06:40:47.861621,name found,Becky Hesseltine,"Vail, CO, USA",41 followers,English,Joined in Apr 2022,"Becky Hesseltine is a tested and certified Evidential Medium, Intuitive Healer, Psychic, Meditation Facilitator and Author.  Meditation has been a fundamental aspect of her person healing journey and development of her gifts.  She shares every meditation from her heart.  When she's not meditating with you, you can find her connecting with clients one-on-one with private sessions along with group mediumship demonstrations, workshops and group healing work.   Being an Evidential Medium means that she can connect with your departed loved ones and give you evidence of  who they were on this physical plane along with their loving message.  This brings her clients a knowing that survival surpasses their loved ones physical death.  With psychic intuitive healing sessions she delivers personalized messages of healing, deep connection to self, and guidance towards living out your full potential.  She looks forward to sharing her healing art with you and yours....read more",https://users.insighttimer.com/b6J6Q7z4S4y8h0R7k1D8A2H0b3M5V2n7a2T0v6f7J4E8B5d4P8k4R0N9s6K7f1Z4n2E9H2c0x4K4G6e8t9z1g8v1R1h4T5d6N5Z1/pictures/square_medium.jpeg
1982,barbaraw,b,20,2022-12-11 06:40:50.542223,name found,Barbara Wallick,"Vancouver, BC, Canada",39 followers,English,Joined in Jun 2021,"Founder of Crack The Money Code for Spiritually Minded Women, Barbara uses her 35 years experience in Finance, Master NLP/Time Line Therapy®, Master Hypnotherapy, Chakradance to guide Women to find Clarity, Confidence & Cashflow. Creating a Life of Joy, Love & Prosperity. 

Let go of stress, overwhelm to create Clarity
Release Negative Financial Conditioning to grow your Wealth
Learn to manifest in present moment awareness.
Quiet your Mind to allow your inner wisdom to speak....read more",https://users.insighttimer.com/fu9QtxGdd6WHVIDlSQyf0z71O0e2/pictures/square_medium.jpeg
1983,betina_pflug,b,20,2022-12-11 06:40:53.189120,name found,Betina Meyer Pflug,,39 followers,English and BR. Português,Joined in Apr 2021,"Betina Pflug is an entrepreneur, a business and life coach, a mother, and a marketing and CRM specialist. She has a degree in hotel management, received her MBA from Rotman School in Canada, and has completed three different coaching certifications, including a specialization in facilitating nonprofits, life coaching, and biopsychology to promote positive mental attitudes for mental and physical wellbeing....read more",https://users.insighttimer.com/k9X6D9U2a5T3A5R5m0t0d9q1J3z1B7E8M4k3S9A5E2d0M5D4e5d6j6s5z5C7h6B6t1S4Z3p1e2d9b0v7a6T2J3Y2Y8X2j5E0N8z4/pictures/square_medium.jpeg
1984,brittucker,b,20,2022-12-11 06:40:55.726851,name found,Brit Tucker,"Joshua Tree, CA, USA",39 followers,English,Joined in Jan 2021,"Brit is a registered yoga and meditation teacher based in Joshua Tree and Los Angeles, California. She began a yoga practice at a young age and became a teacher after a life-changing experience drove her to seek the truth within herself. She now shares those gifts with others to help them anchor into the awareness of their body, mind, and spirit....read more",https://users.insighttimer.com/f2g3D1v4N7T6c2r8m6n2d1S6W7z2d2W5Q3R1a1g6Z0d4R9y1S8z1w9E0Z7k4Y0g4m3w5w8C6v4R3S0S3x9t5L1q1p6H1s0W5X3y4/pictures/square_medium.jpeg
1985,coach_wisch,b,20,2022-12-11 06:41:20.853631,name found,Bob Wischer,"Michigan, USA",39 followers,English,Joined in Feb 2021,"I'm a Marriage Saver and Divorce Healer for Men!  I made all the wrong moves prior to my divorce 8 years ago, ending up an overweight, lazy loiterer who couldn't make his wife happy I hit the bottom with depression and burnout; I then rebuilt my life by losing weight, getting in the best physical shape of my life, finding the woman of my dreams, and am now living my purpose helping others.  Who do you know that is struggling with their marriage or needs to recover from divorce?...read more",https://users.insighttimer.com/3ufFXwtG79hewYML4FIDQS0h38F2/pictures/square_medium.jpeg
1986,zenwithben,b,20,2022-12-11 06:41:23.453714,name found,Benjamin Irons,"Santa Fe, NM, USA",37 followers,English,Joined in Oct 2020,"Benjamin Irons (CHt, CMI) is a sound practitioner, professional percussionist, meditation teacher and author; as well as, Artist-Collaborator for Dragonfly Percussion's ""Resonance Series"" and the new ""Benjamin Irons Signature Series"" of singing bowl mallets....read more",https://users.insighttimer.com/4gu8GhYEd1YdI59HTUkLjxqD4jA2/pictures/square_medium.jpeg
1987,bashir,b,20,2022-12-11 06:41:26.095312,name found,Bashir Youssef,"City of Gold Coast, Australia",35 followers,,Joined in Mar 2019,"Bashir was born 'legally blind', but it doesn’t show when you meet him. 
​
Former Speaker & Coach, now Conscious DJ and Music Producer, he is pursuing his expressive/creative potential & passion for music. His mixes & creations emanate from a strong intent of helping the 'listener' to transcend themselves & go deeper inwardly to Transform, Evolve and Grow.

'My sight may be weak, but my VISION is strong.'...read more",https://users.insighttimer.com/c8j8P1W7b1S5Y2C0Z4u3s9L4R1e3C1u2j2H2R0M3U1b1W0s5F3e2b0A0k1S1M5h7s4P2F1Z1U5f7z2L7Y1C9L9e5h5K4Y8d8c8p3/pictures/square_medium.jpeg
1988,bethanyann,b,20,2022-12-11 06:41:29.063740,name found,Bethany Ann,,35 followers,English,Joined in Dec 2021,"Bethany offers Meditation, Yin Yoga, and Intuitive Energy Work.

Their passion is people and helping them to come into alignment, fully embodied, and integrated - mind, body, heart, and spirit. 

They would be honored to create little sanctuaries for you throughout your day through meditation, a place for you to explore your own inner landscapes.

Their goal is that you experience a deeper acceptance of self by learning to trust and follow your own inner guidance with confidence, grace, and ease....read more",https://users.insighttimer.com/Y6L0U9E6f6c1B4z0x0m4U0z9h1h1S6v3D0N4T8N1M7c6M3z2N5a9C9J2f6x9M7d1K9j7Z5e4d6N7E4x4z5E9r9p8c1Y5r3z1X0w6/pictures/square_medium.jpeg
1989,farreach,b,20,2022-12-11 06:41:31.746669,name found,Becky Diaz,,35 followers,English and Español,Joined in Jun 2022,Beck is an educator and licensed marriage and family therapist. She incorporates mindfulness practices into both her teaching and clinical work.  She is dedicated to blending the interpersonal and intrapersonal to build connections and relational healing....read more,https://users.insighttimer.com/yOiVKN4hWvSmZmABepqxh91W6Tx1/pictures/square_medium.jpeg
1990,yesthatguy,b,20,2022-12-11 06:41:58.604484,name found,Brian Salomaki,Mexico,35 followers,Español,Joined in Nov 2018,"Ex-Googler inspired by Search Inside Yourself. Member of SIY Engage 2017. Hoping to see world peace brought about by widespread compassion, and for humans to find resilience and happiness in the face of a world changed dramatically by technological advances....read more",https://users.insighttimer.com/s7X6L5W5n7W3m2y6k9h0c8Z1p5V6D3s5Z4V8c6f8P1z6m8F6g3T2X8A9G5L7d8g1N6C8j8z9u8d6y6z8b5N5Z1P3y8V4h0M9J8Y8/pictures/square_medium.jpeg
1991,baillieblissyogakinesiology,b,20,2022-12-11 06:42:01.360284,name found,Baillie D,,35 followers,English,Joined in May 2022,"Baillie is a meditation and yoga teacher and qualified kinesiologist. Living on the Sunshine Coast, Australia. She is fairly passionate about aiding beautiful souls in their journey home to themselves.",https://users.insighttimer.com/3B8Ac0CN25dPW51iBnls678jLBK2/pictures/square_medium.jpeg
1992,brennavirginia,b,20,2022-12-11 06:42:04.109075,name found,Brenna Barzenick,"Hammond, LA 70401, United States",34 followers,English,Joined in Oct 2021,"Brenna Barzenick, PT, DPT, RYT500, ERYT200 has practiced yoga for 15 years. She is co-owner of Downtown Yoga in Hammond, LA. She is a graduate of LSU School of Allied Health Professions in New Orleans (1994) and is a Doctor of Physical Therapy (2016) and is certified in integrative dry needling. Brenna trained in the SmartFLOW method with her teacher and mentor, Annie Carpenter and business partner, Britni Serou. Throughout her 26+ years as a Physical Therapist, Brenna has focused on orthopedics and disorders of the musculoskeletal system. From 2014-2017, Brenna was an instructor of Anatomy and Kinesiology at Southeastern Louisiana University. In addition to her career as a Physical Therapist and yoga teacher, Brenna is the author of the book, Tsumommy! Riding the Wave of Motherhood. She enjoys writing humor and loves teaching, practicing yoga, and life in general. Her love of yoga and human anatomy are a natural fit in her teaching....read more",https://users.insighttimer.com/q0M7M1v0w3H2p4t3H2p6w7U3V9w9n2k1k3P1S4n3q9Y6u2P3c1U0k8F2T3E8q0B3g9B5D1x2r0N2D8p5J8v3j7G5n2J2Z1H7g8Q1/pictures/square_medium.jpeg
1993,brontespicer,b,20,2022-12-11 06:42:06.805953,name found,Bronte Spicer,"Bendigo, Australia",34 followers,English,Joined in Jul 2019,"Bronte is a mum of three, intuitive guide, bush-lover, advanced meditation teacher (specialised in children’s meditation), ex-Primary School/Special Ed. Teacher, light and sound energy worker, sacred circle holder, retreat facilitator, author and inspirational speaker. She thrives on helping others to journey from their head to their heart so they can realise their infinite potential, access their own medicine and feel free in who they are. ...read more",https://users.insighttimer.com/k3E4L3V4a9J5j9T2c4c0F6s8d6a3q7J8S3K6W9X1C2r5c6C4A5U2P3G5x6g1w1R3H3v9e8Q9Z1p1P0m0w9x0B0V6C2q0p5V4H3z8/pictures/square_medium.jpeg
1994,biancahavukainen,b,20,2022-12-11 06:42:09.517266,name found,Bianca Havukainen,"Freshwater NSW, Australia",34 followers,English,Joined in Jul 2020,"Bianca Havukainen is a certified meditation teacher in Freshwater, Sydney, with a background in health as a pharmacist and change empowerment coach. Bianca teaches meditation for un-stressing and deeper self awareness, and to enliven a richer connection with yourself, others, and the world around you. Her passion is transforming fear-based, negative patterns into empowering, compassionate, and heartfelt growth. She is known for her gentle, warm, and supportive approach to teaching. ...read more",https://users.insighttimer.com/x2nwCzK4NbWedEtpq10pL1lHDlg2/pictures/square_medium.jpeg
1995,meditatingmama,b,20,2022-12-11 06:42:20.212393,name found,Brittany Hudson,"San Diego, CA, USA",34 followers,English,Joined in Jan 2022,I started on my path of meditation at the age of 17 discovering the benefits of many different types of meditation. At the age of 21 I was introduced to Mindfulness Meditation and I have been in the practice of Mindfulness Meditation for over 20 years. In 2014 I started Meditating Mama and now I guide and teach public and private Semi Guided Mindfulness Meditation classes for Beginners all over San Diego....read more,https://users.insighttimer.com/a1D0G9A4Z4w4P0Y4c6G3P5u4n4T4K3D1D7x7F1B1V6T6W9K4n3r9q3k3s0g7J6Z6B0g1p8m7b5z7E7T6f6v1L0z5c1D5t6r8U2b4/pictures/square_medium.jpeg
1996,bvzcoaching,b,20,2022-12-11 06:42:38.971119,name found,Brenda Vander Zanden,"Toronto, Ontario, Canada",34 followers,English,Joined in Feb 2021,"Right now, there seems to be an over-emphasis on how ‘busy’ we are, and that being busy is a requirement for success. Filling our schedule with as much as we can seem impressive on the outside, but when it comes to how this makes us feel, it often doesn’t leave much space to breathe. Let's challenge that notion by listening to our bodies! Whatever your day-to-day schedule includes, become aware of not just what you do but how you do it and how it affects you.

The ability to slow down will not only allow your body and mind to take a much-needed break, but you’ll be much more aware of how you’ve been using your energy.

I am happy to have you here.

-Brenda...read more",https://users.insighttimer.com/LM5rZsDOBXhKCa3W9VAxixFd60g1/pictures/square_medium.jpeg
1997,biancagm,b,20,2022-12-11 06:42:57.696927,name found,Bianca King,"Geneva, Switzerland",33 followers,English,Joined in May 2018,"I first came across meditation in 1991, and since 1997 I have been practicing meditation daily to ground my own inner resources for well-being. The clear awareness and emotional balance that it encourages have been the cornerstone to my life and work.

My training and experience span both Eastern and Western perspectives on psychology and I draws upon these influences to help guide the therapeutic process and create a more powerful awareness of the benefits of mindfulness.

I began my career in counselling in Australia at the Petrea King Quest for Life Centre for people with terminal illnesses. This is where I was formally introduced to incorporating meditation in processing life difficulties and uncertainties.

In Geneva, Switzerland, I have a private practice and regularly conduct public mindfulness courses and private courses for corporate, non-profit organizations and schools.

In particular, I am deeply passionate about helping others connect with themselves, their environment and in community. 


...read more",https://users.insighttimer.com/K2D7A0m6D7n1M9d6N8v8G7h9P0y0p5s0m6Z2g8w3w9g9M3m9w0e3T0r9r7G1L0R3g5X4V8M3H9A3L6G4D7Z6X3p0U3X3N5E4N9y2/pictures/square_medium.jpeg
1998,brujula_del_bosque,b,20,2022-12-11 06:43:00.309919,name found,Brújula del Bosque,"Santiago, Chile",33 followers,Español,Joined in May 2021,"Nacida en el sur del mundo, ha encausado su búsqueda en el estudio de las comunicaciones, los mitos, Reiki, Terapia Floral, Gemoterapia, el saber de la naturaleza, entre muchos otros caminos. Meditar es un viaje compartido.",https://users.insighttimer.com/LqQfzSGErsOIWZBV6bSvp506lXx2/pictures/square_medium.jpeg
1999,ben1981,b,20,2022-12-11 06:43:18.992569,name found,Ben Eydmann,"London, UK",33 followers,English,Joined in Mar 2021,"Ben is Co-Director of MahaDevi Yoga Centre, a specialist yoga centre working with young people. He is trained in Hatha Yoga, Yoga for The Special Child, Yoga Nidra and Trauma-Informed Yoga. He is currently studying for a Diploma in Group Sound Therapy. He shares with you a number of easily accessible well-being practices that he hopes will guide you towards better self-care and fulfillment. 
...read more",https://users.insighttimer.com/6NQKrcbgYQSLOTkDxol2iZHToMY2/pictures/square_medium.jpeg
