,teacher_id,alpha_index,batch_id,scrape_date,scrape_status,teacher_name,location,followers,languages,date_joined,about,image_url
8300,kerryn,k,84,2022-12-11 20:11:45.789911,name found,Kerryn Slater,"Melbourne, Australia",10 followers,English,Joined in Apr 2021,"Kerryn Slater is the Inspired Spiritual Alchemist on a mission to support you to gain true purpose clarity, heal your body and mind and connect to a joyous life. She’s a fierce advocate for your awakening!

Kerryn loves to learn and has gathered an abundance of tools and expertise, she’s highly qualified and has a wealth of wisdom she shares generously.

Her business, Holistic Essentials Therapy & Consulting has been the channel to reconnect to your wisdom as you learn to trust being supported by the universe’s beautiful energy. 

As a certified Meditation Teacher, Self Discovery Master Coach, Hypnosis Practitioner, Reiki Master Teacher, Theta healer and Thrive Factor Profiler, she’s a wealth of wisdom and inspiration, with an ability to hold space for genuine transformation.




...read more",https://users.insighttimer.com/y6p8w9m8b7v4Y2j4a4R6u4r1h7M8N8R0K0T2Z1J4b6X1Y5v6B1G5d1Q2p9R7a2S9x7b9k2W3y8b1c3X1D1t4L6d0Y5E6x6u7W9L8/pictures/square_medium.jpeg
8301,_wovenlight_,k,84,2022-12-11 20:12:06.818747,name found,Katelyn Wargo,,10 followers,English,Joined in Sep 2022,"Residing in the healing mountains of Asheville, NC with her husband and daughter, Katelyn is an ICRT certified Reiki Master Teacher, Yoga Nidra facilitator, and writer. She has a nurturing heart and the soul of an alchemist. Her medicine is her ability to harness the potential and latent energy of darkness and embed it with light - using its energy to reveal hidden knowledge in the psyche. After almost a decade of classroom teaching, Katelyn found herself at home in the teachings and wisdom of energy work, dream work, and Yoga Nidra....read more",https://users.insighttimer.com/d3ykELiXBhU2k935pB400BcTWuQ2/pictures/square_medium.jpeg
8302,katrinpiepenbreier,k,84,2022-12-11 20:12:15.102900,name found,Katrin Piepenbreier,"Stuttgart, Germany",10 followers,Deutsch and English,Joined in Jul 2022,"Katrin is an international teacher with a background in tantra, Hatha yoga, meditation (Atma Vichara), somatic integrative trauma therapy and sound healing. On her quest for truth, she spent over 244 days in complete silence and over 98 days in darkness & solitude to inquire into the depths of the Heart. Katrins way of teaching is loving and joyful, yet fiercely paves the way for those who wish to truly taste the aliveness and richness of life. Key factors in her teachings are found in integrity and authenticity....read more",https://users.insighttimer.com/H3S5G6b6k0u6X8X6L2Y9B9d6G6w0S7T1s1H8b6h2B8U9y9K2h6w7Z0h1L0z1K9n4g8L2Q6s5h8d5y3G6N4f3a9H6H8E9e2z1r9M0/pictures/square_medium.jpeg
8303,kotroba,k,84,2022-12-11 20:12:39.977458,name found,Kevin Kotroba,"Darmstadt, Germany",10 followers,,Joined in Nov 2019,"Wir nehmen Sie mit auf eine unglaubliche Reise in die Welt der Meditation, des höheren Bewusstseins. Wir zeigen Ihnen außergewöhnliche Techniken / Methoden. Wir zeigen Ihnen das Licht.",https://users.insighttimer.com/P7j4J1X1K9W1K6W8m8E8X5u9M1J4n3t8T2f7x9c8A0r2T4B1a1n2z8R3A9J8N6K9p8e0N5U4Z7c2Q3L5g7n2f7U3D1d4s5C0S7K0/pictures/square_medium.jpeg
8304,kristyiris,k,84,2022-12-11 20:12:47.785357,name found,Kristy Iris,,10 followers,English,Joined in Dec 2021,"Kristy Iris, MFA collaborates with Conscious Creatives to connect home and soul. Focussed on a career designing costumes, sets and lighting for theater and film, a spiritual awakening took her from designing make-believe worlds for make-believe people to creating a unique system to help real people have a home that supports a hit show of their life. 

She does this through one-to-one sessions virtually and free and paid for courses ranging from decluttering for the scattered, creative mind to creating a home that is a powerful tool for transformation and manifestation....read more",https://users.insighttimer.com/xJfSHMWxFgfLZm9QvrzmKlTcsGK2/pictures/square_medium.jpeg
8305,katrinaharris,k,84,2022-12-11 20:12:55.236089,name found,Katrina Harris,,10 followers,English,Joined in May 2022,"Katrina Harris is an accomplished pianist and vocalist living in beautiful Byron Bay Australia. Katrina is also a dedicated yoga practitioner and teacher, completing her 200hr teaching training in 2020.
She is a piano and vocal teacher, a performer and a composer, and holds a Masters Of Music Degree from the University of Sydney. Her uplifting compositions aim to bring focus and inspiration, and are suitable for study, relaxation, meditation or simply as the background to help ground you throughout your day....read more",https://users.insighttimer.com/E3EgIYasSqdGeADkK0soWJjp42O2/pictures/square_medium.jpeg
8306,kealamason,k,84,2022-12-11 20:13:19.048695,name found,Keala Mason,,10 followers,English,Joined in Nov 2022,"Keala is an indigenous Navajo and Native Hawaiian woman who wants her life to be a true meditation in harmony with others and the planet. She has been teaching numerous lineages of yoga, varied styles of meditation, and movement for over 18 years. For Keala, teaching is like breathing; something that grounds yet expands. She has led both service retreats as well as yoga and meditation retreats in the US and abroad. She inspires others on their path to wellbeing....read more",https://users.insighttimer.com/dh56hfqpCxTeQ5XMNeYVQmvwufk1/pictures/square_medium.jpeg
8307,keishar,k,84,2022-12-11 20:13:43.477976,name found,Keisha Reynolds,,9 followers,English,Joined in Jun 2020,"Keisha is an author of children's books and a poet, as well as, a Reik master and sound healer for nearly 10 years. Keisha focuses on assiting people in shifting their energy for healing, divine connection and life purpose work. ...read more",https://users.insighttimer.com/N7H0F6K2p5x7J0d1B9r7C3Q6U0f5n7q6k0A7T3v1b4L4T6C7Z7A9s8A1C7N8q9G0T0M9j9v1G8A2B8T9V3U6v5v2H9Z7h7B7z6A5/pictures/square_medium.jpeg
8308,kaitlynkay,k,84,2022-12-11 20:13:50.466689,name found,Kaitlyn Kay,"Columbus, OH, USA",9 followers,,Joined in May 2019,"Only a fool assumes to know all, so an ardent student I remain of life, psychology, meditation, and the arts. I have earned degrees in both Art and Psychology, and hope to blend those worlds in a way that helps those it can. In any case, my path has led me here and I look forward to walking with you, Traveler....read more",https://users.insighttimer.com/V9J1U9X4E8g5H8E5b3N2f6m0t1N6q7C6k7D3u2T5K4Z2s7C9q8F0s0t0v0V1m8F4T0e6E6W9x3Z4B7J6M3R1k5e2T4y6F4U0u0K3/pictures/square_medium.jpeg
8309,katischehaberfield,k,84,2022-12-11 20:13:58.001869,name found,Katische Haberfield,"Brisbane, Australia",9 followers,English,Joined in Mar 2021,"Katische is a Crystalline Sound Alchemist- she uses crystalline sound and vibrational aromatherapy to heal the subtle body energies. The sound alchemy sessions that she performs are not designed to be ""alternative or complementary"" vibrational medicine. The Crystal Singing Bowl resonates with your own body's frequencies and delivers to you the healing that you need. It is a sacred interaction between your body and the bowl...read more",https://users.insighttimer.com/OCs5HBOJwXOLc760GxICInIL3pi1/pictures/square_medium.jpeg
8310,karunkris,k,84,2022-12-11 20:14:21.790322,name found,Karun Kris,"Kerala, India",9 followers,English,Joined in May 2019,"The world is always in need of more positivity and goodness. I've always been a fan of giving out good vibes and sharing it with others. Why? Because it is a lot of fun to share goodness with others. And the more I give to others, the more I get back.
I hope to give out positivity with my talks and sessions. I hope you do the same as well....read more",https://users.insighttimer.com/m6U6T9Z2Q9K7n1R5Z0F7j3L8T6k8x1K9Q1d6h8e4G3W2y7c5P7m3n0h0T1W0W4N8s3B3h2q9x3t8p7S0Z3V5M5n8m7R7a6x7e7Y8/pictures/square_medium.jpeg
8311,kristinakashyap,k,84,2022-12-11 20:14:29.427207,name found,Kristina Kashyap,,9 followers,English,Joined in May 2022,"Kristina Kashyap Is a Meditation Teacher, Author, Holistic Health Coach and Practitioner. She co-facilitates heart circles and retreats with her husband Vivek Kashyap, of My Present Heart, which help bring clarity, trust, depth and joy into the lives of the participants.

She teaches how to create balanced and nurturing relationships with all aspects of the self: body, mind, spirit, energy and emotions. Kristina connects the dots of healing for a simple, practical and vibrant path forward....read more",https://users.insighttimer.com/7hVs8kFP2NfDR4Gc5U7J5HrdjZi2/pictures/square_medium.jpeg
8312,kristinaconstantina,k,84,2022-12-11 20:14:53.038043,name found,Kristina Constantina,,9 followers,English and Nederlands,Joined in Apr 2022,"Kristina is ACT therapist, counselor & breathwork facilitator.",https://users.insighttimer.com/d6K9T2G0W5Y3t9k2e9T4g8C0A2e1h4s2e9A7U5H3S3L9M8g7W2W1g9u6s5f5E3j5u5J8e8B1F4H2H0y0j4w7N7Q5r9E7b3Y7n1q7/pictures/square_medium.jpeg
8313,eridan,k,84,2022-12-11 20:15:02.657801,name found,Kristina Eridan,,9 followers,Русский,Joined in May 2021,Здесь про психологическое Таро как путь самопознания и мудрости. Медитации и психология для современных ведьмочек.,https://users.insighttimer.com/OKpdCr9yHVPAL0FBvbNUxqca9iC2/pictures/square_medium.jpeg
8314,kirstieleigh,k,84,2022-12-11 20:15:11.602350,name found,Kirstie Leigh,,9 followers,English,Joined in Oct 2022,"Kirstie is a nature loving mom and wife who wants to help people get connected with themselves and their intuition. After leaving the corporate world, Kirstie is now diving into the wellness industry and is getting her holistic health coach certification. Kirstie looks forward to helping others connect with their body, mind, and spirit, whether it's through meditation, food, or even just a conversation....read more",https://users.insighttimer.com/W5WeXu0nZjNQBWqJP7500TeeEM43/pictures/square_medium.jpeg
8315,urban_goddess_yoga,k,84,2022-12-11 20:15:35.267985,name found,Kathryn Brown,,9 followers,English,Joined in Aug 2021,Kathryn Brown is the founder of Urban Goddess Yoga and is passionate about dissolving the misconceptions that yoga and spirituality are beyond reach for the everyday person.,https://users.insighttimer.com/08IUe9B29gYSaAXmzvxcCpx73tX2/pictures/square_medium.jpeg
8316,kidculture,k,84,2022-12-11 20:15:42.766255,name found,KidCulture,,9 followers,English,Joined in Aug 2022,"Original audio stories set in other countries that teach kids mindfulness and cultural awareness.  See KidCulture's website for unique videos and activities from around the world - made by kids, for kids. KidCulture's mission is to empower kids to thrive in a globally integrated world by nurturing their hearts and minds through cultural education. All stories are written and produced our team of certified psychologists, children's educators, yoga instructors, and communication experts....read more",https://users.insighttimer.com/0MkIwMfukBQ1OBMhNVRQ1y0GJ1G2/pictures/square_medium.jpeg
8317,karinflohelias,k,84,2022-12-11 20:16:06.599294,name found,Karin Elias,,9 followers,English and Deutsch,Joined in Nov 2021,"Karin is a wellbeing facilitator. She supports women who want to connect more deeply to their inner self and live a truly authentic life. Using mindfulness, sound healing, meditation and bodywork Karin will accompany you on your journey of discovery, acceptance and self love....read more",https://users.insighttimer.com/un5LzHZbjOWXjYrnl0P8w8yGLtD3/pictures/square_medium.jpeg
8318,lotus.wellness,k,84,2022-12-11 20:16:14.567347,name found,Kendal Ann,"Corvallis, OR, USA",9 followers,English,Joined in Mar 2022,"Kendal is a certified meditation teacher with experience stemming from studying under Lama Tsomo with the Namchak Organization. Kendal teaches meditation and relaxation classes at Oregon State University. She has also received her Bachelors of Science degree in Psychology and Biology, and is pursuing her Masters in Clinical Mental Health Counseling....read more",https://users.insighttimer.com/0Nlxo6vjbBdVd8lqUdfXXCSGNVV2/pictures/square_medium.jpeg
8319,yoga.with.kate.amber,k,84,2022-12-11 20:16:22.425270,name found,Kate Amber,,9 followers,English,Joined in Apr 2022,"We create our experience of life based on where we focus our attention.

I focus on yoga and meditation, speaking on living in wellness, going to the beach, petting every dog I see, and funneling it all into planting trees through my non-profit. There's nothing we can't do here - this is a limitless space....read more",https://users.insighttimer.com/z13Hi2AYYXUYduvxcmB7SCQleaJ3/pictures/square_medium.jpeg
8320,kimcee,k,84,2022-12-11 20:16:45.796263,name found,Kim Cee,,9 followers,English,Joined in Sep 2022,"Kim's focuses on self-talk, ritual and managing relationships . Her content tends to be practical, imaginative and also touching. It's intentional, because many guided meditations use flowery and unrelatable language, which is why some people walk away feeling like they don't work. She sees the importance of speaking like people do in everyday life, like they speak in their mind. And dealing with all kinds of life scenarios.  She deeply loves writing, voicework and using them both in service....read more",https://users.insighttimer.com/QKzbRhtdsiY9JKovG21XlcptriU2/pictures/square_medium.jpeg
8321,karenswainson,k,84,2022-12-11 20:16:55.265499,name found,Karen Swainson,"Australia Occidental, Australia",8 followers,English,Joined in Jun 2022,"Karen is a Spiritual Embodiment Mentor who loves taking soul seeking individuals through an experience of connection.
Blending her Intuitive Intelligences Trainer skills along with Spiritual Companioning she curates a sacred energetic space, supporting trauma to be released through breath work, movement practises and intuitively guided method’s, making way for a deeper Soul connection to not just be experienced, though to be whole-heartedly embodied.
Through welcoming embodied connection, so much is more available to us to be explored and embraced....read more",https://users.insighttimer.com/s4r4d8w8e1s6f2m7E3a9F4K2T1R6a0Z9M7p5M9X4M2v0s1H1U6n5U0k8N9j0u3Q9g9T3Q8Y3u6S9K6T7a4A0n2c2f9H9C8a7x8D0/pictures/square_medium.jpeg
8322,hotelwilderness,k,84,2022-12-11 20:17:02.510800,name found,Krystal Thompson,"Los Angeles, CA, USA",8 followers,,Joined in Jun 2021,"Human Design Guide & Sacred Energy Coach working with souls 1:1 and in groups to activate identity-level transformation by releasing the mind's limitations, reconnecting with your internal guidance system, and reawakening the magic within. Welcome home....read more",https://users.insighttimer.com/Ij9Dp6modPdT7oaiFyzcn8zkwcH2/pictures/square_medium.jpeg
8323,serotunein,k,84,2022-12-11 20:17:10.498708,name found,Kurien Thomas,"Charlottesville, VA, USA",8 followers,English,Joined in Jan 2021,"‎SeroTunein is an audio experience that highlights positive phenomena in our world through conversations with psychologists, social entrepreneurs, economists, and mindfulness experts. By tuning into monthly epidoses, listeners can learn how to navigate through life's challenges and use the power of positive thinking to make effective change in their communities....read more",https://users.insighttimer.com/B1p7P9R5g1u3j6W4z2J6B2s5T3d4x4F3U5q1D4g9j5E7w1V5U7j6M2t2u2q5M6N4T1A0R8R4f6h1N8Y7N9w0w2B0t5j0A8m3k4B4/pictures/square_medium.jpeg
8324,pub19505795,k,84,2022-12-11 20:17:19.132411,name found,Kate Penwarn Thompson,"Marietta, GA, USA",8 followers,English,Joined in Jan 2021,"Kate is a Master Life Coach, Emotional Coach and a Health Coach. She is also an author, singer/songwriter, actress and mother to twelve children.

She originally hails from Australia and her journey through divorce, changing countries, changing careers and adopting eight children has given her experience and insight into the difficulty surrounding the pain of moving on and letting go.

Kate loves to work with the health of the whole body, Mental, Emotional, Phyiscal and Spiritual.  Her meditations reflect the Seven Essential Laws and mindset meditation....read more",https://users.insighttimer.com/EUmfEXyjoPa5H2aKbBT4XowY78o1/pictures/square_medium.jpeg
8325,themindfulprof,k,84,2022-12-11 20:17:26.747452,name found,Kelsey Leigh Evans-Amalu,,8 followers,English and Español,Joined in May 2022,"A consultant, researcher, and teacher of education- Dr. K stands upon the intersection of trauma-informed and culturally responsive teaching through the use of mindfulness and social emotional learning skills in k-12 and adult education.

Expert in topics such as: mindfulness and meditation, social emotional learning, trauma informed response, contemplative practices.

PhD in Social Studies Education, MAT in Social Studies Education, 500 Hour E-RYT, Kids Yoga Certified, Trauma Yoga Certified, Certified Meditation Teacher...read more",https://users.insighttimer.com/YAncVZnEq1M04aWa6CQrz0t4UKk2/pictures/square_medium.jpeg
8326,katerinaburianova,k,84,2022-12-11 20:17:34.706735,name found,Katerina Burianova,,8 followers,English,Joined in Jun 2021,"During the day Katerina is a project manager at an architecture firm, after hours you can find her at the beach, meditating, on her yoga mat or traveling to her next adventure. Katerina is a qualified 200hr yoga teacher and has recently started to pursue Vastu Shastra (yoga for your home)...read more",https://users.insighttimer.com/Z8EQfyMoElQXzjEm0AxgR062gZ72/pictures/square_medium.jpeg
8327,universoul,k,84,2022-12-11 20:17:44.208370,name found,Katherina Leili Dreith,"Bangkok, Thailand",8 followers,English,Joined in Jun 2022,"Katherina is an Energy Healer, Intuitive Empath and a Holistic Health Therapist, Teacher and Consultant since 2002. After an illness in 1996, she had a kundalini awakening that led her to heal her body, mind and soul, studied & certified in several modalities such as Ayurveda, Aromatherapy, Massage, Reiki, Tantra Yoga, Nutrition, Fitness and Meditation. After the rite-of-passage into motherhood, she became a Reiki teacher in 2012 and initiated as a Sacred Union Shamanka in 2017. She is very passionate to empower others to self-mastery, sovereignty and be a conscious cocreator by aligning with a soul purpose.

Sacred Union 
Alchemy of Self-Mastery
Purge.Surge.Merge...read more",https://users.insighttimer.com/qzts7QyZSgVuxs9lAxLL436AZRc2/pictures/square_medium.jpeg
8328,kristaolive,k,84,2022-12-11 20:17:52.415872,name found,Krista Olive,,8 followers,English and Español,Joined in Jul 2022,"“Everything in the past is memory, and everything in the future is imagination.” ― Jeffery Deaver. 

Hello, welcome to the present moment. Inhale HERE, Exhale NOW. Embrace stillness, silence, and feel grounded in your daily practice of asana and meditation. 

I am a CYT-300, and am trained in: Yoga Basics, Vinyasa Yoga, Yin-Restorative Yoga, Teaching Methodology, Meditation and Pranayama, Anatomy and Physiology, Subtle Anatomy and Chakras, Yin and Yang Concepts, Yoga Philosophy and Raja Yoga (8 limbs/Ashtanga), Yogic Lifestyle and Values, Ahimsic Food Preparation, and Intro to Specialty Topics including prenatal and postnatal yoga, chair Yoga, visual yoga, kids yoga and more.

Om, Shanti, Shanti, Shanti....read more",https://users.insighttimer.com/Xx4wMbWwYFTvMOQJelawrVVt7M03/pictures/square_medium.jpeg
8329,lib_ec18,k,84,2022-12-11 20:17:59.894265,name found,Karyn Sandelman,,8 followers,English,Joined in Oct 2022,"Karyn Sandelman is a Certified Mindfulness-Based Stress Reduction (MBSR) teacher, a Certified Mindful Schools Teacher, and a seasoned facilitator, mentor and coach. Having experienced the transformative power of mindfulness first-hand, her aim is to support others as they cultivate their innate capacity to live with greater balance, peace, and joy. When she's not ""working,"" Karyn loves connecting with people, animals, and nature, and finding or creating ways to enjoy and appreciate being alive....read more",https://users.insighttimer.com/wUfrQu9oNMOJ1HIwBOmPy6x9d8E2/pictures/square_medium.jpeg
8330,kierstym.xavier,k,84,2022-12-11 20:18:12.500189,name found,Kiersty M. Xavier,,8 followers,English,Joined in Aug 2021,"Kiersty M. Xavier is a seeker of intuitive knowledge and advocate for authentic human expression. She is a Certified Spiritual Care Specialist and Registered Psychotherapist who works in hospital providing care to those experiencing life-altering events. Kiersty’s private psychotherapy practice focuses on holistic well-being and self-exploration. She enjoys her creative writing outlet on Instagram that touches on existential themes of suffering, meaning and love. @theikarusmind...read more",https://users.insighttimer.com/uTvai3zezJXqHIuNa7JsZ4eT0Yg1/pictures/square_medium.jpeg
8331,karlenehauer,k,84,2022-12-11 20:18:30.509976,name found,Karlene Hauer,"South Brookfield, Canada",8 followers,English,Joined in May 2019,"Karlene loves yoga! She fell head-over-heals with the practice 10 years ago and it’s been a non-stop love affair ever since. In 2015 she obtained her 200Hr Yoga Teacher Certification and has been addicted to enhancing her yoga knowledge ever since. In 2017 she was lucky enough to spend 300 hours training with west-coast yogi, Clara Roberts-Oss. Clara’s deep understanding of yoga and her unique and intelligent style of sequencing have greatly impacted Karlene’s approach to the practice....read more",https://users.insighttimer.com/y6p5B5N3Y3J1d1e3J1k6U3X4s3z0V7S2t4g4e4D9p5e5d6Z2u8D4B4L5g6V7B4k2v0K0a9q2J0Z0g6x9f6k2F9K6E8f8U3U8Y6t9/pictures/square_medium.jpeg
8332,kbristowyoga,k,84,2022-12-11 20:18:43.405299,name found,Katherine Bristow,,8 followers,English,Joined in Nov 2022,"Katherine is an Actor / Yoga Teacher with a deep interest in breath + body connection. Her training started in 2013 and has evolved over the years. In 2021 she completed her 200hrs in Portugal, ""A personal practice is everything to me. It allows me to maintain a deep connection to myself, and create a grounding point for me"". Nidra has also become a big part of her practice ""in a world where we are 'on' 24/7, it is important for us to find time to connect not with others, but back to ourselves""....read more",https://users.insighttimer.com/X2dy37al8Gfi4O4zQpU7jVlMOeC3/pictures/square_medium.jpeg
8333,befree-embraceyouruniqueness,k,84,2022-12-11 20:18:51.089599,name found,Kristy Russell,"Agnes Water, Australia",8 followers,English,Joined in Sep 2020,"Kristy is an intuitive mentor and lightworker, drawing upon many certified modalities, including counselling, meditation, life coaching, NLP, crystal healing, shamanism and shadow work, to facilitate her unique individual and group sessions to assist humanity in shifting to a love based, self-sustainable way of life.
...read more",https://users.insighttimer.com/S8m1C2k9c8k4S6v1n4t8p4t9A2a2j9V1D0u2y2q4Q3g4j5F9B0s5g4s1R2E0f1T6S7k3u5P7f1u0s0a4V9z5M3v7Z3A2A7T3V4a5/pictures/square_medium.jpeg
8334,kyom,k,84,2022-12-11 20:19:00.997683,name found,Ky Om,,8 followers,English and Deutsch,Joined in Nov 2022,"MY LIFE IS PURE TRANSFORMATION

I go where it hurts. Leaving nothing in my life untouched. Exploring every subtle part of what I would call ""me"". As deep as I can.
This ""quest for truth"" has brought me pain and suffering along the way. And yet, it has gifted me the greatest joys I could imagine.
It brought me wisdom. Love. Peace. And made me live life in 4K, instead of sticking to the old 480p resolution I've used to experience life in.

Come. Join me in living life fully. See life, taste life, feel life in ultra high definition. And let me hold space for your very own journey of getting there.

With all the love
Ky...read more",https://users.insighttimer.com/2pkhXQRxhJVrvNT5CrucvYKtmEP2/pictures/square_medium.jpeg
8335,mindful_obsession,k,84,2022-12-11 20:19:16.557471,name found,Karly Placek,,8 followers,English,Joined in Aug 2022,"“Smile, breathe and go slowly.” 
― Thich Nhat Hanh

Karly Placek is a sound healer, mental health advocate, and non-fiction television producer based in Los Angeles, CA. She specializes in working with folks within the OCD community as mindfulness practices have been an instrumental part of her own mental health journey. She aims to help all earthlings mindfully meet each moment with radical acceptance.  

Karly has completed THE DEN Meditation's 400-hr Teacher Training course....read more",https://users.insighttimer.com/D6C2Y5B0x7W7H8D2z7p9E3R9Z9A6Z4L2k9A6X1P3V6A6n5K3X8L8a0Q0f1c0Z9Q3h5K6t1a5b0W6E6U3d6X4U6A6D5x3x7k3C1C5/pictures/square_medium.jpeg
8336,crusadingspirit,k,84,2022-12-11 20:19:42.018914,name found,Kylie Clarke,"NSW, Australia",7 followers,English,Joined in May 2020,"May you find here the inspiration to know yourself, free yourself, and empower yourself.
​
I support individuals in creating an outer world that reflects their inner reality.
​
Embody Nadora is a holistic approach to a deeper connection to self - mind, heart, spirit and body.

Each part of us is as important as the other for daily functionality, balance, and well-being.
 
You will find tools, processes, and guidance here to help you in all the different aspects of your life and your journey.....read more",https://users.insighttimer.com/E4a9J5s6q3P4K6S3H1f6E8e6c3P2s4F1G8s6H2B1p6m6T9d4C2Z0v6m5V2x7G4K4R0d2H8r1e2z5W6e7g9f8e4u1V7K3U7w1F3C7/pictures/square_medium.jpeg
