,teacher_id,alpha_index,batch_id,scrape_date,scrape_status,teacher_name,location,followers,languages,date_joined,about,image_url
11000,marlou.pure.essence,m,111,2022-12-11 17:47:05.440306,name found,Marlou Kamphuis,,5 followers,English,Joined in Mar 2022,"Marlou is a certified meditation teacher in guided and self-directed meditation. For Marlou, the pure essence of her spiritual journey is practice. The pure essence of practice is meditation. And the pure essence of meditation is teaching your mind to become aware of itself. Her life purpose is to help others to see this and become the beautiful person they already are....read more",https://users.insighttimer.com/w8D3e9Z2B4m9t3x0f4E8N3u6V4Q3U7U1U1A0m0Y6Z4Z2w2X6k4m9P9c8h8J8h7d5J1j0n2P0G2T4L9w0c2D0k3F3f7M5p4h2g0j3/pictures/square_medium.jpeg
11001,toomuchfuture,m,111,2022-12-11 17:47:08.256215,name found,Madeleine Woodward,,5 followers,English,Joined in Jun 2022,"Allow Madeleine to be your guide and help you have a change in energy, a change in balance and a change in life.

Madeleine created this series of short healing exercises, (or guided meditations), to help others, and herself, move through life with ease and clarity.

Each exercise uses a unique combination of breathwork, meditation, visualisation, manifestation sound and mudras with the purpose of disempowering painful, negative, toxic and misplaced energy which shows up in the body as stress, anxiety, depression, jealousy, frustration, anger…. and all the rest.

The intention is self-realisation, deep healing, pain relief, relaxation, transformation and evolving consciousness for the greater good of yourself and all others.

Change your energy - Change your life!...read more",https://users.insighttimer.com/H0W5SlchQiShKAmR4COB6iIvxB93/pictures/square_medium.jpeg
11002,themindfulinnovator,m,111,2022-12-11 17:47:27.213800,name found,Matt Mueller,"Palmetto, FL, USA",5 followers,English,Joined in Aug 2022,"Matt Mueller is a believer that every person has the ability to create massive impactful change. But fear and today's social construct dampen the courage of many, leaving great ideas never heard. Matt questioned today’s methods and looked for inspiration from our ancestors. How did we innovate before there was a book about it? With a little bit of curiosity Matt discovered the keys to become a leader in Innovation. With expertise in facilitation, strategy and insights Matt brings the ideas of others to life in a big way. Whether its advocating change for a complex corporation or not-for-profit organization, with some thoughtful planning, ideas can break through!
Matt wants to share his knowledge of change and developing innovation with you to show you that we have over complicated the process. If we just took a step back, analyze what is really in front us and simplified our approach we are on the cusp of making meaningful change. All that is left is to breath and be courageous!...read more",https://users.insighttimer.com/A2M9h8K7A5u7d0p1f7X8D5U1Q5t0g0v2K0k4e1x9n9Z3F7Y5F8f5T5W0n9c2Z7F5v2H7w6P0Z9G5W3V5n7y2b0S8P2z3j0d6L5u9/pictures/square_medium.jpeg
11003,yogimarcus,m,111,2022-12-11 17:47:38.270474,name found,Marcus Berardino,"New York, NY",4 followers,,Joined in Dec 2020,"Marcus found the practice of yoga in the 1990s after moving to New York. With a desire to be fit and healthy, and to temper his new life in the unfamiliar fast lane of the big city, he began exploring this ancient method of calming the mind at the local “sacred” YMCA. Following brief periods exploring several methods of yoga, he decided to combine his professional skills as a Massage Therapist with his deepening yogic discipline and completed two yoga teacher certifications through Laughing Lotus, and Prajna Yoga. Marcus’s classes combine vigorous, inventive sequencing with breath awareness, alignment, humor, and lots of heart to invoke a sense of celebration of one’s life. In addition to teaching private and public classes locally, he’s taught yoga retreats around the globe such as England, India and Turkey. He’s been involved with several yoga teacher training programs with Prema Yoga Brooklyn. 
...read more",https://users.insighttimer.com/vafZScjFmdOhJZVX5favhaNuRE03/pictures/square_medium.jpeg
11004,trustlove,m,111,2022-12-11 17:47:56.929642,name found,Mandira Mouritsen,"Copenhagen, Denmark",4 followers,English and Dansk,Joined in Mar 2021,"Mandira is a Danish mystic, whose awakening journey is based on a meditative practice shaped by the school of life. 

She has guided and inspired thousands of people, with a deep, heartfelt desire to help people remember their inner wisdom, and find peace and happiness in life. Her soul calling is to inspire compassion and love in the individual - and thereby, in the world....read more",https://users.insighttimer.com/8deKp7mRsIe3z5iPP17ee8MLgu63/pictures/square_medium.jpeg
11005,lifesurfing,m,111,2022-12-11 17:48:15.653918,name found,Marisa Whitty,,4 followers,English,Joined in Feb 2022,"Marisa Whitty, aka Lifesurfing, has been providing healing and wellbeing workshops for over 20 years. A committed student of Insight Meditation practice (Vipassana), Mindfulness Teacher and Yoga Nidra instructor. 
Marisa is passionate about sharing simple techniques of wellbeing with people of all ages to remember the healing potential within themselves. Here she shares simple Mindfulness Meditation and Yoga Nidra guidance – both powerful tools for good mental and physical wellness....read more",https://users.insighttimer.com/oD8yHZFCMtMQlkcfoUkNsBS0tom2/pictures/square_medium.jpeg
11006,mariana.melo.art,m,111,2022-12-11 17:48:18.492906,name found,Mariana Melo,,4 followers,English and BR. Português,Joined in Aug 2022,"Mariana is a Mandala Artist based in Taranaki-NZ, coming from a background in Astrology and Anthroposophy. She truly believes in the healing power of mandalas, gemstones and the arts in general.

She started painting mandalas after going through a huge burnout, stemming from an incredibly busy life, which had her looking for ways is slow down, cultivate presence and stillness. She was desperate for a moment of bliss and serenity, amidst the chaos. She found the healing she was looking for in painting and contemplating mandalas, as well as in chanting Sanskrit mantras.

She believes that her mandala art represents a meaningful way to contribute to other people's healing, and to raise the vibration of the planet, is this is why she decided to teach Mandala Dotting for Beginners online and spread the magic!...read more",https://users.insighttimer.com/qA2tExjcWCdK64KeFQEsfQNgFV62/pictures/square_medium.jpeg
11007,selfremembrance,m,111,2022-12-11 17:48:21.546128,name found,Megan Armstrong,"California, USA",4 followers,English,Joined in Mar 2021,"Megan is an embodiment teacher revolutionizing living with dis-ease. Anchored in her own body's wisdom, Megan guides practitioners to move from dis-ease to ease & awaken embodied liberation.",https://users.insighttimer.com/V9W9U1GxHlZ9aElNntAVuqk4NVR2/pictures/square_medium.jpeg
11008,mariaberndorfer,m,111,2022-12-11 17:48:24.211473,name found,Maria Berndorfer,"Vienna, Austria",4 followers,English and Deutsch,Joined in Apr 2022,"My whole life I am fascinated by death and what exists beyond, searching for ways to explore the dimensions of existence through different states of consciousness and various paths to reach them. Studying religions and concepts of what life is all about I explored Theta Healing, Quantum Healing, Pleiadean and Sirian Light Work, Atlantean Crystal Work, Energetic Transformation and Exorcism, Channeling and Soul Travel quite excessively. In these years I proved to myself the existence of the soul beyond the borders of the physical body.

Exploring a conscious, mindful and spiritual approach to work and live with intense emotions and a highly sensitive perception of the world, I decided that it is time now to share what brought me to the point where I am in life right now. Now is the time to face what goes beyond the ordinary. Now more than ever....read more",https://users.insighttimer.com/KHEO9GWbsEPK9vyf4RnZJeLhGc23/pictures/square_medium.jpeg
11009,martinblank,m,111,2022-12-11 17:48:53.020315,name found,Martin Blank,,4 followers,English,Joined in Jun 2020,"Educator, musician and 200H yoga and meditation teacher, Martín Blank has taught restorative practices, mindfulness, breathing, to over 15,000 students, administrators, and teachers across North America. He consults and speaks on the topic of social emotional learning, and is a recipient of the Christopher Peterson Memorial Fellowship at the Penn's MAPP Program. He lives with his wife in Philadelphia, USA, and enjoys sailing, working with teachers and students, and making people laugh....read more",https://users.insighttimer.com/d5j2D2B6b0h8K7Y0h3d5J2w6j8V8N5b4Q0q5z7N2z4F9k8y6V8y8E6z1f7r4w7T1Q4j3z2Q0N3S1w1w6a3c8m2g8z8R5K0x5p8V4/pictures/square_medium.jpeg
11010,mags_yoga,m,111,2022-12-11 17:49:11.717574,name found,Mags Russell,"Newtonhill, United Kingdom",4 followers,English,Joined in Jul 2020,"Hi,

I started yoga classes in 2003. These included yoga, mixed with relaxation and meditation. It has helped me through many hard times. After getting cancer in 2013 I decided I would change a few things in my life. So I retrained as a yoga teacher with Yoga Scotland in 2015. I now run yoga classes local to me. My students love my relaxations at the end of each class. A few have asked for recordings so that's why I'm here. To share....read more",https://users.insighttimer.com/k5R2F1K7m1G5k4U1M1b5E1H0V7G5G5U1G5N1d1p4c2N3Y5s0z4C3T2W4v9J4T3P2T2a2f8v8V5f0g8N4G8B3S8d8W2n1E0s5F1g7/pictures/square_medium.jpeg
11011,theinvertedattorney,m,111,2022-12-11 17:49:14.294718,name found,Madiha Vallani,,4 followers,English,Joined in May 2021,"Madi is a lawyer and certified yoga teacher with over 500 hours of teacher training. 

Madi believes that each of us is uniquely multifaceted with individual needs. Her classes embody the multi-facetedness of Yoga: a celebration of the physical body, an opportunity to explore the energetic body, a reminder to stay present and live a life of nonviolence (towards oneself and others), a means to detach from anything that is no longer serving a purpose, and the balance to life off the mat....read more",https://users.insighttimer.com/ehyPzdRKR8WoVOKQ60s9I48UNZz1/pictures/square_medium.jpeg
11012,mildaurban,m,111,2022-12-11 17:49:16.815178,name found,Milda Urban,"Split, Croatia",4 followers,English,Joined in Jan 2020,"Milda is a yoga teacher, with a special focus on Hatha yoga, light and mindful flows, gentle restorative and deep yin practices. Her goal is for the students to discover what is the practice THEY identify with most, to find balance and to live with more ease. She loves travel, stories and coffee. ...read more",https://users.insighttimer.com/R0c6M7h5J4P0N4N9Z4v7b0W7n1J7v1j8E2j4b6L1Q5v8z6E2u5p6Q2A4R7m4J1r8Y8r7u6C9y1e9e2b7h7K2U9b1d1M8k4w0d4Z0/pictures/square_medium.jpeg
11013,mackbelcastro,m,111,2022-12-11 17:49:35.557330,name found,Mackenzie Belcastro,,4 followers,English,Joined in Mar 2022,"Mackenzie Belcastro is a writer, podcaster, Reiki practitioner, and Inner Wellness Guide. She believes we have each been brought to this earth with gifts we're meant to bestow, and it is our deepest calling to tune in and access them. Her work centres on tending to the garden within—weeding out what doesn't serve in order to cull space for what does: passion, purpose, presence, spirituality, and courage to be....read more",https://users.insighttimer.com/Yn9zQ5EObgOUwrDNSZ5j4eI8jBr1/pictures/square_medium.jpeg
11014,maggiemoon,m,111,2022-12-11 17:49:54.351261,name found,Maggie Perkins,,4 followers,English,Joined in Sep 2022,"Hi! My name is Maggie and I am an integrative nutrition coach, avid meditator and nutrition therapy practitioner in training. I love helping others reach higher levels of consciousness and fall more in love with themselves and their life....read more",https://users.insighttimer.com/FyFlULVqxOWQfI5GRIpB54oXVoq2/pictures/square_medium.jpeg
11015,mindbodymiller,m,111,2022-12-11 17:50:07.218427,name found,Meghan Miller,"Michigan, USA",4 followers,English,Joined in Jun 2022,"Meghan Miller believes in providing an oasis for busy people around the world to pause, to reflect, and to tune in to their own greatness. She guides you into a healthy lifestyle full of grace and elegance! In doing so her followers can change their lives, their families lives and impact their communities. 

She began her wellness journey as a Pilates instructor and expanded her toolbox over the years to heal/cope from a mental health disorder of Bipolar 1. If you are feeling overwhelmed by life’s demands, her services and teachings aim to introduce clarity and self-motivation. She holds certifications in Personal Training (ACE), Nutrition Coaching (Precision Nutrition), Trigger Point Therapy, Reiki, Journal Therapy, Life Purpose Coaching, Meditation Practitioner and EFT/TFT Tapping. 
@MindBodyMiller on IG...read more",https://users.insighttimer.com/X9x5j6g3m0C2F8n5X4B6j4V8r4x6h0W0J8X2j5S1A1A3z9Q2R9v1h3F7R3P3b5y5s8e9a1r1n7P3f5S0R3J5v4Y5Q7v4A8e6e5F6/pictures/square_medium.jpeg
11016,mekocloud,m,111,2022-12-11 17:50:25.946173,name found,Meko Cloud,,4 followers,English and Español,Joined in Aug 2022,"meko is a an ambient musician from argentina and also a yoga and meditation teacher. through his musical compositions he creates soundscapes where themes such as nature, human emotions and healing are explored, and creates a bridge for the listener to meet different destinations inside and outside of himself. his music is ideal for meditation, savasana, deep relaxation or just a moment of peace and tranquility....read more",https://users.insighttimer.com/vBTf896EfFb2B60eryExjrXldk13/pictures/square_medium.jpeg
11017,martinadavitkova,m,111,2022-12-11 17:50:29.741421,name found,Martina Davitkova,Sweden,4 followers,"English, Svenska and Français",Joined in Oct 2022,"Martina is a swedish yoga and meditation teacher with an interest in holistic health and healing. She got her 200 h teachers certificate in Bali, Yoga barn, in 2014 with Cat Kabira yoga energetics training. A special training containing not only yoga but the energetic healing touch as well....read more",https://users.insighttimer.com/818S0l8pmrSHY3Lp34OUovdvdYa2/pictures/square_medium.jpeg
11018,mpasrija,m,111,2022-12-11 17:50:34.750856,name found,Mridu Pasrija,"Northville, MI, USA",3 followers,English,Joined in Apr 2020,"Mridu is a certified mindfulness meditation teacher and coach, energy healer and life coach. She also works part time in the corporate world as a Senior Product Specialist. Her passion lies in empowering individuals through mindfulness and meditation, encouraging them to tap into their inner wisdom and stillness.  ...read more",https://users.insighttimer.com/r9q8e8T8z9t8C8w5s4a6C4F3X2B6X3t7y5r4G9K7A5g0T7b7C4j0B0z2u8W9p6y6X7h7J5b1p1f5F1u8E5f2L1n0K5j8b7p6u5Y8/pictures/square_medium.jpeg
11019,myrrachevalier,m,111,2022-12-11 17:50:38.048852,name found,Myrra Tschante,"Stockholm, Sweden",3 followers,English,Joined in Aug 2020,"Myrra Tschante, L.L.M, is a speaker and an educator.  She loves and emerges herself into yoga, meditation, Qi Gong since 2001.

She has explored a vast amount of different meditation practices as well as yogic disciplines.

She incorporates her passion for personal development as well as physical well-being into her meditations. Her teachings focus on empowering others through exploration of the body and mind....read more",https://users.insighttimer.com/x5B0b1U1c2m5Q3r5d1a7w9U7A5f3c2e1A6M7f5g0T4c1s4r2z1n4S0z1a8Y9W1z3m6f6P2b8v9M5F7v7Z4G8V1s1H7x1Q3x8S7b8/pictures/square_medium.jpeg
11020,maliwatta,m,111,2022-12-11 17:51:05.027883,name found,Malicka Sang,"London, UK",3 followers,,Joined in Apr 2021,"Malicka’s 741hz guided meditations & affirmations are another element to add to the toolbox to assist you in getting you closer to your goal. They are tailored to each North Nodes, and other placements to help you manifest the results you need. Your rewards is what your heart  truly desires, only when you align to the purpose meant for you....read more",https://users.insighttimer.com/CCZJM0OfosU3ZTtW8BCVfsXoP1T2/pictures/square_medium.jpeg
11021,i.am.mfw,m,111,2022-12-11 17:51:23.705791,name found,Marcus Williams,,3 followers,English,Joined in Jan 2022,Doing my part to eradicate leadership lifestyle poverty. Serving leaders by helping them navigate the journey of living intentionally for eternity. The primary aim of this platform is to provide reflective practices that speak to the soul-level needs of today's leaders. Hoping to make a meaningful spiritual impact on individuals navigating the challenges of life and leadership....read more,https://users.insighttimer.com/c7w5W4S7Q4J9w6b2r7b5G7p1n6S5B1t0w6J0n9W7C3s9H3t8D3H5U8s0Z7e6u4F7b4D2J5f2K2m8s7P4p3W5C9S7E4e3k5v7P2X2/pictures/square_medium.jpeg
11022,lakecomowellness,m,111,2022-12-11 17:51:42.389934,name found,Madeline Fahey-Gibson,,3 followers,English,Joined in Dec 2021,"Madeline is a Level 3 trained Internal Family Systems Practitioner & Yoga Teacher from the UK who lives in Lake Como Italy, where she runs online & in-person wellness events, retreats & works with individuals & groups using the compassionate framework that IFS provides....read more",https://users.insighttimer.com/O9sVYwPeTWSktyxMNHTdRJcjPPU2/pictures/square_medium.jpeg
11023,milynbrazier,m,111,2022-12-11 17:52:01.223417,name found,Milyn Brazier,,3 followers,English,Joined in Aug 2022,"Milyn is an Equine Intuitive.
As a qualified physiotherapist Milyn’s path led her to her first love – horses.
Milyn uses her experience, intuition and her deep desire to promote the connection between humans and horses to give others permission to truly understand, connect and heal – themselves and their equine family, so that they can both fulfil the potential they’ve been gifted....read more",https://users.insighttimer.com/TEkWWRiiNmYclnRxTBaOWoMSbGa2/pictures/square_medium.jpeg
11024,essentialembodiedenergy,m,111,2022-12-11 17:52:20.037072,name found,Michelle Beaulieu,,3 followers,English,Joined in Aug 2022,"Trained as a clinical psychotherapist, I blend elements from my years of experience treating trauma and anxiety with a variety of integrated healing approaches. I see myself as a bridge between traditional allopathic Western medicine and ancient healing practices. It’s my experience that healing comes from the heart center.  My non-dual approach to healing allows me to help people open to compassion and to heal at a cellular and soul level....read more",https://users.insighttimer.com/Ckag9rooMUcgulNwfJaBSGcY5NY2/pictures/square_medium.jpeg
11025,sanfteserwachen,m,111,2022-12-11 17:52:38.704818,name found,Madelaine Perroulaz,,3 followers,Schweizerdeutsch and Deutsch,Joined in Nov 2021,"Madelaine, die Stimme von Sanftes Erwachen hat sich schon als Kind mit der tiefgründigen Frage; ""Wer bin ich"", auseinandergesetzt. Ihre Suche nach der richtigen Antwort hat sie nie aufgegeben und hat in verschiedene Methoden darin gesucht. Im Yoga fand sie einen Hauch dieser Antwort und machte eine 4-Jährige Solide Ausbildung zur dipl. Yogalehrerin YCH. Seit dem Jahre 2006 begleitet Madelaine in ihrer eigenen Yogaschule viele Menschen. Mittlerweile hat sie sich auf Meditationen spezialisiert. Ihre Meditationen sind tiefgründig und begleiten die Menschen in ihrem ""ERWACHEN"". Daraus ist ""Sanftes Erwachen"" entstanden. Eine Anleitung mit Erläuterungen und Meditationen zum Erwachen und erkennen wer du wirklich bist....read more",https://users.insighttimer.com/OLN2jkMKOAWfPlEUl4Azde7tkLr1/pictures/square_medium.jpeg
11026,dewegnaarmezelf,m,111,2022-12-11 17:53:07.620985,name found,Melissa Janssen,"Limburg, Belgium",3 followers,Nederlands,Joined in Apr 2022,"Melissa's leven staat in het teken van yoga, meditatie & journaling en ze leidt vrouwencirkels in spiritualiteit, zelfontwikkeling en zelfzorg.

",https://users.insighttimer.com/a9j3E0v0s3Y9B2D1P7u1R7f2a8t3V1G2q9e8Y7P5j5X2a5e5w7u6E0X5J4A6E8d8e8A1s4H6J5B6B7u6s9J4v6u2j6P5K5W4V7B4/pictures/square_medium.jpeg
11027,innamaksymenko,m,111,2022-12-11 17:53:10.197540,name found,Maksymenko Inna,,3 followers,Русский and український,Joined in Nov 2021,"С помощью практик осознанности вы соприкоснетесь с собой.Узнаёте о своих неосознанных действиях и поступках. Откроете новый мир ощущений, эмоций и реакций, научитесь взаимодействию с ними.Начнёте проявлять интерес к себе и к любому повседневному процессу. Снизить уровень стресса.Сон стан здоровым.Появится возможность взаимодействовать со сложными и неприятными эмоциями, не разрушая ничего вокруг.Начнете проявлять заботу о себе.Откроете двери навстречу своему счастью, спокойствию и благополучию....read more",https://users.insighttimer.com/srT0R4EQwpfCm0kPwP5ZLyhIPs52/pictures/square_medium.jpeg
11028,themotherofmedicine,m,111,2022-12-11 17:53:28.996118,name found,Mami Ani Igwe,"District of Columbia, USA",3 followers,English,Joined in Nov 2022,"Mother of EARF. SACRED MOTHER - Andromeda

Reiki Master and Ancestral Medicine Woman. 

Offering REIKI INFUSED GUIDED PLANT SPIRIT MEDITATIONS 
- ANTI ANXIETY
- OPEN THE THIRD EYE
- CONNECTING WITH THE INNER CHILD
- CLEARING ANCESTRAL TRAUMA...read more",https://users.insighttimer.com/2dyDLAs0q9QKybF6wWrM4XvFA3j1/pictures/square_medium.jpeg
11029,magssheridan,m,111,2022-12-11 17:53:47.747820,name found,Mags Sheridan,"Sydney NSW, Australia",3 followers,English,Joined in Nov 2022,Recovery mentor and embodiment coach Mags Sheridan leads you in an approachable practice of observing your mind. Learning skills like centering yourself and concentrating will allow you to find ease in all areas of life by becoming fluent with your emotions. These trauma-informed explorations invite you to make friends with your body and connect with your inner wisdom....read more,https://users.insighttimer.com/F5r8d1m8D1X4Y8n4T6u8d0r4M4z5e0P1n6a2j1j7J6d4t0t3f0n2A7Z5R8u7R9w4N8Q7n1f2Q6X4r6v6M4W3V1p2Y6Z6Z6m5k5r4/pictures/square_medium.jpeg
11030,manon.holigami,m,111,2022-12-11 17:53:50.487469,name found,Manon Holigami,,3 followers,Français and English,Joined in Mar 2022,Naturopathe spécialisée en fertilité et Moon Mother basée dans la région Bordelaise,https://users.insighttimer.com/SxIPb4T5hZUynMZurIAgC1wVByC3/pictures/square_medium.jpeg
11031,melinda.spirande.nu,m,111,2022-12-11 17:54:09.163766,name found,Melinda Andersson,,3 followers,Svenska,Joined in Oct 2022,"Melinda vill inspirera till att lyssna inåt, hitta sin inre sanning och tillåta den att spira. Ett andetag, en meditation och en rörelse i taget.",https://users.insighttimer.com/Friw4MEckFUdBHSmanBFozHLnvf1/pictures/square_medium.jpeg
11032,chielpiano,m,111,2022-12-11 17:54:22.010947,name found,Michiel Brinkmann,"Haarlem, Netherlands",3 followers,,Joined in Sep 2020,"Michiel has always had a strong love for music. When he was nine years old he started following guitar lessons. At the age of 11, he created his love for jazz. Besides always having played the guitar and for a short period also the saxophone, he, later on, started playing the piano at the age of 18. Michiel sees himself as an improvising pianist who creates music that includes inspiration from all styles. Michiel sees himself as an improvising pianist....read more",https://users.insighttimer.com/P2h3b2q3z3f3Q7L0c7Y1M8R3U1t5w0m6R6c8W1V4m2b7L3S0R6R2H7h6Y8u1f6m8T8z3v0D7r2w8c7m9T5a6Q7S9a7k6R8e4r5U8/pictures/square_medium.jpeg
11033,marciewalkercoaching,m,111,2022-12-11 17:54:40.712133,name found,Marcie Walker,,3 followers,English,Joined in Oct 2021,"A woman-owned business founded in 2016, Marcie Walker LLC focuses on holistic wellness through brain-based coaching and body-centered hypnotherapy. As a Certified Clinical Hypnotherapist and Certified Executive Leadership and Development Coach, Marcie Walker helps people own their circumstances and take control of their lives by providing practical tools to relieve stress, stop suffering, and find solutions. 

With specialties in therapeutic imagery, trauma resolution, and hypnosis for immune disorders, she uses hypnosis to help change lifestyles, reset stress hormones, and improve focus. Marcie also works with executives and leaders to create and cultivate cultures that address the physiological and psychological needs of their teams....read more",https://users.insighttimer.com/ZUX9VBCuduMoBCIiJbANwhUttex2/pictures/square_medium.jpeg
11034,marinaarrudaa,m,111,2022-12-11 17:54:59.527712,name found,Marina Arruda,,3 followers,"BR. Português, Português and English",Joined in Sep 2022,"Atua como professora de yoga, também como parceira no projeto Conexão Equestre e administra a produção dos cosméticos OLIQ.
Também realiza ensaios fotográficos procurando retratar a autenticidade de cada ser. Especializada em retratos para divulgação de vocação profissional.

Professora de Yoga pela aliança internacional e brasileira do Yoga com Yoga Arts (Bali, Indonésia) e Karime Neider (São Paulo/Brasil).
Aromaterapeuta pelo Instituto Aroma Flora (São Paulo/Brasil)....read more",https://users.insighttimer.com/6VV8cJeeL7Ug8Ydi42fdKehh5kQ2/pictures/square_medium.jpeg
