,teacher_id,alpha_index,batch_id,scrape_date,scrape_status,teacher_name,location,followers,languages,date_joined,about,image_url
8374,kimsterenborg,k,84,2022-12-11 20:28:19.870195,name found,Kim Sterenborg,,5 followers,English and Nederlands,Joined in Sep 2022,"Kim is a certified yoga teacher with additional training in yoga nidra. She was once introduced to yoga nidra when she had trouble sleeping. The effects were powerful, so she set out on a journey to discover more and was hooked.",https://users.insighttimer.com/P5GOnJXUWUOvhCrd9JqMSeJCq192/pictures/square_medium.jpeg
8375,kristadonnayoga,k,84,2022-12-11 20:28:27.138215,name found,Krista Donna,,5 followers,English,Joined in Sep 2022,"Krista helps people slow down and manage their stress from the business of life with yin yoga and meditation. Krista is passionate about yin and anatomy. Krista teaches yoga in the Niagara Region, Ontario.",https://users.insighttimer.com/F8P6E1F9T5T6x9Z2B2y2K2G6E9D3E9P6b5S4p1G5p6k4F4Z6B1Z4p0r8r7A1h6S2u8m0m8R3M6v1v3J3B7E0k1T2S3x2v6N2J7G0/pictures/square_medium.jpeg
8376,yokaze,k,84,2022-12-11 20:28:34.504651,name found,Karin Zetterlund,,5 followers,Svenska,Joined in Feb 2022,"Karin fell in love with yoga 2017 and has been teaching since beginning of 2021. She teaches at Västerås gymnastic association and at Utopia Yoga Studios. She does mostly Vinyasa, Yin and yoga nidra. She encourages her students to get to know their body along with their breathing....read more",https://users.insighttimer.com/zB7XJXRgLqhkU93jNnH8q0MX7tn2/pictures/square_medium.jpeg
8377,livegreatly,k,84,2022-12-11 20:28:57.789321,name found,Kristel Bauer,,4 followers,English,Joined in May 2020,"Kristel Bauer PA-C is the Founder of Live Greatly. Her mission is to help you achieve optimal health in mind, body, and spirit to attain success.  Kristel bridges the gap between Conventional Western Medicine and Meditation & Mindfulness. Kristel has experience in Integrative Psychiatry & Functional Medicine. She is an Integrative Medicine Fellow, Podcast host of “Live Greatly”, Keynote Speaker, and University Lecturer. Learn more at www.livegreatly.co



...read more",https://users.insighttimer.com/p0X9a3v2C3z7t6H5U7j3v5p3b3q3K7h4J8Z0Q2G7X9v0P9E7c8e5T9G3E5j3w1c1k5M1M0E1J2z0m6N1e1P7u6b9Q3d0x5a7w8w3/pictures/square_medium.jpeg
8378,afreegiston,k,84,2022-12-11 20:29:04.994177,name found,Kseniya Belokhvost ,"Saint Petersburg, Russia",4 followers,,Joined in May 2021,"Йогиня с 6-летним стажем собственных практик, преподаю женскую Хатха-йогу, йогу в гамаках и медитативные практики, также в своих уроках использую пранаямы и пение.",https://users.insighttimer.com/bdYuYhVE8FeJTfPMczwxQFi1jOM2/pictures/square_medium.jpeg
8379,kelseeroses,k,84,2022-12-11 20:29:12.436691,name found,Kelsey Rose,,4 followers,English,Joined in Dec 2021,"Kelsey Rose is a multi-disciplinary artist, wearing many hats; always ""making it work.""  The healing arts practices have been the golden thread that have kept everything in working order in her journey and she has become dedicated to bringing practices to others. 

Kelsey has years of experience leading groups of all ages and backgrounds within the yoga and meditation communities and beyond.  Kelsey practices Insight Meditation and leads Mindfulness based in Buddhist Dharma principles.  

Kelsey is a RYT in Yoga Therapy and Alignment. Kelsey is currently in the MMTCP '23 certificate program with Tara Brach and Jack Kornfield....read more",https://users.insighttimer.com/unlU7OcMq4NnFbqSexbousqXsdB2/pictures/square_medium.jpeg
8380,tadasanamama,k,84,2022-12-11 20:29:19.877706,name found,Kristine Jones,"Truckee, CA, USA",4 followers,English,Joined in Jan 2022,"Kristine Jones has been practicing yoga for almost two decades. She graduated from Janet Stone's yoga school with a RYT 200 certification through Yoga Alliance. Kristine has turned to yoga, meditation, and writing to help her through many difficult life transitions. Based in Truckee, California, she now shares what she has learned with others on Tadasana Mama and Yoga then Pizza....read more",https://users.insighttimer.com/aR1WPE3XQ9SDDK0CMdfnbO65VYe2/pictures/square_medium.jpeg
8381,kamav,k,84,2022-12-11 20:29:27.399244,name found,Kamav Integrativa,,4 followers,BR. Português and English,Joined in Aug 2022,"Através de meditações guiadas queremos auxiliar seres a praticar o autoconhecimento, autocuidado e expansão da consciência.",https://users.insighttimer.com/zEeBwcBPKueWqbjibC1uLz1gsPK2/pictures/square_medium.jpeg
8382,kateyogaryan,k,84,2022-12-11 20:29:42.421902,name found,Kate Ryan,,4 followers,,Joined in Aug 2021,"Kate is a Chicago-based Yoga and Meditation instructor, specializing in mindful healing for the whole person. After teaching for many years in traditional studios throughout the Chicagoland area, Kate felt called to serve the communities that have impacted her life in a profound way.  She now practices Trauma-Informed Care, and specializes in the areas of Women’s Wellness, Recovery, Anxiety, and Healing. 

...read more",https://users.insighttimer.com/ga9JhmWY19cfXsTLIRPCt2ZjGlJ3/pictures/square_medium.jpeg
8383,pub14951680,k,84,2022-12-11 20:30:02.519589,name found,Kris Cassidy,"Colorado Springs, CO, USA",4 followers,English,Joined in Mar 2021,Kris Cassidy first experienced breathwork at the Findhorn community. It benefited him greatly and he became certified as a practitioner with Leonard Orr in 1980. He led breath workshops in Europe and Japan before moving to the USA  in 2000 where he founded Breakthrough Breathwork Meditation. He currently practices in Colorado Springs with his wife Savanna. They offer virtual sessions to help with the global awakening....read more,https://users.insighttimer.com/V2B7z9V0y2s5j9r1h4m4k6E8u2p7s7w2F1R8E4s0b8h0D9v0P1x3v5F0z9S5N7N6g9L7f3J9R5Q6q7m4K8J3V9H3C3K4d0e7X7b0/pictures/square_medium.jpeg
8384,kirstenessling,k,84,2022-12-11 20:30:20.701130,name found,Kirsten Essling,"Hattersheim am Main, Germany",4 followers,Deutsch,Joined in Mar 2020,Ich bin Buddhistin und intuitives Medium.,https://users.insighttimer.com/n1m9u0X0W3T9p8H8A4Y3n3X5k4B1b6t8N3N2K1k1E5w8U6a0d6h7E6n6K5u9Y4V9a5g6h0R1D7b1Q1W0n9L0x7g5Y8X4v6z1t6b6/pictures/square_medium.jpeg
8385,themindful.way,k,84,2022-12-11 20:30:34.684458,name found,Karly Knight Mongeon,,4 followers,English and Français,Joined in Mar 2022,"A simple, yet powerful mission to help others live purposefully, freely, and intentionally using mindfulness, yoga and meditation practices. 

The light in me honors the light in you, and together we can share our light out into every corner of the world...read more",https://users.insighttimer.com/Cq1d7fSYFLTDH0VOb16lwGxPA4d2/pictures/square_medium.jpeg
8386,comealive,k,84,2022-12-11 20:30:58.273480,name found,Katie Rose,,4 followers,English,Joined in Nov 2022,"Katie Rose is the owner and founder of Come Alive Healing Adventures located in the northwest corner of Montana. Her insights, teachings, and perspectives stem from the wisdom that horses, nature, yoga, nutrition, and creativity provide. With a background in aeronautics and the personal experience of moving out of the societal norm of fitting in, Katie Rose has developed the Come Alive approach rooted in helping others find their unique gifts, strengths, and abilities which help to lead a life of fulfillment and self-realization. Horses help us to ""rewild"" our inner nature and reveal emotional traumas and blockages that interfere with choosing ourselves in life. Nature helps us to feel supported, held and a part of a bigger entity. Yoga gives us the tools to connect our body, mind, and soul allowing for a felt sense of strength, courage, and gratitude. Nutrition helps us to fuel our desires. Creativity blossoms our innate skills and is the outpour of our love, gifts, and abundance....read more",https://users.insighttimer.com/DzNtSEOAzJbgDYOvu1bb7v8Q4tU2/pictures/square_medium.jpeg
8387,katiamazzo,k,84,2022-12-11 20:31:09.829887,name found,Katia Mazzo,,4 followers,BR. Português,Joined in Oct 2022,"Katia é Publicitária, Mãe e entusiasta de meditação e bem estar, com formação em meditação Naan 5, Osho Meditation e meditação Guiada. Ela gosta de retribuir ao universo todo amor recebido, distribuindo paz e amor a todos. Seus áudios são para acalmar a mente, o coração e trazer felicidade, convido você a vir comigo nessa jornada da Paz....read more",https://users.insighttimer.com/i2K3xnJKw8d67RL0TZaWkV5Jeoj1/pictures/square_medium.jpeg
8388,kellyalmondlundy,k,84,2022-12-11 20:31:18.796984,name found,Kelly Williams,"Hinckley, UK",4 followers,English,Joined in Nov 2022,"South Africa native Kelly Williams, MBACP Accredited, is a qualified yoga teacher and Counsellor/Psychotherapist, founder of Amukelani Counselling. She has lived in England for the last 22 years and is passionate about her job and helping people to find self-love and peace. Her person-centred approach to therapy and meditation is woven into the workshops and led meditations she offers on topics including fear, self-esteem, depression, body image, relationship issues, anxiety and stress. Although a qualified Yoga Teacher, her passion lies mainly in meditation, breathing techniques and chanting. Through these practices of pranayama, chanting and visualization she gently guides us to the answers within and to a place of surrender and acceptance....read more",https://users.insighttimer.com/MSYBRKBdSrYBxfs0A2Bw3XoSjKP2/pictures/square_medium.jpeg
8389,hustlewithease,k,84,2022-12-11 20:31:37.079998,name found,Kirsty Norton,"Melbourne VIC, Australia",4 followers,English,Joined in Oct 2022,"Kirsty can turn really complicated things into something very simple and easy. She truly believes you should love what you do and do what you love.  Kirsty is the Founder and Creator of Hustle With Ease, empowering the visionaries, change makers and dusruptors who serve from the heart to make the world a better place....read more",https://users.insighttimer.com/N5HxmfFugSaMzZsfLszXajtce0u1/pictures/square_medium.jpeg
8390,katehenn.healing,k,84,2022-12-11 20:31:48.898963,name found,Kate Hennessey,,4 followers,English,Joined in Nov 2022,"Kate is an EFT Tapping Practitioner, Licensed Massage Therapist, and Self-Care Coach helping highly sensitive souls and empaths cultivate calm, compassion, and confidence with tapping and self-care practices.",https://users.insighttimer.com/ZN4bEANBUEXwmPkh248Rv9GQqbv2/pictures/square_medium.jpeg
8391,waterfallkristy,k,84,2022-12-11 20:32:05.786277,name found,Kristy Podruchny,"Portland, OR, USA",4 followers,English,Joined in Dec 2020,"Well all have the right to thrive. My mission as a writer and health coach is to harness my education, passion for health, and curiosity to help others live healthy and fulfilling lives.",https://users.insighttimer.com/IW3MAVP3XvZMqOb31eyzJ7ROrkn2/pictures/square_medium.jpeg
8392,kevinpatrickmartin,k,84,2022-12-11 20:32:20.415271,name found,Kevin Patrick Martin,"Providence, RI, USA",3 followers,English,Joined in Jan 2021,"Kevin is a voice actor with a passion for meditation narration. His calm, deep, rich voice provides soothing comfort to those who listen.",https://users.insighttimer.com/qWiYCZXLf9eDvyIlb8mn1EzDWaC2/pictures/square_medium.jpeg
8393,kaycee,k,84,2022-12-11 20:32:34.242867,name found,Kaycee,,3 followers,English,Joined in Dec 2021,"Kaycee came to yoga as a method of healing her body, spirit, and soul from an eating disorder that took over her life as a young girl. Today she uses her story to connect with others and create awareness of healthy skills that lead her clients to living out a life of purpose.

Kaycee is committed to sharing her journey of healing to guiding people back to their true selves and empower them to live their best lives....read more",https://users.insighttimer.com/9onGt9473gSZdJUKHy78RpnZtEh2/pictures/square_medium.jpeg
8394,suki790926,k,84,2022-12-11 20:32:44.052045,name found,Katie Chong,,3 followers,English,Joined in Sep 2021,"Katie is well trained and certified in Hatha Yoga, Sivananda. She has completed 30-day intensive teacher training course certificate at a Sivananda ashram in the foothills of the Himalayan mountains in October 2009. She taught in New Zealand after she completed her teacher course....read more",https://users.insighttimer.com/Zje6btZMquh1HXRnhCFyMX3vgz62/pictures/square_medium.jpeg
8395,vatrawellness,k,84,2022-12-11 20:33:00.618271,name found,Kristina Jovanovic,,3 followers,English,Joined in Feb 2021,"Kristina is a 500 hour registered yoga instructor and meditation guide. She teaches at various studios in addition to teaching independently. Her passions lie within the realm of environmentalism, animal advocacy, cooking, and bringing a sense of calm to the lives of her peers. She lives her life by ahimsa - doing no harm to others. Kristina's journey of yoga and meditation began whilst studying business in college - amidst chaos, she fell in love with this practice. As a result, she became an energy exchanger at her local studio until later deciding to become an instructor. She took a semester off from college to pursue becoming a yoga instructor. Her goal was, and remains to offer that same safe space that changed her life, to others. Namaste....read more",https://users.insighttimer.com/aUKfHb8hfwQWKc01pKLR59dsWj92/pictures/square_medium.jpeg
8396,coachkrissmith,k,84,2022-12-11 20:33:10.315117,name found,Kris Smth,,3 followers,English,Joined in Jan 2022,"Hello everyone! Kris Smith is a Life Coach and Meditation Instructor. His passion is to help people experience personal breakthroughs and return home within, to discover the answers to happiness and fulfillment!",https://users.insighttimer.com/U8Mqh9IKJAR5dmp5mES9rgVaxYD2/pictures/square_medium.jpeg
8397,kristinknappcoaching,k,84,2022-12-11 20:33:34.341976,name found,Kristin Knapp,"Vancouver, BC, Canada",3 followers,English,Joined in Nov 2021,"Kristin is a life coach and yoga teacher who is very excited to support you on your journey. Her approach is holistic, relatable, honest and fun. You can change your life while having a good time. You have Kristin's promise. If you’re looking for a coach to hold you accountable, keep you honest and throw a little pizazz in there, then she is the right person for you. ...read more",https://users.insighttimer.com/V7d8U5A8C7a2X8y7J4U3A8q5t7N0C4Y0R4E2a8D4D0K4p4D2H8r3v4G9r5R1P7a3Y3n1H0n4V7Y4K8E7e4t6Q5n2H9X1Q8c9S0M6/pictures/square_medium.jpeg
8398,kaye,k,84,2022-12-11 20:33:57.647193,name found,Kaye Manson,,3 followers,,Joined in Apr 2021,"Kaye Manson is a Yoga teacher (I.Y.T.A. N.Z Teachers Diploma) and a Veterinarian (B.V.Sc). She teaches mixed style Yoga classes, mainly Vinyasa, to suit beginners to intermediate level, in South Auckland, New Zealand and on Zoom. She is passionate about Yoga is keen to share its many benefits in improving overall wellness and well-being.
...read more",https://users.insighttimer.com/9MHldxLiKaM0wrLhjmuC7wpKWoH3/pictures/square_medium.jpeg
8399,kyleleeyoung,k,84,2022-12-11 20:34:06.229227,name found,Kyle-Lee Young,"Paddington QLD, Australia",3 followers,English,Joined in Sep 2021,"Kyle started yoga and meditation to manage high levels of stress and anxiety. She believes in the power of specific techniques to calm the nervous system, quiet the mind and open the heart. And, that you can learn simple effective techniques and apply them for greater calm and balance. Yoga for Stress classes are a fusion of asana, mindful movement, pranayama (energy/breathwork),guided meditation and self-awareness practice. Kyle has been teaching hatha yoga for 14 years and is trained in Mindfulness Based Stress Reduction which explores mindfulness through an experiential structured learning program. For Kyle, yoga, meditation, mindfulness are all one. Yoga = union/unite. ""When we start yoga we begin an inner journey, and move towards optimal health and wellness. Ultimately, we move towards union with our Self.""...read more",https://users.insighttimer.com/P6u7n6U8C0U0s3P1x7z5P8B8C4x5N8L8x7C9P9P7v9e9h7k1M6X0a7n7B3J5W8S0X2L3b9w4Y9p7m6G4F7W9h9S7r8U2N4U1h6x7/pictures/square_medium.jpeg
