,teacher_id,alpha_index,batch_id,scrape_date,scrape_status,teacher_name,location,followers,languages,date_joined,about,image_url
3536,danrobertstherapy,d,36,2022-12-11 13:25:14.349051,name found,Dan Roberts,"London, UK",352 followers,English,Joined in Oct 2021,"Dan Roberts is a psychotherapist, writer and teacher. As an Advanced Accredited Schema Therapist, Trainer & Supervisor, he specialises in working with complex trauma. Dan integrates other models in his clinical work, teaching and writing such as internal family systems therapy, cognitive therapy and compassion-focused therapy, enriched by his long-term interest in mindfulness and Buddhism. Dan is Founder of Heal Your Trauma, a project involving guided meditations, workshops and self-help books....read more",https://users.insighttimer.com/N2F7n9u1E8x9L3N4Z6z5k3H5j8d2F2W6T3K1b5V9n7J5f2G3d3G2d4r5x2Y7J6E0v3e7y8r1k5H3e9Y4U1R9Y7K7M6J8A3a9G5G3/pictures/square_medium.jpeg
3537,danipimenta,d,36,2022-12-11 13:25:17.072591,name found,Danielle Pimenta,"Bahia, Brazil",351 followers,BR. Português,Joined in Aug 2020,Apenas uma estudante de Medicina que percebeu que para cuidar do outro é preciso buscar cuidar de si; saber o caminho de volta. ,https://users.insighttimer.com/Q7f8F6v1P7e8M5e8x4H7F1z8C1g7y7X1U8x9y2H9f0A0M6K8v8A4u0T2C7K8N8v1u5n3Z8N4m3m9Y3k1z1N9u1V0x0x3S7L7h6m1/pictures/square_medium.jpeg
3538,danielleinexpansion,d,36,2022-12-11 13:25:36.010370,name found,Danielle Boyd,"North Vancouver, BC, Canada",352 followers,English and Français,Joined in Jul 2019,"Danielle is trained as a physical therapist and her most recent work has been investigating the mind-body connection, the nervous system and their roles in pain, stress and overall health. Her passion is to bridge the gap between science and spirit through education and meditation....read more",https://users.insighttimer.com/x2K2J1R4v3n8x1p5K3F4m3f8n9z8M8v9y8y3C5F1Y8S3Q3N4s1R8S4c0P0C9b1P9S5X9Q4N4B3y7h0X2P8K7k5Y5y7L1F7P2f6Q0/pictures/square_medium.jpeg
3539,daveglynn,d,36,2022-12-11 13:26:00.753352,name found,Dave Glynn,"Arlington Heights, IL, USA",343 followers,,Joined in Apr 2019,"Dave Glynn is a singer/songwriter who has been writing and performing his songs since he was a young lad.  Dave has written several instrumental compositions over the years, and has just recently begun focusing on meditation-worthy songs. Dave meditates every morning to the compositions of other artists on Insight Timer and thought it would be nice to contribute some of his own pieces. ...read more",https://users.insighttimer.com/s8t0y6k2f6m6Z9n2z7P4V3H6B3a1p5c8g9d0a5g9V4J1D1W6x0m5V9C9s1m0D4w9Y3m3A9S6U3M0H9r1U6j0D9d2y0W9P5k7d9D1/pictures/square_medium.jpeg
3540,rachresilienceyoga,d,36,2022-12-11 13:26:03.455001,name found,Dr Rachel Beanland,"Biert, France",341 followers,English and Français,Joined in Jun 2021,"Rachel supports people who are ready to prioritize their health and create a mindful, sustainable life they love. Rachel combines her knowledge of science with the philosophy of yoga to create calming, practices that help you reduce stress, and anxiety and feel more connected to your authentic self. Rachel teaches yoga, meditation and breathwork sessions online and is a life coach for healthcare professionals. Click on the link below for more info....read more",https://users.insighttimer.com/w0z0W0w6R2Q3K7j7s4v8u7X8L1u8p6b9d2a2V3Q3b6z4e1Q1Y0x9K5f9B9U8v6V9T2g1b1T2c0m7J3L2L1f0h9L5p2g3J5a4W6X5/pictures/square_medium.jpeg
3541,davideluchino,d,36,2022-12-11 13:26:06.428649,name found,Davide Luchino,"Metropolitan City of Turin, Italy",340 followers,"Italiano, English, Français and Español",Joined in Sep 2022,"Appassionato di narrazione, insegnamento e spiritualità, mi pongo quotidianamente in ascolto e a servizio.

Passionate about storytelling, teaching and spirituality,  I place myself daily in listening and at service.",https://users.insighttimer.com/Z1M3W1q5R1J6E7D5C7F6A5D0j8K5H1a6g0w4H8v1A7d5f5c7X8S0m8t3E5U4V0a2a1v4v1s0F7w1S5K3J1T7L7N9M6X6z0h7z8C2/pictures/square_medium.jpeg
3542,danneuffer,d,36,2022-12-11 13:26:25.445960,name found,Dan Neuffer,"City of Gold Coast, Australia",339 followers,English,Joined in Dec 2018,"Dan Neuffer is a former scientist who suffered chronic illness for nearly 7 years before recovering thanks to his research and explanation for the root cause and dynamics of Myalgic Encephalomyelitis/Chronic Fatigue Syndrome(ME/CFS),Fibromyalgia and POTS. 

His book CFS Unravelled has attracted attention from the medical/research community and he publishes interviews with people that have recovered from these syndromes in various ways including his recovery program ANS REWIRE.
...read more",https://users.insighttimer.com/M7Z7E7V4j0v3b7a9W8M3F2Y7g6m0B5b2M9P1K5z6Q1S9J1r2a9y3t1w1Y6j2D7V4R0R9j2y2C4d4w7z1Z2c4R5b3m7a2r9z0J0H5/pictures/square_medium.jpeg
3543,dionnenui,d,36,2022-12-11 13:26:50.471973,name found,Dionne Beltrao,"Tres Cantos, Spain",339 followers,Español,Joined in May 2018,"Socia de NUI People, consultora de Mindfulnes y bienestar en el entorno laboral.

Consultora y Experta de Mindfulness e Instructora de Meditación de la Escuela Española de Desarrollo Transpersonal.  Instructora Certificada en el programa de Entrenamiento en el Cultivo de la Compasión (CCT) a través de Compassion Institute.  Formadora y consultora especializada en Desarrollo de personas, equipos y liderazgo. Coach titulada en el Instituto Europeo de Coaching, coach de equipos....read more",https://users.insighttimer.com/e5b8n0k6X5H6w7z2E2s8C2A5f6k9D9t3E8U3Q2U8W6L0x3y9E1m4b8b5T6e9Q3s0f5j4P3b6A1y2K7N3F2J2a7k9T8p1D4U9T3U4/pictures/square_medium.jpeg
3544,drtricia,d,36,2022-12-11 13:27:09.198728,name found,Dr Tricia Wolanin,"Paris, France",337 followers,English,Joined in Feb 2021,"Dr. Tricia Wolanin is a creativity and wellness consultant, clinical psychologist, author, yoga instructor, sound healer, and speaker. She helps others lead more intentional, authentic, and creative lives through developing their daily discipline, mindfulness, and reflection....read more",https://users.insighttimer.com/OqgXtwTBtZZWh4ON3Ofs8xFPJMD3/pictures/square_medium.jpeg
3545,danielnaor,d,36,2022-12-11 13:27:11.858832,name found,Daniel Naor,"Los Angeles, CA, USA",337 followers,English,Joined in May 2019,"Born in Israel and raised in Germany, Daniel became a Kabbalah teacher in 2004 at the Kabbalah Centre in London. Daniel strives to inspire people by showing them their inner greatness, imparting in them a greater desire and urgency to reach their full potential. He has touched the lives of thousands of people worldwide, having managed study groups in Europe and all over the USA. He currently teaches at the Los Angeles Centre where he lives with his wife Esther and their two daughters. ...read more",https://users.insighttimer.com/u8b2u2m6q6F1z2z7g0A1L7w2a7U6E6y7G9y5U4n0h5f5q4C8a6d3b2Y8W5P6L6B6R7A0z3n8a2V4x7J8s1E1N0t0y4g8P6B1A8a9/pictures/square_medium.jpeg
3546,howardjohnson,d,36,2022-12-11 13:27:35.610605,name found,Dr. Howard Johnson,Sheffield,336 followers,English,Joined in Sep 2022,"Dr. Howard Johnson is a Clinical Psychologist and diploma qualified teacher of Mindfulness Meditation, having trained at the Centre for Mindfulness Research and Practice, University of Wales, Bangor. He has helped many people, including himself, who struggle with their emotions to live happy and rewarding lives. His teachings draw on both health science and traditional Buddhist practice, hoping to inspire, to calm and to connect with the fullness and grace of our present moment reality....read more",https://users.insighttimer.com/W2D1m2d1L4b2e6n8c8G1V7H6z9q5g7w3K4B3U4B4y3D8m4y8k6k8A2Y1J2C1M4Z3T6q4B6X5H3V3h7K5H7F4N8G9F9q8X9F2Z5r4/pictures/square_medium.jpeg
3547,lukesniewski,d,36,2022-12-11 13:27:38.190092,name found,Dr Luke Sniewski,"Auckland, New Zealand",332 followers,English,Joined in Jul 2019,"Dr. Luke Sniewski is a Wellbeing Coach & Somatic Therapist. He helps people help themselves by connecting them to the innate wisdom of their body. He is passionate about self-inquiry, meditation, healthy living, and somatic awareness. The quote he lives by is... the mind tells stories, the body speaks the truth....read more",https://users.insighttimer.com/A5w9B3x4p1S7J8K3q0H7T3k7k9s3g9h8H7m5q1F7K4k6f5t0c2B2r9U8e2Z0v1e6Q3n8B4A4Z0d2V8A6v5Q6v5V3W4x6W6q8A3C4/pictures/square_medium.jpeg
3548,drmartinmeinhardt,d,36,2022-12-11 13:27:57.287353,name found,Dr Martin Meinhardt,"Berlin, Germany",328 followers,Deutsch and English,Joined in Jan 2021,"Martin is a psychologist, meditation teacher and holistic therapist from Berlin. He combines Western and Eastern approaches of therapy. A meditative attitude is essential to his work and helps him to meet every being with clarity, openness and love. / Martin ist Psychologe, Meditationslehrer und ganzheitlicher Therapeut aus Berlin. Er verbindet westliche und östliche Ansätze von Therapie. Dabei hilft ihm eine meditative Grundhaltung, jedem Menschen mit Klarheit, Offenheit und Liebe zu begegnen....read more",https://users.insighttimer.com/72gKnm99YsZd0y3NDp2T8AN2NFG3/pictures/square_medium.jpeg
3549,douglasamell,d,36,2022-12-11 13:28:20.063388,name found,Douglas Amell,"Moose Jaw No. 161, Canada",323 followers,,Joined in Oct 2019,"Douglas Amell graduated from the University of Toronto with an Honours Bachelor of Science Degree in Physical Organic Chemistry, with a heavy interest in quantum physics and subsequent studies in various personal growth technologies. In 1998, he graduated from the 4-year post-graduate Naturopathic Doctor program at the Canadian College of Naturopathic Medicine. Upon graduating, he moved to Moose Jaw, Saskatchewan to set up practice, and in 2002 established the Moose Jaw Naturopathic Clinic. He has a profound desire to inspire others to live the best life possible for themselves through sound nutritional and philosophical principles....read more",https://users.insighttimer.com/L9m9r6H3n5X5f2P4Y0S0V5C1p4S2V8b8s0e9M0a0C6H6W6W3k3J0t6L7y4T2J5u1D5g8F8p0N3u0Z1J5k9B3w9t7e8C3m7v1h9g1/pictures/square_medium.jpeg
3550,daniellenuhfer,d,36,2022-12-11 13:28:38.965737,name found,Danielle Nuhfer,"Reading, PA, USA",318 followers,English,Joined in Nov 2018,"Beginning with integrating small practices into my classroom, I am a Mindful Schools Certified instructor and hold graduate certificates in Mindfulness for Educators and Positive Psychology. I support teachers in their quest to reduce stress and burnout while finding and sustaining balance and wellness inside and outside the classroom. Through developing a consistent mindfulness practice, teachers learn about the power of self care, ultimately assisting them in being more present with students....read more",https://users.insighttimer.com/X1n8h1R2A1h7n6n6W4h3P5S2g3c2M9B9p2Y0S8V6f7J9x4r3d2v7e4u9y7q7v5d3J9J9N1r4T4B3S2j1L3h7A2j2p0q3t3J9G7n2/pictures/square_medium.jpeg
3551,deannamoffitt,d,36,2022-12-11 13:28:57.758581,name found,Deanna Moffitt,"Los Angeles, CA, USA",316 followers,English,Joined in Jan 2021,The stories we tell about ourselves create our reality. Deanna helps people dig deep to find the core beliefs that are holding them back and then create a more powerful story about who they are and what they're capable of to change their lives forever. It's a truly transformative experience....read more,https://users.insighttimer.com/veVA9GvSAYU0EZfccEONVNhk8sr2/pictures/square_medium.jpeg
3552,denasamuels,d,36,2022-12-11 13:29:00.335316,name found,Dena Samuels,"Washington D.C., DC, USA",315 followers,English,Joined in Mar 2019,"Author, public speaker, award-winning educator, Dena Samuels, PhD is a mindfulness-based leadership development & cultural inclusion consultant.
Samuels’ latest book, The Mindfulness Effect: an unexpected path to healing, connection, and social justice (Night River Press, 2018) offers 25 mindfulness practices for self-empowerment and cultural inclusion....read more",https://users.insighttimer.com/j4h4h0V7e0M7F3f1c9L6S7r6W6d2W5K4F9K3t2a9v4J4G3q5z2v2n1E4A9A4W8A2L8q9A9k0h5c4Y1a0E0X8r6T2y6s1P5h8y0v4/pictures/square_medium.jpeg
3553,daniellelockwood,d,36,2022-12-11 13:29:25.201788,name found,Dr Danielle Lockwood,"Portland, OR, USA",314 followers,English,Joined in Apr 2020,"Danielle is a naturopathic physician and acupuncturist in Portland, OR. She uses simple meditations and mindfulness as a treatment modality to balance all aspects of health. Meditation is the reason she was able to achieve good health from daily anxiety and panic, and the reason she dedicated her life to helping others achieve optimal health. Whether you desire the health or recovery the first, middle, and last part of that journey requires that you redefine your relationship with stress. ...read more",https://users.insighttimer.com/q4f3z8s3v1N0B5R6M7W6M9X2r9d1M4B8W4B7d7n9m4z0z6s0N1X3f7L4x9n1H4F3B1G8u1p2q7s4S8h4D9C6q8T8q8F8z3v0f4y4/pictures/square_medium.jpeg
3554,danielavianna,d,36,2022-12-11 13:29:27.786195,name found,Daniela Vianna,"San Diego, CA, USA",312 followers,BR. Português,Joined in May 2020,"I'm Daniela Vianna, I once was the community manager here at Insight Timer. I left Insight to pursue my entrepreneurial journey goals that soon became achievements. Now, I use this amazing app to teach how you can also listen to your inner voice, hack your life and face your fears in order to reach your full potential and live the life you've always wanted....read more",https://users.insighttimer.com/Q9F2t8Q9t9P4T4t0n4J8A3E8v7D6n9d1G4f7a6H2j4v0L7J6C6x7E2W9n3T7D0G7F3r5L9f4c3F2G3B1E2N6f8N5J3h5J3h2z8C3/pictures/square_medium.jpeg
3555,mindiekniss,d,36,2022-12-11 13:29:46.488884,name found,Dr Mindie Kniss,"Arizona, USA",311 followers,English,Joined in Jun 2020,"Mindie Kniss is a Coach and CEO of Lucra®. She is the author of the bestselling book, The Heart of Consciousness. Her podcast, The Lucra Life™ can be found on your favorite podcast provider. Mindie holds degrees in theology, writing, and philosophy....read more",https://users.insighttimer.com/g2N2w4W4Q0W3s9V5s5W2E1K0c4J1S8j7j1E8x5C0E1b3M3b1p2k8N0Y5t9w2Z0t6z0N9K4E0x7j3n0e4e5a5m2L3Q9E8E8r9z7a5/pictures/square_medium.jpeg
3556,dantrumanmusic,d,36,2022-12-11 13:29:49.301773,name found,Dan Truman,"Providence, UT, USA",304 followers,,Joined in May 2021,"Dan is a Grammy award-winning composer whose music is in hundreds of TV shows. His ability to create unique moods of emotional and healing music is inherent. Dan's mother, Karol Truman, wrote the groundbreaking book ""Feelings Buried Alive Never Die"" and Emotional Healing is also interwoven into his music. 
Dan also composes his own brand of smooth jazz which incorporates chill beats & modern grooves. Dan’s band, Diamond Rio has sold over 10 Million albums, and has over 200 million streams....read more",https://users.insighttimer.com/zS7SAnKSomNey7a43uf8wEzW49w1/pictures/square_medium.jpeg
3557,dustinjackson,d,36,2022-12-11 13:30:14.242780,name found,Dustin Jackson,"Virden, Canada",303 followers,English,Joined in Sep 2016,"Dustin is a Rescue Tech, Firefighter and also ecommerce entrepreneur.",https://users.insighttimer.com/w3G3L1a1z5y0u9b5F4x2N6y3m7p1U3Z0P1G5u1r3r6u5g5N7K0b8d4D8M0E0c7W7M3Z7G0X2G9p2f4z8k1u4q0S8u0y7G2E8z2F1/pictures/square_medium.jpeg
3558,danyariver,d,36,2022-12-11 13:30:17.061891,name found,Danya River,"Boulder, CO, USA",303 followers,,Joined in May 2020,"Danya River is an Anxiety & Life Fulfillment Coach and a recording artist.  She practices Somatic Experiencing, a body-based nervous system regulation/trauma-resilience method, along with Life Coaching to help people move far beyond just ""feeling better"" into creating a deeply rewarding life of love, confidence, depth, connection, purpose, and contribution. ...read more",https://users.insighttimer.com/e8w6D4G1G3j1K5Z7m4S6G0u7D5X4M0K1y6A5w3e1T1z6L7M9d5T3N3L3c2E4A6J8k7d5G7u7m2Z3z1a0p4X2W4w9Z9J1c4Q5M1z5/pictures/square_medium.jpeg
3559,yogadaphne,d,36,2022-12-11 13:30:19.631781,name found,Daphne Chua,Singapore,299 followers,English,Joined in Apr 2019,"Daphne is a certified yoga therapist, bodyworker and movement educator. She uses an inquiry-based, body-sensing approach to bring about transformation and healing into the ways we relate to ourselves, others, and our environment. Daphne infuses the alchemy of her integrated bodywork and evidence-based yoga therapy to promote self healing and lead an embodied life. 

Follow Daphne on her website or attend her one of her somatics and bodywork trainings. 

...read more",https://users.insighttimer.com/f6e8s1U5Q8U3X8c3S6R3g0h3k8e1c8u0s6G7w8U0q2C4w8B6u9Y3c5s8Z7M7d2z6d4Y4N6U6n6Y0W4t4w1k5L0K6w0j1n1u5t2g3/pictures/square_medium.jpeg
3560,snackcakes,d,36,2022-12-11 13:30:22.289203,name found,Debbie West,"Toronto, ON, Canada",297 followers,English and Español,Joined in Aug 2021,"Debbies yoga evolved over the years, from an enjoyable exercise to a sacred daily practice.  Through various health challenges, yoga became a medicine to find balance.  Yoga teacher trainings, months living & volunteering in ashrams, teaching in different countries - Debbie is humbled to now share this science with others. Classes lean towards traditional practices with pranayama & moments of stillness.  Debbie does her best to make students feel welcome & to make the practice assessable for all....read more",https://users.insighttimer.com/J9u8v3e1B2X0X7w8J7B7b0f3z8g6w6E0W9t5f6Z7D5n2y2J9W1S2V3d9s7W4D1X4W6m8L3R7Q7d8V2q1P4X5q8Y5Q4v4q0x1N1z5/pictures/square_medium.jpeg
3561,magiainterior,d,36,2022-12-11 13:30:47.180860,name found,Denisse Zamora,San Diego California,291 followers,English and Español,Joined in Dec 2021,"Denisse desarrolla programas de meditación personalizados, enseña cursos de Ayurveda, técnicas naturales de sanación, y realiza limpiezas energéticas en persona y en línea, promoviendo el bienestar físico, mental y espiritual en sesiones privadas o en grupo.
Es Instructora en Meditación con Sonido Primordial y en Salud Perfecta: Estilo de Vida Ayurvédico. También es Reiki Master y cuenta con una certificación en Pranic Healing (Institute for Inner Studies Inc)...read more",https://users.insighttimer.com/D9y6u4z2h2q4j7z9n8Y8w3z1q5F2g2w8j9J5H6F2B3f1e7J6x6q1g6e6e5h6W9H8A1M1B6u0Q2C0z3A1d0f5L2E8V8q3s0s3y1n3/pictures/square_medium.jpeg
3562,dosehaus,d,36,2022-12-11 13:31:06.048159,name found,D.O.S.E. Haus,"Barcelona, Spain",290 followers,English and Español,Joined in Sep 2021,"D.O.S.E. Haus offers a modern approach to a holistic lifestyle designed to awaken the full potential in yourself. An immersive sensory experience that shifts your state with music and guided breathing exercises. 

At D.O.S.E. Haus you will find a collection of wellness-oriented guided sessions to help you decrease anxiety, improve focus, and upgrade your health with simple, science-based breathing exercises. ﻿A transformational reset within minutes....read more",https://users.insighttimer.com/X7w2T1Z7R4p5p4w7Y0p7A9U0k2b2X2R8u2v9H7f1T4q5D7F0F8s4q1u2q2E6x9G0E2h2v5w5J7T9G4j5b1r1k2P9U4y5s6m5K6j7/pictures/square_medium.jpeg
3563,danipaes,d,36,2022-12-11 13:31:24.961277,name found,Dani Paes,"Curitiba, State of Paraná, Brazil",288 followers,BR. Português,Joined in Feb 2019,"Pranayama, Mindfulness & Meditação.",https://users.insighttimer.com/X8D7s6S1D6r4T7f0L6P7k2p2F4q4K8C6t6j6k7y9K0K9F3w5R5s0R4W8Z9t1F2t7Y8Y6c0N9P8Q3v7b9T5h6f8E1V3M3e4B2e1v4/pictures/square_medium.jpeg
3564,deepspacedrones,d,36,2022-12-11 13:31:27.481493,name found,Deep Space Drones,,287 followers,English,Joined in Jun 2020,"Deep Space Drones is a composer working at the border between technology and tradition. The music they produce is designed for a variety of purposes and moods, and they take inspiration wherever they find it. Deep Space Drones is based in Canada....read more",https://users.insighttimer.com/K4Q3B0h2y6C5r2R5p0d1b2d3J0n2e2m7r7R4H0P1x1a3Y8D5M9x6S7T1X3K1j8v4r0G2y4Q8S6r8H8h5g1S8k4M1a3z0R0w9S0t6/pictures/square_medium.jpeg
3565,lensesthatliberate,d,36,2022-12-11 13:31:52.215375,name found,Derek Sheahan | Lenses That Liberate,"Boulder, CO, USA",287 followers,English,Joined in Apr 2019,"Derek Sheahan is a facilitator of transformation with over 20 years of experience exploring with those who truly want to wake up and embody the fullness of their life. Arising from my many years of meditation practice, inner spiritual work and psychological study, he developed the ""Lenses that Liberate"" model to serve as an integrative system for embodied awakening and profound healing. Check out his website (link below) for information on individual sessions, my 3 month program and group events....read more",https://users.insighttimer.com/z4f2k7w2R6A1J7Q4K5J4g5G7Q0c5f0Z7j6h5y8L5k4n9K0L2y1J8v6b1j9s7m2Y6J4Q9F9Q5C3N6W4h3P1n4Y8t9X7e9A6Y8c4H4/pictures/square_medium.jpeg
3566,dustindiperna,d,36,2022-12-11 13:31:54.920701,name found,Dustin DiPerna,"Occidental, CA, USA",285 followers,English,Joined in Oct 2018,"Dustin DiPerna is a visionary leader, entrepreneur, and recognized expert in world religions. He is author of the books Streams of Wisdom, Evolution's Ally, and Earth is Eden. 

Dustin holds an undergraduate degree from Cornell University and a graduate degree in Religion from Harvard University.

Dustin practices in the lineages of Mahamudra and Dzogchen with Daniel P. Brown. He teaches courses on human flourishing and meditation at Stanford University.
...read more",https://users.insighttimer.com/D3c9S8A3Z1w8T3u9Y3L7d9x8q4h2K4v7U0k7a6T7C1L9a3k1y7Y8b1G2e6S0R0G4z0D1c5M0A0a3u2V8j6K9F2Q3G4Z5q4u0Q2N1/pictures/square_medium.jpeg
3567,rheakomarek,d,36,2022-12-11 13:31:57.548057,name found,Dr Rhea Zimmerman Komarek,"Napa, California, USA",285 followers,English,Joined in Dec 2018,"Dr. Rhea Zimmerman Komarek is a chiropractor and producer focused on individualized healing and wholeness for those she touches. Her mission of igniting people to their vitality, gifts, purpose, and passion is the driving force behind the practice she shares with her husband, Blossom Precision Chiropractic, her mind/body retraining CD, “Breathe Love,” and feature documentary , “Love Bomb.” She is happy to be sharing meditation audios on Insight to benefit those seeking ease....read more",https://users.insighttimer.com/W2w5q3C2k4y1L7H3P5n2H6R7d8t7q1A1Y7P0N0e6t4z5T5A1u5C3K5f0f3Z7x4G0r9F7d3E6Q3v5S1v4r5b1g9f9U9y6F0Y4k9p5/pictures/square_medium.jpeg
3568,viryakirti,d,36,2022-12-11 13:32:00.070210,name found,Dharmachari Viryakirti,"Mexico City, CDMX, Mexico",283 followers,Español,Joined in Jun 2021,"Practicante por más de 14 años, soy Mexicano y Miembro de la Orden Budista Triratna, dirigo Meditaciones y Cursos de Budismo en español en el Centro Budista de la Cd. de México y algo que me gusta es compartir los beneficios de la practica de la meditación y del Budismo.
Espero encuentres en estas grabaciones el apoyo para que tu practica se fortalezca y encuentres calma y tranquilidad en tu vida....read more",https://users.insighttimer.com/H0R6F9D3p2p1y0G1t8f9G3v5M0M9V8m8T2S4q7G0Z1B5L1V5h0U8E4h0s6L9Q3D4h2p3x1G6L5v6s6x3t6G5X9Z6k1u6q8X0c4L7/pictures/square_medium.jpeg
3569,danton,d,36,2022-12-11 13:32:24.903286,name found,Danton Freitas,"Belo Horizonte, State of Minas Gerais, Brazil",282 followers,,Joined in Oct 2018,Creating calm and peace.,https://users.insighttimer.com/R0H8h4H8M2P3f3Q7X7p3t7R3b0a6r2H0j7A2n0H5H0Q7S8A8c0e7D2u0C7W8U4U3c3B9e6p7R3A1f6z9D6z9Q5G9J9A1w8U7Z7H9/pictures/square_medium.jpeg
3570,dantecoluccio,d,36,2022-12-11 13:32:27.730611,name found,Dante Coluccio,"Evesham Township, NJ, USA",272 followers,,Joined in Jun 2019,"Dante has been a musician, composer, producer and teacher for over 35 years. His beautiful music feels like prayer in itself. As a backdrop to your meditation Dante's music will soothe your soul, comfort your heart, calm your mind and deepen your spirit.  After years as a touring musician Dante sensed a call to teach in a prison for 18-30 year old men. He has seen the power of music change lives. Now he is using his gifts, making the world a better place, through meditation music....read more",https://users.insighttimer.com/b7C1Z1e0J8r2r4G0W6X8R3D4z9E7P2G1S2z1F0d5w3U4M8u7z4L4H9T3v8j5P3V7d6S6S3X1e2D6d1p7x3C9f9M7m8P7n9d0c0d7/pictures/square_medium.jpeg
3571,davidmercado,d,36,2022-12-11 13:32:46.844130,name found,David Mercado,"London, UK",263 followers,English and Español,Joined in May 2021,"Hi! I am Business/Life Coach, NLP Practitioner and Counsellor. My experience includes dealing and supporting with change and reinvention. Life is in constant change so embracing life is embracing change. My approach is a combination of Counselling, Neuro-Linguistic Programming and Coaching focused on finding an emotional centre by living in the present....read more",https://users.insighttimer.com/aScA37bedsRV35ZXlPNyERlEaMi2/pictures/square_medium.jpeg
3572,doragil,d,36,2022-12-11 13:33:05.641984,name found,Dora Gil,"Estepona, Spain",261 followers,Español,Joined in May 2019,"Acompaño a cualquier ser humano en la aventura de conectar e intimar con su propia vida, comprendiéndola en profundidad y descubriendo su radiante potencial. Ofrezco la experiencia y el entrenamiento en una nueva perspectiva, la del AHORA, en la que podemos descansar y sentirnos profundamente nutridos por la vida. Estudié Psicología y Bellas Artes. Recorrí escuelas de autoconocimiento y me he formado en Terapia Transpersonal, Meditación Zen, Yoga, Mindfulness y en Advaita Vedanta....read more",https://users.insighttimer.com/U0G5C3D4V0t4v9G2E5s3N1x4s9J7G6x4J9U2X1T3U7H2u2P0g4e6M5C6v5f2N5u4k4c4g8U2M1u1P8a9h0x6N0C8L6U7m0J1Q0W6/pictures/square_medium.jpeg
