,teacher_id,alpha_index,batch_id,scrape_date,scrape_status,teacher_name,location,followers,languages,date_joined,about,image_url
2772,cataldana,c,28,2022-12-11 09:45:21.782672,name found,Cat Aldana,,69 followers,English,Joined in Sep 2018,"Over the last 7 plus years, Cat has helped individuals and companies across the globe be more focused and have more energy. She fosters a spirit of levity in her teachings that allow clients to trust their intuition and create positive change....read more",https://users.insighttimer.com/w6H9s4A4L7e9F8z0V4Q5P1t8w2A5d0g5T8z2Q4a7H0h8z5G3f1N7b6r5p1b9P3T8K4T0H0n1W7a8f3z6k3P0u1C6f0v3S2p9e1n6/pictures/square_medium.jpeg
2773,christofmelchizedek,c,28,2022-12-11 09:45:40.514167,name found,Christof Melchizedek,,69 followers,English,Joined in Sep 2021,"Christof has spent 25 years working with fortune 500 executives, pro-athletes, entrepreneurs, and experts in health, performance, the healing arts, psychology, and leadership. Coined a spiritual futurist, Christof has a real gift in translating ancient spiritual teachings in new and practical ways for the western mind to comprehend and apply.

His teachings combine a beautiful blend of arts and science. He’s spent his entire life studying formally with degrees in psychology, physical education, and energy medicine with Brennan Healing Science, and informally learning from some of the brightest minds in shamanism with lineages of Africa and the Amazon.

Christof and his team have facilitated hundreds of epic experiences online and live experiences, gathering like-minds on top of sacred mountains, secluded tropical islands, jungles and ancient pyramids. He offers guided plant-medicine initiations that are like “10 years of therapy in 15 days.”...read more",https://users.insighttimer.com/bKtgAtugdtVIcFM74ju7rvj9Je93/pictures/square_medium.jpeg
2774,chels,c,28,2022-12-11 09:45:59.416275,name found,Chelsie Moak,Sacramento,69 followers,English,Joined in Mar 2019,Classroom teacher and yoga teacher looking to spread wellbeing practices through meditation and yoga. ,https://users.insighttimer.com/V9D1t9b8V1P4z3b8c1R4U4d3Q1u1p6c8S0L2T5n0W8W9q4J2r7Q8e0K7p2U0E8y6H7u6b7C4f6a4A9X4Z1g5X1S4q1b3N6L6A9j3/pictures/square_medium.jpeg
2775,mindfuldetroit,c,28,2022-12-11 09:46:18.152730,name found,Caitlin Brown,"Detroit, MI, USA",69 followers,English,Joined in Jan 2022,"Caitlin Brown (she/her/hers) is a yoga and meditation teacher (E-RYT 500), yoga therapist in training, professor, business owner, and social worker (LMSW). She began her journey with yoga and meditation due to her own struggles with anxiety. As a social worker, she is passionate about sharing yoga and meditation for self-care and burnout prevention, which is unfortunately all too common in helping professions....read more",https://users.insighttimer.com/f9t3G3E0x5k3Z7v0W1h3V7C8F7S4N6D5S6N1h6j1q7D5d6U1P8w0L1p3Y2F3Q5z7L2w7M0S5P5z0E7R0x0R6z1s2N8g1y9g9t8D1/pictures/square_medium.jpeg
2776,catherinejackson,c,28,2022-12-11 09:46:37.285581,name found,Catherine Jackson,,69 followers,English,Joined in Feb 2022,"Catherine Jackson is Hypnotherapist, Meditation & Yoga Instructor. Having spent many years as a Trainer & Coach in Personal Development, Catherine combines her personal goal of finding freedom through self reflection and increased awareness with serving others to help them discover space in the mind and the body.  
Catherine is responsible for creating 1000's of meditations that appear on Apps across the planet, working with and contributing to many of the well-known brands in this domain....read more",https://users.insighttimer.com/x7A9d5H7T8G8Y6G0W6d0N1U8h1t8C0g2q2G6d4n9q1e0A0y7D5A8Q8C9N2Q6h0Y4F9f3n4p7b3P1z4N4W2J2M9r2v5a0R7m1V9Z8/pictures/square_medium.jpeg
2777,cherylwilfong,c,28,2022-12-11 09:47:04.133163,name found,Cheryl Wilfong,"Vermont, USA",68 followers,English,Joined in Apr 2019,"Cheryl Wilfong teaches at Vermont Insight Meditation Center, which she co-founded. She is the author of The Meditative Gardener: Cultivating Mindfulness of Body, Feelings, and Mind, winner of 8 book awards. She also writes a blog, winner of a Blogisattva Award. Cheryl has been teaching mindfulness for 25 years. ...read more",https://users.insighttimer.com/v1W9n8L6X6e0G5W8L7C4e5A3T3v4n7t2q5F9f4s4n6T1w9u4g0a8J9A7q8y3D9G9v8j0z0H6E8E8b5B7z1g6e9c7a2q7k0Z0s2F4/pictures/square_medium.jpeg
2778,carola.akasha,c,28,2022-12-11 09:47:06.765145,name found,Carola Akasha,"New York, NY, USA",68 followers,Español,Joined in Nov 2020,"Carola is a Tibetan Buddhist Meditation Instructor. She has been studying spirituality, receiving teachings, transmissions and blessings from shamans, holistic teachers and buddhist lamas since 2004. She is also an Akashic Records Consultant, Meditation & Yoga Instructor, Clairvoyant and Human Development Coach. 

Carola has been facilitating spiritual teachings in different countries like Mexico, Colombia, USA, Spain, UK and Scotland....read more",https://users.insighttimer.com/WykZq6mzrMdna3bX1vPmTmSsAP42/pictures/square_medium.jpeg
2779,pub6474568,c,28,2022-12-11 09:47:25.535703,name found,Christiane Eitle,"Betong, Thailand",68 followers,English and Deutsch,Joined in May 2020,"Learn to calm your mind and go on an inner journey with my mindfulness meditation. I am sharing from my own experience to show you, that there is nothing wrong with your mind.

You will drop into presence by focusing on your senses and relaxing the body. Gradually my soothing voice will guide you deeper into your essence by observing and softening the breath. Any thoughts or emotions will be welcomed and released without judgment. You will learn to accept the state of your body and mind....read more",https://users.insighttimer.com/C5W6j9h5P9j1T5Z9A1W1x3z9k5V0B2w9j6g8b0F3U1Z7c4N6P5W4C0U5p3E1T9V7U8N1H6f9f3U4q1y6t0M5r7F8U6L2w0E9Q7U0/pictures/square_medium.jpeg
2780,claudialackner,c,28,2022-12-11 09:47:28.134074,name found,Claudia Lackner,"Kreuzlingen, Switzerland",68 followers,Deutsch,Joined in Apr 2020,"Hallo, ich bin Claudia. Ich möchte Menschen die Freude ins Leben bringen und ihnen zeigen wie sie aus eigener Kraft etwas bewirken können, damit wir gemeinsam wachsen und die Leichtigkeit und Lebensfreude teilen. Als Yogalehrerin und Ayurvedic Lifestyle Coach verbinde ich verschiedene Methoden und Techniken aus dem Vinyasa, Hatha und Anusara Yoga mit dem Ayurveda, welcher als traditionell indische Heilkunst und Erfahrungswissenschaft des Lebens ganzheitlich die Gesundheit fördert....read more",https://users.insighttimer.com/D0Y7B3u1T9j8N1d2J1W5u3x4Q3B2W6A0j0S2v6e7z2s5k6K6V1V1w9T8k9E2q2q5y3U3M3f2h4C7S2w7j0Y0g6m8Z3N7c9B8j5L7/pictures/square_medium.jpeg
2781,caterinatestime,c,28,2022-12-11 09:47:52.901444,name found,Caterina Colomer Osca,"Valencia, Spain",67 followers,Español and English,Joined in Jul 2022,"Caterina es profesora de yoga desde 2016, además es terapeuta Reiki y practicante de Barras Access Consciousness. Imparte clases grupales e individuales de manera presencial en una casita en el campo y online.

Descubrió el yoga en 2013 en Estados Unidos y desde entonces sigue aprendiendo y practicando con diferentes profesores de todo el mundo. 

El yoga le ha ayudado a amarse tal como es y por eso lo comparte con tanta pasión con sus alumnas y alumnos, le encanta recordarles día a día que son merecedoras de ser amadas y que confien en su poder interior....read more",https://users.insighttimer.com/y5j5v7V3X4Y7X9t6f5a2a6Q4d8f8q6f4L6e6h6e3e7Y3x0s9V2X8W3B3e8c0W6z8g4M3h9j1T9F7M6w6j6T8j8C4h9p7Y9D0E7V0/pictures/square_medium.jpeg
2782,mayarihealme,c,28,2022-12-11 09:47:55.524997,name found,Christina Bitanga,,67 followers,English,Joined in Dec 2021,"Christina is a Reiki master  and Transformation Life Coach,   known for her compassionate soothing and supportive style of guiding others.  With a background in positive psychology, kundalini yoga and aromatherapy ,  she brings health and healing in her online coaching  programs, courses and wellness sessions....read more",https://users.insighttimer.com/CWnFXquG2ecxG6wN6tyHwq8YsY33/pictures/square_medium.jpeg
2783,cassandramichael,c,28,2022-12-11 09:48:14.291899,name found,Cassandra Michael,"Amsterdam, Netherlands",65 followers,English,Joined in Feb 2019,"I am a Positive PsychoIogy and Mindset Coach (MSc). My mission is to help you move from fear to authenticity using love as your guiding force. I have a Masters in Applied Positive Psychology and Coaching Psychology from the University of East London and a Diploma in Coaching from Kingstown College Dublin. I have developed my own meditation program and through academic research proved the positive effects it has on fear of the unkown, authenticity and hope. ...read more",https://users.insighttimer.com/V9s2r6H0h0k2w1E0G2f8U1B6c6K5s2J4Z5S5J3T9G8m4q7K0D6d1Q0w5L4p9v7q5Z6g6E1y8M0p0U0G7g1G7Y7j6C8s9K1r3f0c9/pictures/square_medium.jpeg
2784,carlijn_vrouwencoach,c,28,2022-12-11 09:48:32.961635,name found,Carlijn,"Arnhem, Netherlands",65 followers,Nederlands,Joined in Jun 2021,"Carlijn brengt haar achtergrond als verloskundige samen met haptonomie en mindfulness om vrouwen te coachen naar een krachtige geboorte-ervaring en in het nieuwe avontuur dat moederschap heet. Vetrouwen, je eigen lijf leren kennen en een positieve mindset zijn belangrijke waarden waar Carlijn zich op focust tijdens de (individuele) cursussen die ze geeft, zodat (bijna) moeders vol vertrouwen en dicht bij zichzelf hun kindje kunnen verwelkomen.
...read more",https://users.insighttimer.com/m4ilrPzsd9YvBGRIs6vBuyXYfbl1/pictures/square_medium.jpeg
2785,moonforestflow,c,28,2022-12-11 09:48:51.845906,name found,Carly Chandler-Morris,"Milton Keynes, United Kingdom",64 followers,English,Joined in Dec 2020,"Carly, founder of Moon Forest Flow, is a mama, yoga teacher, writer, circle facilitator, menstrual mentor and rewilding advocate. She lives for all things wild & cyclical.
​
As a certified Hatha, meditation, Well Woman Yoga Therapy, Restorative, Pregnancy & Yoga Nidra teacher, She offers wild and cyclical practices and circles for women of all ages, life stages and cycle phases....read more",https://users.insighttimer.com/t5u6x4L7L7k9S4t1S1r7M6n3p2r9x3F0R1T3s6K2g2x6f3T7d8A9c0j1m3c5A3N3f2F0C6W8c1Y2j9S1v5j9Q7R5k5q7n8u5m4E9/pictures/square_medium.jpeg
2786,charlottegibson,c,28,2022-12-11 09:49:18.723502,name found,Charlotte Wilson,"Los Angeles, CA, USA",64 followers,English,Joined in Apr 2019,"Charlotte is a certified meditation teacher, mindfulness coach, and wellness author.

With her experience and passion for mindfulness for all ages, Charlotte specializes in making meditation and mindfulness practices accessible and engaging for people at every stage of life.

After the Covid closure of her studio- The Happinest NYC in Brooklyn, Charlotte is passionate about continuing the spread of the life-changing effects that mindfulness and meditation can provide, online....read more",https://users.insighttimer.com/F1H4y7P5F7c9U0b0u8f7f3d8T3d1j6N9g2u9B2v3W4a1z6y6b3m1N7Z9S0n1n4j8E5H3V1u3g0F6b8r4X8E6T3F3T6E3R2D2g4c0/pictures/square_medium.jpeg
2787,chelseaaks,c,28,2022-12-11 09:49:38.054899,name found,Chelsea Aks,"Palm Beach Gardens, FL, USA",64 followers,English,Joined in Mar 2021,"Chelsea is a certified life coach through.Chelsea has a Master’s degree from Florida State University. She has an undergraduate degree in psychology from which she graduated Summa Cum Laude. Through her work with 12-step recovery programs she also has extensive training in Inner Child & Family of Origin trauma healing, as well as conquering codependency. Chelsea also studied with Mama Gena’s School of Womanly Arts. Her mission is to share my love and light, and to hold a mirror for others, so that they can better see their own beauty and infinite internal wisdom....read more",https://users.insighttimer.com/E8P0K4H9v1q2f6K8u6D7X5V3N3j6a0m2M7Q9R5N0j3P2t6k7p5c1P5H1B1p7Q4W4k4b3X1e0x9a3H1C0P8w3J0C8S2B5q3T3Q9E7/pictures/square_medium.jpeg
2788,chantalomiller,c,28,2022-12-11 09:49:56.837369,name found,Chantal Miller,,64 followers,English,Joined in Oct 2021,"Chantal Miller is a storyteller, creative healing practitioner, wellness advocate and community builder with a deep passion for slow and soft living. 
She is the founder of Island Girls Rock and also co-hosts The *(Relate)able Podcast - a safe space for open and honest conversations created unapologetically for Black people....read more",https://users.insighttimer.com/vVciBaXYRFho2kUsw9LPZsA7rbh2/pictures/square_medium.jpeg
2789,chris.veterinaria,c,28,2022-12-11 09:50:15.788589,name found,Christiane Isliker,"São José dos Campos, Sao Jose dos Campos - State of São Paulo, Brazil",64 followers,BR. Português,Joined in Oct 2019,"Sou Médica Veterinária, ultrassonografista, e apaixonada em desenvolvimento de pessoas. Acredito que podemos ser um versão melhorada a cada dia e espero poder ajudar você a encontrar sua essência através da meditação.
",https://users.insighttimer.com/p2d2x3w0g6Q3t4q5N2F8Y1F5r3u9z1N6L2K7W8f8B8v2X7H9t8U9M1J9B9Q0r4S7h7r8b0B4Q3q3m1Y8w7n7P6W7S7f8k0c7y4L5/pictures/square_medium.jpeg
2790,catherinedubois,c,28,2022-12-11 09:50:40.656999,name found,Catherine Dubois,,64 followers,Français and English,Joined in Oct 2021,"Catherine Dubois est infirmière et enseigne les soins infirmiers au niveau collégial. Elle pratique la méditation depuis plusieurs années. Ses approches de méditation sont: la visualisation, la méditation de compassion et la pleine conscience.  Elle a terminé la formation d'enseignante de méditation en pleine conscience à l'université Brown. Elle offre des méditations pour les enfants et les adultes....read more",https://users.insighttimer.com/eg7DncgI44fuS3H4h2tylp41Q7x1/pictures/square_medium.jpeg
2791,cristianamatos,c,28,2022-12-11 09:50:59.679248,name found,Cristiana Matos,"Dubai, United Arab Emirates",64 followers,English,Joined in May 2020,"Cristiana is a 200HR RYT (Ashtanga Vinyasa Based).

After almost four years above the clouds, working as a cabin crew, she took the decision to leave and invest on her dreams. She wants to help others find the same benefits she found in yoga practice -to find their balance, guide them on a journey, share her passions and knowledge....read more",https://users.insighttimer.com/b8K9M4T8t1n5B1B4n7J5M4r5p4S3V7t8D3z8a4u6R7H0P7w5y7e9M6z6L1w9z9L1h6C8b0F0C4G2u8Y0b8e4f5k3T9b5B9M9k1p6/pictures/square_medium.jpeg
2792,cristinadossantos,c,28,2022-12-11 09:51:18.637103,name found,Cristina Dos Santos,"Austin, TX, USA",63 followers,English,Joined in Sep 2020,"Ayurveda was introduced to Cristina dos Santos at a young age, though it wasn't until her early twenties that she began hearing the call to help others heal through Ayurveda and Yoga. It quickly became very clear that this is her Dharma. Cristina's experience with her own healing journey led her to pursue helping survivors of trauma. 
Cristina has completed over 750 hours of yoga certification, and specializes in yoga Nidra, guided meditation, and Ayurvedic Yoga Therapy. ...read more",https://users.insighttimer.com/a8c7N0D8Q3m2h6h2n8D3N8e2q2B4B3p1M1r2T0V3A0p0y2R8K8Y1J2k8g6M3d4G3W9U3T4S5J9r0P3L8p1m2p0B4S5F1A5U7V6N2/pictures/square_medium.jpeg
2793,adamcobb,c,28,2022-12-11 09:51:37.411468,name found,Coach Adam Cobb,"Brooklyn, NY, USA",63 followers,English,Joined in Aug 2020,"Meet Coach Adam Cobb. Head health lifter, founder of FYCNYC, certified Nutritional consultant, sports performance coach, speaker, foodie, a fan of G.O.O.D. music, first love God, second love SCUBA",https://users.insighttimer.com/Z1n4y9D8g6k7W5T9E0z5B0P0C1c9x4X9S9H4Y0r2R5T6k3P6M5B4g6m0D7P2a5W6K0F2F6S4v7V8u3Q2d5L4M1c8a8a1b5C5k6W1/pictures/square_medium.jpeg
2794,lovejoy,c,28,2022-12-11 09:52:02.120954,name found,Carolyn Rubin,"Boston, MA, USA",62 followers,English,Joined in Jan 2021,"Carolyn's passion and longing is to hold a space for those who desire to go inward.  A daily meditation practitioner, yoga teacher, and voiceover artist, Carolyn finds great significance and inspiration in the heartfelt and triumphant journeys of fellow human beings.   ""We are all summoned daily to come home to our spiritual selves.   To support another's journey home is an awe-inspiring gift of connection, service and belonging.""...read more",https://users.insighttimer.com/27PCAWwbfXc0YEgiGBTkAWtkbmU2/pictures/square_medium.jpeg
2795,catherinetheyogi,c,28,2022-12-11 09:52:05.493688,name found,Catherine Njeri,"Nairobi County, Kenya",62 followers,English,Joined in Aug 2021,"Catherine Njeri is a yoga teacher from Nairobi, Kenya.  She has been teaching and practicing yoga and mindful practice since 2009 and is passionate about creating world-class wellbeing leaders in Africa using the transformational practice of Yoga. Catherine is the first Kenyan woman to lead a 200-hour yoga teacher training in Africa. When she isn't leading meditation, yoga sessions, or leading training, Catherine is a proud mum to a baby girl. She also enjoys braiding her daughter’s and friends' hair....read more",https://users.insighttimer.com/kXcxWt4HXwSSXFfwHGYjOhiOQzj2/pictures/square_medium.jpeg
2796,carolabecker,c,28,2022-12-11 09:52:25.087097,name found,Carola Becker,"Exeter, UK",63 followers,English,Joined in Sep 2022,"Carola is a Nutritionist, Fitness Instructor and Wellbeing Speaker with a passion for mental health and brain performance. She has founded 'The Nutrition Coach' where she helps people make game-shifting changes to their mental and physical health: more energy, drive, resilience and cognitive performance. 

Carola designs programmes for corporate teams and individuals about specific topics, and runs worldwide award-winning wellbeing retreats in beautiful locations. As a nutrition coach helps her clients to live a healthier life for good, feel better within their body, are less stressed, more productive and focused. 

She is an international speaker and regularly delivers inspirational and engaging sessions on Nutrition and Lifestyle. 
Carola lives in Great Britain and works with people all over the world....read more",https://users.insighttimer.com/b8F6L6J6g9E5y8X2w1H7g3J3b7z6t5c2G2X5t5Y1A2q5G4x8J1v0m6S4v0Z1M3n6K9X4V7q9h4n2u8T8r2B0r9s2r4A3j2n0E3s0/pictures/square_medium.jpeg
2797,mogli,c,28,2022-12-11 09:52:43.961685,name found,Claudia Wiens,"Seville, Spain",62 followers,Deutsch,Joined in Dec 2018,"Claudia Wiens ist eine Yoga- und Meditationslehrerin, die seit über zehn Jahren international unterrichtet. Sie gibt Klangmassagen und Gongbäder und kombiniert oft Klang mit Yoga und Meditation. Für Claudia sind Meditation und Yoga ein Lebensstil und die Möglichkeit, ein ausgeglichenes, zufriedenes und gesundes Leben zu führen. Seit 1995 arbeitet sie auch als Fotografin für internationale Publikationen, NGOs und Unternehmen. Frauen- und Umweltthemen liegen ihr sehr am Herzen....read more",https://users.insighttimer.com/H5n4L3T3F8x0F2x4K3p1S6u4T6Q0P8Q9W3k3D2r5u4g7C3K8J0J6Y1Z9p8b2L7Z2A4Y1C9m6k4y1z6h2K2E6S5X8Z1t2M4X5Z6r1/pictures/square_medium.jpeg
2798,carlosmilitante,c,28,2022-12-11 09:53:08.897343,name found,Carlos Militante,,62 followers,English,Joined in Oct 2021,"Originally haling from New Jersey, Carlos moved to Long Beach, California to ultimately hone in on his gift of creativity and musicianship. Through his journey of practicing mindfulness meditation, completing the MBSR and the Power of Awareness course, it only made sense that his spirituality grew deeper. And so his practice drew him to express his music through sound meditation.  Having been a musician for half his life, and knowing how to play a multitude of instruments, this transition came quite naturally. But this would not have been possible without the help of his mentors and teachers who guided him along the way. With an intuitive ear, Carlos seeks to create sound meditations that aid people coping with anxiety, depression, and grief. He also aids people with their sleep as well as their mindfulness practice....read more",https://users.insighttimer.com/pc4VQFNdQzP9EuTaq5TnRduAMB83/pictures/square_medium.jpeg
2799,callehunefalk,c,28,2022-12-11 09:53:15.288636,name found,Calle Hunefalk,"Vejle, Denmark",61 followers,Dansk,Joined in Jan 2020,"Meditation teacher and mindfulness coach based in Denmark. Teachings in Danish, English and Swedish.",https://users.insighttimer.com/s2S8M3P7A2H9X0S3a9k8V3e2h8s1p0D1S6C0v8F0P8p2g9L3C8s6r3a7e6A5Z1g8p5j5M9M7t2Q2E7G6K7X3V2h7t3P2Q3u9g1T1/pictures/square_medium.jpeg
