,teacher_id,alpha_index,batch_id,scrape_date,scrape_status,teacher_name,location,followers,languages,date_joined,about,image_url
7972,kylieanderson,k,80,2022-12-11 19:02:50.356538,name found,Kylie Anderson,"Melbourne, Australia",66 followers,English,Joined in Dec 2018,"Kylie Anderson is the founder of Be Your Radiant Self and is a reiki healer, holistic health coach, personal trainer, blogger and speaker. Her mission in life is to inspire and support women everywhere on their journey to coming back home to themselves and connecting back to themselves - physically, emotionally, spiritually and sexually. ...read more",https://users.insighttimer.com/m8y9x5j9B4K0a9B4t4c4x3Y3j6T8D4d7f8B7C6c5L7s6H1G5z9n4U4W7K4T7z6c0k8Q9H0a8u0K0b9U1X7F5w9n9H3L8Q0z7S2t6/pictures/square_medium.jpeg
7973,katnienartowicz,k,80,2022-12-11 19:03:14.081880,name found,Kat Nienartowicz,"Vancouver, BC, Canada",66 followers,English,Joined in Sep 2019,"Hello I'm Kat and I'm a mindfulness and inquiry coach. I guide you to moments of presence through mindfulness, and help you stay there by gently unraveling the stories and patterns that are holding you back to help you find freedom and enjoy life now. ...read more",https://users.insighttimer.com/R3X3z5Q2B0s1D8R5D4Y9U1V3y2v4m3N9S6z5v9W6J6Y7w3F2e5m2H6w4u8u8r2w8e2Q0u8B1B8h6t2N2N0s8r0n8L7e4m8e4L6k7/pictures/square_medium.jpeg
7974,kati,k,80,2022-12-11 19:03:37.575349,name found,Katherine I Mesa,"Taos, NM, USA",66 followers,English and Español,Joined in Mar 2022,"A Holistic Ayurvedic Practitioner & Transformational Speaker, Mentor & Coach.
For 11+ years she has facilitated many gatherings throughout the US, Cuba, Peru & Colombia. Providing tools of empowerment, elemental body awareness, ancestral healing, inner child healing, spiritual, emotional, mental, physical healing and life purpose embodiment....read more",https://users.insighttimer.com/k9W5z4c8w6B8G4s2M8g4E3c5u1J2Y2f7Q1h2g8X7L3f6X2P9H7X2z4S4Y7W0P2y9s8W1w1u6N5z5g0T6v0m9r5B3B8U9t4Q6M4S5/pictures/square_medium.jpeg
7975,kimarario,k,80,2022-12-11 19:03:45.041677,name found,Kimara Rio,"Balingen, Germany",67 followers,"BR. Português, English and Español",Joined in Feb 2022,"Kimara is a certified Tantra Hatha Yoga teacher and Holistic Health Coach. She is passionate about ceremonial cacao, and the power of ritual for self healing. She has traveled all over the world to attain further knowledge & training on metaphysical healing, holistic nutrition, breathwork, tantra + feminine embodiment, yoga, meditation and alternative healing....read more",https://users.insighttimer.com/gPF5pyV3OWf8065SXmZfjZILQ1b2/pictures/square_medium.jpeg
7976,kendracoupland,k,80,2022-12-11 19:03:53.276186,name found,Kendra Coupland,"Vancouver, BC, Canada",65 followers,English,Joined in Feb 2021,"Kendra Coupland is a sādhaka, meditation coach and multi-disciplinary artist living and working on unceded Coast Salish territory, the traditional lands of the Sḵwx̱wú7mesh, səl̓ílwətaɬ, kʷikʷəƛ̓əm, Xʷməθkʷəy̓əm and Stó:lō people.

After studying and practicing yoga for 7 years, in 2017 Kendra was initiated into the yogic tradition by Swami Vidyanand while studying Transformational Yoga in South India. Kendra is certified as a Yoga Grandmaster (500HR+) with Yoga Alliance International of India....read more",https://users.insighttimer.com/64GYcAYLMHQOP7sAG1LUwBteYiu2/pictures/square_medium.jpeg
7977,nidraworks,k,80,2022-12-11 19:04:01.923519,name found,Kate Rock,"Hove, UK",65 followers,English,Joined in Apr 2022,"Kate was introduced to Yoga Nidra when she trained as a yoga teacher in 2019. She loved it so much she went on to do specialist training, realising Nidra holds so much more than just reading aloud from a book. Yoga Nidra is a world within itself: its powerful yet effortless practice offers precious space to rest and restore, rebalance, recalibrate, and re-connect with ourselves in ways we have forgotten. With regular Nidra practice, we really do become AWAKE in ways we have been sleeping before....read more",https://users.insighttimer.com/jGeQNkxACpSHYvIwsf6rzMVJxiC2/pictures/square_medium.jpeg
7978,krjamo,k,80,2022-12-11 19:04:26.406571,name found,Kristina Rose Jamo,"Maine, USA",64 followers,English,Joined in Jan 2021,"Healing has always been Kristina's primary mission in life; from saving the worms on drying sidewalks as a child, to becoming a Doctor of Physical Therapy, a Yoga Instructor, and a Reiki Master as an adult.  Her mission has always been to guide those around her to discover their own capability to heal. Today, she uses her unique skillset to awaken the light within others, making the world a brighter place for all at the intersection of science and spirit....read more",https://users.insighttimer.com/a8K1c6L6q4s0y1L1w0p7T8t7n6w1m2M5b1m4R2p5X2D1A5c3C4a2A6U9n9w0E4f7r7q3e5S6F2r6S9s1k9P5R0x1G3c0U0T0v3R8/pictures/square_medium.jpeg
7979,hayward,k,80,2022-12-11 19:04:50.249066,name found,Kristy,"Sunshine Coast QLD, Australia",64 followers,English,Joined in Oct 2021,"Welcome to my healing page.
I have been teaching mindfulness meditation and Yoga for the last 6 years. 
I am deepening my understanding of the human body as a 3rd year social psychology and counselling student at university.
I bring to each video and recording a deep healing and awareness of the self. 
Please enjoy.
Big love x...read more",https://users.insighttimer.com/G2F0c8k4X7Y9f3G5n2D0F8g5g3G4Z0K6A3P7Q4L9L1p3p8D5g6T3A7v8P8z1h8X5S7W4R5G5B7E9M4q7X5S7u1A7F3C8Y4b4A1a6/pictures/square_medium.jpeg
7980,avaenidh,k,80,2022-12-11 19:04:57.832509,name found,Karina Maria Wohnig,"Darmstadt, Germany",64 followers,Deutsch,Joined in Nov 2019,"Karina Maria Wohnig ist Reiseleiterin in die inneren Welten, Wort-Magierin (Autorin) und Entspannungstrainerin (zertifiziert, seit 2014). Seit ihrer Kindheit reist sie durch ihr inneres Universum und meditiert mit Bäumen, Pflanzen und Steinen. Sie  ist eine Hüterin und Verteilerin des spirituellen, kosmischen Wissens. Gehe mit ihr auf eine meditative Reise in den Seelengarten......read more",https://users.insighttimer.com/V9U1Y7n4w1k0N7R0k3Q3d9k0u6a8m5j5t5D5y3S1m9B9H5p9P5g8M6e5H3E4G9Y2K6P7F5A4v5t4J4G7B7d0T1H0Y0H8F2x4D8r3/pictures/square_medium.jpeg
7981,healconnectthrive,k,80,2022-12-11 19:05:05.494367,name found,Kyle Haskins,"Auckland, New Zealand",64 followers,English,Joined in May 2020,"Heal Connect Thrive is both a purpose and a passion. Following a dream to heal the world, one trapped emotion, one human at a time.",https://users.insighttimer.com/d3r4v5d9D5p6f6K2G8b9k5r1J6E5B8y7r7V5U6d4b4S3z0r2X9X7V7g2E3h9j3p0U5y1U7D4b1y9k7y9E5M3h9F4T4j9T1e9Z1A7/pictures/square_medium.jpeg
7982,highlymeditated,k,80,2022-12-11 19:05:29.348820,name found,Kevin Rehberg,"San Diego, CA, USA",63 followers,English,Joined in Jan 2020,"Kevin is a breathwork facilitator, level 3 Reiki master, and abundance life coach.",https://users.insighttimer.com/d4L3q3b8U7w7t7Q9z6g4K1c5s9v3P4W1L3C5p5S7Y4R8a6D7c5M3T0R6G8j5V6V7S7f3Z2d4Y6V4b1D2T8H2H8F0f3h6c5K8S1s5/pictures/square_medium.jpeg
7983,kerrysky313,k,80,2022-12-11 19:05:39.690579,name found,Kerry Sky,"Санкт-Петербург, Russia",63 followers,Русский,Joined in Jan 2021,"Проводник в мир осознанности. 
Автор духовных практик, тренер по саморазвитию и личностному росту. 
Миссия каждого из нас - возможность открыть себя миру, почувствовать собственную внутреннюю энергию, реализовать скрытый потенциал и обрести гармонию с собой. ...read more",https://users.insighttimer.com/s7V6W5v6E2u3f9D9q0S6V1X4z4r1H2h6S5B9f0V9t7h4R0T3y3V8V6n4X6x2f3p4L8Y4s4k4E2m4B0s7Q8Q9H0L7t3d0v0M7L0v0/pictures/square_medium.jpeg
7984,shineonkacey,k,80,2022-12-11 19:06:04.196597,name found,Kacey,,62 followers,English,Joined in Dec 2021,"Kacey is a radio host on 100.7 WHUD in New York, reiki healer, life coach, women’s group and foundation leader who runs a food pantry, farmers market and thrift shop.  Shine On her Health & Happiness Podcast has been running 12 years with guests like Thomas Moore and Marianne Williamson.   What she knows for sure is that you are a miraculous being capable of amazing things. Let her remind you. Every day....read more",https://users.insighttimer.com/QIrIHNLQWoSjbVRfKIWBuf6LIby1/pictures/square_medium.jpeg
7985,katieschroederbeing,k,80,2022-12-11 19:06:12.537588,name found,Katie Schroeder,"Boston, MA, USA",61 followers,English,Joined in Jul 2021,"Welcome. I am a spiritual teacher, soul therapist, and offer mindful movement, yoga (flow and restore), meditation, yoga nidra, and practices to come home to the heart.
I have two masters degrees that taught me the science of the human experience and advanced yoga certification, reiki, and yoga nidra training. I practice what I teach and have a lifetime of experience with transformation.
My intention is to serve and honor sacred space for the mysteries and transformations of life. Change and uncertainty have been my life's calling personally and collectively. I have been initiated in the most powerful apprenticeship with birth and death and transformation throughout my whole entire life.
My offerings are an intimate passage created from a lifetime of experience and extensive education to feel into the depths of your heart and remember who you really are...body, mind, heart, soul...a whole being~ness of joy and sorrow, love and loss. Dare to love deeply with me as your Guide....read more",https://users.insighttimer.com/y6r9R0q9h8N5F0M1S2C2v7Q7J2a0D6k7R4E6Z4p3s8Q8n7A2T6F8G2W8f0U0T3a2N8g6t6H1D9e4f7u4a2Z6V6z6z8V5X1f8T1U8/pictures/square_medium.jpeg
7986,kborn,k,80,2022-12-11 19:06:21.283616,name found,"Kaitlin Born, MSW","Winnipeg, Canada",61 followers,English,Joined in Jul 2020,"Kaitlin is a Clinical Social Worker from Winnipeg, Manitoba, Canada. She specializes in trauma and addictions, and is trained in a number of treatment modalities including DBT and ACT, where mindfulness practices are especially important. ...read more",https://users.insighttimer.com/z0e4A1x6e6b1N9g0n2S2X1P7D3Z9b1C0j2V2B5h8g0a2W0J4q3B6K3m0M2V7e3b8q6N7F8n9L9u1C3k3Y7c3p6e0G3Q5u1G3f6P9/pictures/square_medium.jpeg
7987,katemckenzie,k,80,2022-12-11 19:06:29.865087,name found,Kate Mckenzie,london uk,60 followers,English,Joined in Sep 2016,"I’m inspired to explore all aspects of well being through the map of the chakras (described as swirling vortexes of energy where the physical, emotional, mental and spiritual elements of our being meet).
I love this structure, and I love to play with the specific sounds and mantras that activate the qualities of each chakra. The sequence called ‘Love’ is the audio file from my DVD ‘The Flow: exploring the Chakras ‘...read more",https://users.insighttimer.com/s3N8e5F5n1f0P5f2G6x2r9m3L6n7X9z4F4C0U2w1K0R2A4c6P0E6B5P9c1u2D3d4J6m3u1R4V9y3r4J4a8E7B8u4E8d4T3j3Y0v5/pictures/square_medium.jpeg
7988,sonhab,k,80,2022-12-11 19:06:37.094182,name found,Kristen Blue,"Phoenix, AZ, USA",60 followers,English,Joined in May 2020,"Certified Sound Meditation teacher and adaptogenic chocolate maker at Sonhab.com. Years of experience with meditation, cacao, consciousness, and sound. You have the power to heal yourself. Meditation is a powerful tool to bring self awareness, forgiveness, love, healing, and compassion to our daily lives....read more",https://users.insighttimer.com/x2K9X7J9H2H1k3F0q9S7Y2f0V7u0D0d2L6q4n6g7U1C1a3V4t5b4G9Q7Q3A3q6b7a4t7E8T2U6g1p8Q0V1M5R5f5d6y2X8U9E4H4/pictures/square_medium.jpeg
7989,lionsheartwellness,k,80,2022-12-11 19:06:46.256724,name found,Kim Peirano,"San Rafael, CA, USA",60 followers,English,Joined in Mar 2021,"Dr. Kim Peirano, DACM, LAc is an Acupuncturist in San Rafael, CA, she is a published author, speaker, meditation teacher and intuitive healer. Dr. Kim’s offerings aim to access the deep inner workings of the mind-body-spirit connection to help her patients unlock the root cause of disharmony.  Dr. Kim uses acupuncture and meditation as tools to help her patients experience a deeper level and layer of their most authentic self - free of pain, stress, tension and full of confidence and vitality....read more",https://users.insighttimer.com/EEiz28NPKZPBXsk8WeMsHye1uA03/pictures/square_medium.jpeg
7990,karenwade,k,80,2022-12-11 19:06:54.567017,name found,Karen Wade,"Lake Conjola, Australia",59 followers,English,Joined in Jan 2019,"I experienced myself as magnificent, pure loving light that was so vast it filled my entire awareness. I was not my body, thoughts or emotions the ONLY thing that existed was  Pure Grace! It changed my life forevermore!  In that moment  my will and Divine will became one as I surrendered to this truth within and intended that from this moment forward my every word my every thought and my every action would come from this magnificent love that I AM, thus creating my Heaven on Earth.





 
...read more",https://users.insighttimer.com/h2e2Q1G1t6w3p8T0N5t2W7U5f5E9c6a2j2B3J7K1D0Q5u6G7m7W7N2Q3d0U1G0T4N6p1k8N4F4U3R4a0b8h1N7j2r8C3d8N7f6D8/pictures/square_medium.jpeg
7991,kerrywhite,k,80,2022-12-11 19:07:03.878483,name found,Kerry White,"Umhlanga, South Africa",58 followers,English,Joined in May 2021,"As a Yin Yoga Teacher and Shamanic Energy Healer, Kerry inspires us to come home to ourselves and find freedom in the movement of life.",https://users.insighttimer.com/edBSh6mskUUnpcqqK21XFRH4lGB2/pictures/square_medium.jpeg
7992,kamifasan,k,80,2022-12-11 19:07:12.525247,name found,Kami Fasan,"North Vancouver, BC, Canada",58 followers,English,Joined in Nov 2020,"Yin Yoga and Meditation teacher specializing in chronic stress, anxiety and depression. Offering accessible practices that anyone can do regardless of experience or level - peace comes one breath at a time. Kami has over 600 hours of training, ranging from kids to adults (Hatha Yoga, Yin Yoga, Trauma Informed Yoga and Kirtan)....read more",https://users.insighttimer.com/Z7A9U5R2h0E8U1q2K7x7q4p0V3z6L5E0T6G1M4E0D3g3N8p5k9d4u3b2c6L1P7q4a6W6m9H1u6D8m0y7e9B3v4V2E7Z3R1X8k8t0/pictures/square_medium.jpeg
7993,kirstysaunders,k,80,2022-12-11 19:07:25.949351,name found,Kirsty Saunders,"Melbourne, Australia",58 followers,English,Joined in Sep 2020,"Kirsty Saunders is a yoga teacher, meditation & energy guide with over 10 years experience. She supports adults and children to enhance their wellbeing and to feel connected to themselves and their own inner wisdom through movement, breath, healing remedies, activations and supported self-enquiry. 

I am a woman and a mother.
I am a communicator, connector, and guide.
I am an intuitive and empath.
I offer to hold you in heart energy....read more",https://users.insighttimer.com/r1x1NzhvpIhwEZ4S9sLMVojUwdA3/pictures/square_medium.jpeg
7994,kristinemcglinchey,k,80,2022-12-11 19:07:41.123905,name found,Kristine McGlinchey-Yap,,58 followers,English,Joined in Apr 2021,"Kristine McGlinchey-Yap is an author, conscious communicator and intuitive guide. She provides women with guidance to trust themselves in business and in motherhood so that they can lead purposeful lives.",https://users.insighttimer.com/d6Sg293rkwRqrBDMHe89gg1AmGu2/pictures/square_medium.jpeg
7995,kellyfreebird,k,80,2022-12-11 19:08:05.656482,name found,Kelly Turgeon,"Denver, CO, USA",57 followers,English,Joined in Apr 2022,"Kelly is co-founder of Soul Tribe Sisters and creator of the Soul Path Accelerator - a powerful group coaching container built for aspiring entrepreneurs and soulful service providers looking to channel their passion, gifts and talents into a clearly defined offering that cultivates fulfillment, prosperity and impact.

Over the last 6 years, Kelly has immersed herself in the studies of yoga, meditation, pranayama, and the power of the mind while traveling the globe. 

Kelly was part of the core team of what has grown to be one of the largest breathwork organizations worldwide; SOMA Breath.   She shares a transformative system to help awaken people to their true potential while releasing the limiting beliefs that keep them stuff in their current circumstance.   

Kelly is passionate about helping others to free themselves of anything holding them back and step fully into living an inspired, connected and fulfilling life....read more",https://users.insighttimer.com/Z0YeEpcU8aZUPXErQf5TROsMweB2/pictures/square_medium.jpeg
7996,lifeataltitude,k,80,2022-12-11 19:08:14.618192,name found,Kyle Mercer,,56 followers,English,Joined in Jul 2018,"The purpose of Life at Altitude is to help you live your life at a higher level of consciousness. Are you tired of going through the motions of everyday life? With Life at Altitude, a program dedicated to helping others live more fulfilling lives, you will start loving life again! Our sole goal is to help you learn, love, laugh, and find beauty in everything. By living at a higher level of consciousness, you will be able to accomplish all of this, and much, much more.
...read more",https://users.insighttimer.com/R2Z3e0Y9z5F7B4R3b5v6u5G2F3b1K7D7t8s4T4v8z5P5k8a4n5p6p3m6q9M7X9f4p6a5M2v1q0M0v5j0a3W2u4z5n6t3Z2g3v1h1/pictures/square_medium.jpeg
7997,kohavahoward,k,80,2022-12-11 19:08:35.655856,name found,Kohava Howard,"Buffalo, NY, USA",56 followers,English,Joined in Oct 2017,"Welcome to  Kohava’s sacred space, certified Jungian & leadership mindset life coach, holistic nurse practitioner, and therapeutic movement specialist. mentoring holistic visionaries, introverted lightworkers, and highly sensitive coaches to rise above their limitations, Find their archetypes to create a strategic journey, Brainstorming and map their vision in life and business to achieve success, so their can courageously show up as a leader to light up the world. ...read more",https://users.insighttimer.com/d3X0x5M5r3B2X3T6t5P7g5M3h1R1N2E1r1k4T9g3h0G6v4e7W9E2m6C3N2h7S0N2u8b9J6S4D4U1H3z7y5c4C4v3M1s8v7q8v3b2/pictures/square_medium.jpeg
7998,programy_terapeutyczne,k,80,2022-12-11 19:08:44.437769,name found,Kalina Feith,"Fredrikstad, Norway",56 followers,Polski,Joined in Jun 2019,"Jestem psycholożką i terapeutką, żyjącą w krainie fiordów i trolli. Wierzę i wiem, że wiedza i świadomość, to podstawa, na której możemy budować. Właśnie dlatego moje ulubione narzędzia w pracy, to psychoedukacja i uważność ",https://users.insighttimer.com/d7g5Z7k3e9P0S6J5z1G2B3c2n0r9U3M1t3x9v0t0K7S6N5t9g2V9u7b9p4W4f2A0b1B9U5R9C0k5B3x4A6C7k8n8A7t5F6j0k5q0/pictures/square_medium.jpeg
7999,karlyn,k,80,2022-12-11 19:09:09.063429,name found,Karlyn Fischer,,56 followers,English,Joined in Apr 2022,"Karlyn is a yoga instructor and a neural-optimization coach. She is passionate about functional health and neuroscience. Her mission is to inspire highly motivated individuals through her neuroplasticity and autonomic nervous system coaching program. These integrated tools are used to bring back longevity, so her clients can continue to focus on their passion. Her clients are looking to do whatever it takes to bring the intensity back into their lives.

Be the person you needed yesterday!...read more",https://users.insighttimer.com/xynespsMRleUod5drw9VprGENmG3/pictures/square_medium.jpeg
